,Product name,MRP,Discount,Tag,PerUnitPrice
305, Organic Tattva Chakki Wheat Flour 5 kg , 375.00 ,249.00,None,( 49.80/1 kg)
306, Nutri Binge 600g Premium California Almonds (200g x 3) , 810.00 ,499.00,None,None
307, Daawat Super Basmati Rice 5 kg ," 1,095.00 ",719.00,None,None
308, Daawat Sehat Mini Mogra 60 Basmati Rice 10 kg , 650.00 ,529.00,None,( 52.90/1 kg)
309, The Oil Factory 1L Extra Light Olive Oil , 850.00 ,380.00,None,( 380.00/1 l)
310, Sunpure Refined Sunflower Oil 15 L ,"1,950.00","1,950.00",None,( 130.00/1 l)
311, Lali Balaji Walnut kernel (Akhort Giri) 1000g (250g pack of 4) ," 2,140.00 ",893.00,None,None
312, Dynamix Cow Ghee 1 L (Pouch) , 719.00 ,605.00,None,None
313, Natureland Organics Brown Sugar 1 kg combo - Pack of 2 , 314.00 ,266.00,None,None
314, Mirchillion 1Kg Guntur Red Chilli Powder , 399.00 ,319.00,None,( 319.00/1 kg)
315, Good Life Chilka Moong Dal 500 g , 93.00 ,69.00,None,None
316, Daawat Pulav Basmati Rice 1 kg , 165.00 ,129.00,None,None
317, Daily Herbs Dried Premium Dry Anjeer 500g | Fig | Gluten Free & Sodium Free ," 1,199.00 ",349.00,None,None
318," Foodcan Walnut InShell-1 Kg Dry Fruits American Akhrot with shell, 1Kg "," 1,500.00 ",499.00,None,None
319, Good Life Washed Gota Urad 500 g , 100.00 ,81.00,None,None
320, Tata Sampann White Thin Poha 500 g , 57.00 ,51.00,None,None
321, Nesa Broken Raw Cashew -1Kg ," 1,600.00 ",629.00,None,None
322," Future life Oats Atta | Whole Grains Oats | With Targeted Minerals of Zinc, Chromium, and Magnesium | Gluten-free | High Fiber and Protein | 100% Healthy & Natural | 1kg Pouch ", 220.00 ,189.00,None,None
323," Farmley Whole Cashews, W400 Raw Kaju (Pack of 2, Each 500g) "," 1,498.00 ",849.00,None,None
324," Khari Foods Pure Afghani Saffron / Kesar Threads A+++ Grade / Kumkuma Puvvu / Kungumapoo Original, For Milk, Pregnant Women, Skin (1g) ", 499.00 ,325.00,None,None
325, Desi Kitchen Ginger Garlic Paste 200 g , 58.00 ,29.00,None,( 14.50/100 g)
326," Aeroplane Rozana Premium Basmati Rice Perfectly Aged Long Grain with Rich Aroma Basmati Rice, 5 Kg ", 625.00 ,449.00,None,None
327, Baby Saffron 1g Pack | Premium Kesar | Blister Pack | 100% Pure Mongra Saffron/Kesar , 340.00 ,299.00,None,None
328, Aashirvaad Select Sharbati Whole Wheat Atta 1 kg , 68.00 ,59.00,None,None
329, GKD's Premium 100% Pure Coconut Oil 500 ML (Pack of 2) , 400.00 ,310.00,None,None
330, Good Life Whole Urad 500 g , 91.00 ,73.00,None,None
331, Oreal 5L Premium Kachi Ghani Pure Mustard Oil | Chemical Free | Pure Sarso Cooking Oil -5 Litres ," 1,350.00 ",855.00,None,( 171.00/1 l)
332, Pansari Rozana Basmati Rice 10 Kg | Royal Taste | Premium Pulao Rice , 900.00 ,799.00,None,None
333, Tata Sampann Garam Masala 100 g , 104.00 ,52.00,None,( 52.00/100 g)
334, Eatyumm Afghani Anjeer 1 kg Figs - Afghanistan Dry Anjir (Dried Figs) 1kg Jar Pack| Premium Quality , 899.00 ,529.00,None,None
335, Snacklorry 1 Kg Walnut Without Shell Quarter Kernels | Kashmiri Quarter Akhrot Giri | Walnut Kernels 1000 Grams| Vaccum Packed | Pack Of 4 x 250 Grams| Without Shell 1 Kg Akhrot Giri ," 1,999.00 ",687.00,None,None
336, Good Life Cloves 50 g , 110.00 ,99.00,None,None
337," Yogabar Cashews 1kg W320 (500g Value Pack of 2)| 100% Natural & Premium Whole Organic Cashew Nuts| King Size Crunchy Kaju Nuts| Premium Nuts & Dry Fruits| Rich in Fibre, Vitamin E, K, B6 & Boosts Immunity| Healthy Snacks "," 1,200.00 ",799.00,None,None
338, Good Life (S) Fennel 100 g , 85.00 ,76.00,None,( 38.00/50 g)
339, Good Life White Till 500 g , 190.00 ,158.00,None,( 15.80/50 g)
340, Good Life Popcorn Maize 500 g , 95.00 ,69.00,None,None
341, Dalda Kachi Ghani Mustard Oil 1 L (Bottle) , 165.00 ,130.00,None,None
342," Aryionuts Pistachios/Pista Dry Fruits & Nuts | Rich in Vitamin & Minerals For Healthy,250g Incomplete ", 899.00 ,536.00,None,None
343, Rice Villa | Divine | 26 kg | Parboiled Rice | Silky Chap ," 1,690.00 ","1,532.00",None,( 58.92/1 kg)
344, Good Life Fine Besan 500 g , 60.00 ,44.00,None,None
345, Lali Balaji Gold Makhana 100 g (Pack Of 4) , 560.00 ,369.00,None,None
346, Vijaya Ghee 1 L (Pouch) , 690.00 ,629.00,None,None
347, Daawat Devaaya Basmati Rice 1 kg , 145.00 ,109.00,None,None
348, Eassy Dairy 1 Liter Desi Ghee | Pure Ghee for Better Digestion | Immunity Booster| Tetra Pack , 620.00 ,449.00,None,None
349, Snacklorry 1 Kg Premium Walnut Quarter Kernels | Akhrot Giri 1000 Grams | Lowest Price | 4pkts X250g ," 2,999.00 ",676.00,None,None
350, EATYUMM Seeded Dates ( Pin Khajoor) -[ Premium Quality] [ Hygienically Vaccum Packed] , 499.00 ,189.00,None,None
351," Living Tree Cashews 500 gram (500g Value Pack of 1)| 100% Natural & Premium Whole Organic Cashew Nuts| King Size Crunchy Kaju Nuts| Premium Nuts & Dry Fruits| Rich in Fibre, Vitamin E, K, B6 & Boosts Immunity| Healthy Snacks ", 798.00 ,399.00,None,None
352, Catch Kitchen King Masala 100 g , 88.00 ,44.00,None,( 44.00/100 g)
353, Good Life Superfine Thin Poha / Aval 1 kg , 75.00 ,71.00,None,None
354, Natrixeed Premium Quality Anjeer 1kg - Naturally Dried Figs| Perfect for a Healthy Lifestyle ," 1,499.00 ",538.00,None,None
355, Savastha Natural Jaggery | Vellam | Natural Chemical Free | Whole Round Shape Gur Jaggery-1 Kg , 225.00 ,214.00,None,None
356, Good Life Wada Kolam Rice 1 kg , 105.00 ,71.00,None,None
357, Catch Super Garam Masala 200 g , 98.00 ,49.00,None,( 24.50/100 g)
358, DAIRYSAGAR DAIRY MAKHAN Pure Desi COW Ghee ||Pure Ghee for Better Digestion and Immunity-1 ltr TetraPack , 680.00 ,398.00,None,None
359, Pick N Cook Premium Surti Kolam Rice 10 kg , 800.00 ,595.00,None,( 59.50/1 kg)
360, Tata Sampann Unpolished Urad Dal 500 g , 113.00 ,105.00,None,None
361," Wonderland Foods -Healthy Roasted Seeds Combo Pack of 4 - Chia 200g, Pumpkin 200g, Sunflower 200g and Flax 200g "," 1,015.00 ",394.00,None,None
362, Good Life Rice Atta / Flour 1 kg , 86.00 ,39.00,None,None
363, Good Life Dosa Rice 1 kg , 65.00 ,57.00,None,None
364, Khari Foods 500g California Almonds | Badam Dry Fruits | Healthy Snacks , 699.00 ,339.00,None,None
365," Shrego Jumbo Raw Peanut, Desi Singdana, Red Peanuts, 350G (1x350G Vacuum Packed) ", 160.00 ,159.00,None,None
366, Daawat Pulav Basmati Rice 500 g , 85.00 ,65.00,None,None
367, Daily Nut California Roasted & Salted Pista (Pistachios) 1000gm (250gm x pack of 4) ," 1,860.00 ","1,034.00",None,None
368, Nutrela Mini Soya Wadi / Chunks 200 g , 60.00 ,54.00,None,None
369, Catch Red Chilli Powder 100 g , 67.00 ,44.00,None,None
370, Kohinoor Charminar Select Basmati Rice 1 kg , 135.00 ,99.00,None,None
371, Lali Balaji DAILY NUT California Almond VALUE 500gm (250gm x pack of 2) , 620.00 ,377.00,None,None
372, Goshudh Best Quality Peanut -1Kg (Pack Of 1) Moongfali (1000 g) , 599.00 ,290.00,None,None
373," NUTRIMIXX Premium Californian Roasted & Salted Pistachios 1 Kg| Pista Dry Fruit, Super Crunchy "," 2,800.00 ","1,075.00",None,None
374, Daawat Sehat Mogra 70 Basmati Rice 10 kg , 800.00 ,625.00,None,( 62.50/1 kg)
375, P Mark Kachi Ghani Mustard Oil 1 L , 265.00 ,165.00,None,None
376, Everest Garam Masala 100 g , 98.00 ,91.00,None,( 91.00/100 g)
377, Good Life In-Shell Walnuts 500 g , 349.00 ,299.00,None,None
378, Vandevi Bandhani No 1 Hing Powder 100 g , 160.00 ,80.00,None,None
379," 3P Kashmiri 1kg Walnut Kernels Walnuts Without Shell Brown Quarter, Bakery Akhrot Giri (250gm X 4) "," 1,800.00 ",640.00,None,None
380," Farmley Premium Natural Chia Seeds 400g, Pack of 2- Each 200g ", 398.00 ,249.00,None,None
381, Saffola Total Pro Heart Conscious Rice Bran Based Blended Oil 5 L ," 1,100.00 ",995.00,None,( 199.00/1 l)
382, Molsi's Sayer Dates 1Kg , 320.00 ,249.00,None,None
383, Good Life Black Raisins 100 g , 70.00 ,45.00,None,None
384, Kohinoor Charminar Select Basmati Rice 5 kg , 649.00 ,449.00,None,None
385, Dhara Filtered Groundnut Oil 15 L ," 3,570.00 ","3,099.00",None,( 206.60/1 l)
386, Catch Jeera Powder 100 g , 135.00 ,90.00,None,None
387, Zoff 500gTamarind & 200g Cumin Seeds| Combo Pack of 700g , 590.00 ,225.00,None,None
388, Varalakshmi Sabudana / Sago 500 g , 75.00 ,52.00,None,None
389, Pinkcity 2L Pure Sesame Oil | Til Oil | Gingelly Oil | Wood Pressed | 1Litre Bottle , 800.00 ,649.00,None,None
390, Emami Healthy & Tasty Refined Sunflower Oil 1 L , 190.00 ,109.00,None,None
391, Happilo 500g Almonds|100% Natural Californian Almonds (Value Pack) , 675.00 ,489.00,None,None
392, STAR 555 Sona Masoori Rice Pouch - 30 Kg | Naturally Aged Rice | Rice For Daily Cooking ," 2,000.00 ","1,949.00",None,( 64.97/1 kg)
393, Good Life Classic Kolam Rice 30 kg ," 2,000.00 ","1,639.00",None,( 546.33/10 kg)
394," Havoc Nuts Premium Unsalted Pistachio Kernels Without Shell, Sada Pista Dry Fruit, Shelled Nuts Super Crunchy & Delicious Healthy Snack | Vitamins & Minerals Rich | No Gluten (250 gram) ", 999.00 ,474.00,None,None
395, Catch Ginger Garlic Paste 200 g , 50.00 ,33.00,None,( 16.50/100 g)
396, Khari Foods 1kg Zahidi Dates | Khajur / Khajoor Dry Fruits | Energy Booster | High Fibre | Soft & Juicy Healthy Snacks , 599.00 ,270.00,None,None
397, India Gate Dubar Basmati Rice 5 kg+ 1 kg , 790.00 ,769.00,None,None
398, Pansari Super Saver Grocery Combo Package - 7 in 1 ,"1,073.00","1,073.00",None,None
399," Parityaag Commonly Searched Topics: dal, dal toor, toor dal, dal yellow, dals & pulses, dal pulses 1kg ", 398.00 ,328.00,None,None
400, Catch Kashmiri Mirch Powder 100 g , 125.00 ,83.00,None,None
401, Sagar Pure Ghee 500 ml (Pouch) , 320.00 ,313.00,None,None
402, The Oil Factory 5.25L Extra Light Olive Oil | Ideal for All Indian Cooking | Imported from Spain ," 4,900.00 ","1,700.00",None,( 323.81/1 l)
403, Foodcan Chilgoza Neja Dry Fruits Lebanon Pine Nuts With Shell 50g , 800.00 ,349.00,None,None
404, LG Compounded Hing Powder 50 g , 92.00 ,85.00,None,None
405, Catch Chatpata Chat Masala 100 g , 79.00 ,39.00,None,( 39.00/100 g)
406," Aeroplane Everyday Biryani Basmati Rice, 25 Kg "," 3,325.00 ","1,999.00",None,( 79.96/1 kg)
407, Everest Kitchen King Masala 100 g , 88.00 ,81.00,None,( 81.00/100 g)
408," Organic Sapphire Foods 1kg Premium ( VIP) Brown Dates, Original Brown Dates, Dried Dates |Rich in Iron | Healthy Food | Saudi Arabian Dates Organic Sapphire Foods 1 kg Arabic Dates ", 599.00 ,245.00,None,None
409, Simla Premium 5 Liter Danedar Cow Ghee | Pure Cow Ghee | 5 Liter ," 3,750.00 ","2,099.00",None,None
410, Ziofit Popular Whole Cashews 500g , 549.00 ,469.00,None,None
411, Good Life Sharmili Rajma 500 g , 86.00 ,76.00,None,None
412, Lali Balaji DAILY NUT California Almond VALUE 750gm (250gm x pack of 3) , 930.00 ,515.00,None,None
413, Catch Garam Masala 100 g , 100.00 ,50.00,None,( 50.00/100 g)
414, Parmatma | Kachi Ghani Pure Mustard Oil | Good for Heart | Cholesterol Free | Fortified with vitamin D | Delicious food | Ideal for cooking food 2 litre , 380.00 ,330.00,None,None
415, Barik Rawa 500 g , 43.00 ,25.00,None,None
416, Good Life Unpolished Whole Moong 1 kg , 213.00 ,153.00,None,None
417," Pure Pik Dry Red Chilli Whole, Hand Picked, Red Chilli Whole, Dry Red Chilli Whole, Dried Red Chilli, 100 G ", 249.00 ,185.00,None,None
418, Kohinoor Charminar Brown Rice 1 kg , 119.00 ,79.00,None,None
419, Catch Sabzi Masala 100 g , 70.00 ,35.00,None,( 35.00/100 g)
420, Raams' Fox Nuts (Phool Makhana) 1Kg | Makhana Healthy Snacks | Lotus Seeds and Fox Nuts | Diet Food | Gluten Free | Organic Indian Food | Rich In Nutrients (Makhana 250gm Pack Of 4) ," 1,196.00 ",749.00,None,None
421, 921 REHAAN CLASSIC BIRYANI SPECIAL 5KG BASMATI RICE , 850.00 ,649.00,None,( 129.80/1 kg)
422, Amogha Premium Toor/Arhar/Tur Dal , 215.00 ,210.00,None,None
423, Tulsi Premium Indian Kishmish 500 g , 305.00 ,135.00,None,None
424, Jivo Cold Pressed Kachi Ghani Pure Mustard Oil 5 Litre ," 1,250.00 ",799.00,None,None
425, Catch Amchur Powder 100 g , 95.00 ,63.00,None,None
426, Kesari Amazing Saffron 250 mg , 119.00 ,59.00,None,( 11800.00/50 g)
427," Pyramid Traders 1 KG Kashmiri Mamra Almond in Shell, Sabut soft (Kagzi) "," 1,500.00 ",515.00,None,None
428, Catch Turmeric Powder 200 g , 72.00 ,48.00,None,None
429, Good Life Unpolished White Gota Urad 1 kg , 219.00 ,167.00,None,None
430, Kriti Refined Soybean Oil - 5L Square Jar (Pack of 1) , 709.00 ,699.00,None,( 139.80/1 l)
431, Super Dairy Punjab Rich Desi Danedar Ghee 1 Kg (Carton) , 999.00 ,435.00,None,None
432, The Nature Krafts Anjeer [Dried Figs] - 500gm Big Size Anjeer Afghanistan Anjir , 899.00 ,289.00,None,( 289.00/500 g)
433, Good Life Chilka Urad Dal 1 kg , 182.00 ,151.00,None,None
434, Eatyumm Cumin Seeds (Jeera) 1kg|Kitchen Spice|Organic Farm Jeera Cumin Seeds jeera ," 1,499.00 ",799.00,None,None
435," Jivo Canola Cold Press Oil, 5 Ltr Healthiest Cooking Oil (Pack of 1) "," 1,650.00 ","1,349.00",None,None
436, Pick N Cook Wada Kolam Rice 10 kg , 850.00 ,655.00,None,( 65.50/1 kg)
437, SHREE KALPADRUMA ghee Natural A2 Desi Cow Ghee 1000ML|Pure Cow Ghee for Better Digestion and Immunity|100% natural and premium quality , 799.00 ,599.00,None,None
438, DILJEET SPICES Cumin Whole/Jeera /Cumin Seeds/Zeera/Caraway(200gms) , 309.00 ,240.00,None,None
439, RICE VILLA PURE| GOBINDO BHOG RICE JEERA KASALA 10 KG| ," 1,570.00 ","1,019.00",None,( 101.90/1 kg)
440, Good Life Bay Leaf 25 g , 25.00 ,15.00,None,None
441, Mangalam 15 liter Ground nut oil | 100% pure | ," 3,500.00 ","2,800.00",None,None
442, Oleev Active Blended Edible Vegetable Oil 5 L ," 1,395.00 ","1,295.00",None,( 259.00/1 l)
443, Good Life Fard Dates 500 g , 225.00 ,165.00,None,None
444, Good Life (W240) Cashews 100 g , 138.00 ,90.00,None,None
445, SURYA 500gm GREEN CARDAMOM (HARI ELAICHI) WHOLE |ELAKULU ," 1,500.00 ","1,099.00",None,None
446, Leonardo Pomace Olive Oil 5 L ," 4,099.00 ","3,199.00",None,( 639.80/1 l)
447, Dulhan Classic 5 kg XXXL Biryani basmati rice (Extra long rice/chawal) , 799.00 ,599.00,None,( 119.80/1 kg)
448, Aeroplane Shudh Chakki Atta| 15 Kg(5 Kg*3 nos) , 675.00 ,639.00,None,( 42.60/1 kg)
449, BLK Foods Select 1.0Kg Jumbo Super Crunchy Almonds Californian ," 2,250.00 ",897.00,None,None
450, Tata SuperLite Salt 1 kg , 65.00 ,59.00,None,None
451," Chastity Dry Fruits Gift Pack of Cashew, Almond, Walnuts 350 gm "," 1,299.00 ",379.00,None,None
452," Horaira Nutz 1kg Walnuts Natural Sona White Fresh Walnuts , Akhrot Giri 1kg (4x250g) "," 2,599.00 ",749.00,None,None
453, Good Life Matta Vadi Rice 10 kg , 900.00 ,749.00,None,( 74.90/1 kg)
454, Mr.Gold Refined Sunflower Oil Can 5L with Iron Dosa Tawa worth Rs.250 ," 1,625.00 ",899.00,None,None
455, Everest Chaat Masala 50 g , 44.00 ,40.00,None,None
456, Maggi Masala Ae Magic 120 g (Pack of 20) , 100.00 ,93.00,None,( 77.50/100 g)
457," The Oil Factory Extra Virgin Olive Oil, First Cold Pressed,(Imported from Spain) Olive Oil - (5.25 L) "," 6,300.00 ","1,910.00",None,( 363.81/1 l)
458, Sunny Soya Fit Refined Soyabean Oil 1 L (Pouch) , 155.00 ,109.00,None,None
459, Foodcan Figs 1 Kg Dry Fruits (Afghani Anjeer| Dried Figs| Medium Size) 1Kg ," 1,600.00 ",629.00,None,None
460, 921 CHOCO LABEL (DAILY BASMATI RICE) SUPER MOGRA 10KG , 900.00 ,549.00,None,( 54.90/1 kg)
461," ORGANIC BASKET Mix Dry Fruits Almonds,Cashews,Raisins,Pista And Black Raisins , 250 Gram Each (Pack of 6) ", 499.00 ,249.00,None,None
462, Good Life Ajwain 200 g , 100.00 ,90.00,None,( 22.50/50 g)
463, True Elements Chia Seeds 500 gm - Non-GMO| Rich in Omega -3 & Fibre| Healthy Snacks for Weight loss , 600.00 ,299.00,None,None
464, NAVJEEVAN TAMARIND | IMLI | CHINCH SEEDLESS 1kg (500g X 2) , 340.00 ,249.00,None,( 124.50/500 g)
465, The Oil Factory 2L Pomace Olive Oil - 1L Pack of 2 ," 1,500.00 ",649.00,None,( 324.50/1 l)
466, Good Life Jeerasar Rice 10 kg , 700.00 ,539.00,None,( 53.90/1 kg)
467, Paras Nandan Cow Ghee 1 L (Pouch) , 675.00 ,555.00,None,None
468, SIMAV NATURALLY GOOD COLD PRESSED Groundnut Oil | COLD PRESSED Mungfali Ka Tel | COLD PRESSED Peanut Oil- 5Liter . ," 2,550.00 ","1,249.00",None,None
469, Good Life Mixed Dry Fruits 200 g , 150.00 ,135.00,None,None
470, Kinsfolk 2 L Groundnut Oil (1 L pack of 2) ," 1,100.00 ",439.00,None,( 219.50/1 l)
471, Parth Jaggery Powder 500 g , 90.00 ,59.00,None,None
472, NEXTSTEP ORGANIC Premium Green Cardamom Whole | Hari Elaichi Sabut 25g , 550.00 ,199.00,None,None
473, Suhana Simla Premium 1 Liter Danedar Cow Ghee | Pure Cow Ghee (PACK OF 6) ," 4,650.00 ","2,349.00",None,None
474, Jivo Pomace Cooking Olive Oil 5 Litre Tin Healthy Cooking Oil (Pack of 1) ," 4,999.00 ","2,200.00",None,None
475, BLK Foods Select 1KG Mamra Almonds Big | Original Iranian 1000g (5 X 200g) ," 6,000.00 ","2,146.00",None,None
476, NAVJEEVAN JEERA WHOLE 1kg. ," 1,300.00 ",749.00,None,None
477, Value Pack Plain Cashews (4 pcs) 500 g , 450.00 ,339.00,None,None
478, Everest Pav Bhaji Masala 100 g , 88.00 ,74.00,None,( 74.00/100 g)
479, Jivo Cold-Pressed Canola Oil 5L + 1L ," 2,025.00 ","1,549.00",None,None
480, Good Life Tibar Basmati Rice 1 kg , 99.00 ,79.00,None,None
481, Marwar Spices - 1.5 Kg (Red Chilly Mirchi Powder+ Coriander (Dhania) + Turmeric (Haldi) Powder) Saver Pack , 635.00 ,329.00,None,( 21.93/100 g)
482, Healthy Land-Beyond Nutrition Premium Broken Cashew (1kg) ," 1,599.00 ",569.00,None,( 56.90/100 g)
483, Ching's Secret Chowmein Hakka Noodles Masala 20 g , 55.00 ,51.00,None,None
484, Devaaya Weight Watchers Brown Rice 1 kg , 110.00 ,89.00,None,None
485," The Nature Krafts Mix Dry Fruits 500gm [ Almonds, Cashews, Walnuts, Raisins and More ] Jar Pack ", 999.00 ,299.00,None,None
486, Double Horse Vadi Matta Rice 5 kg , 420.00 ,399.00,None,None
487, Snacklorry 1 Kg Walnut Without Shell Quarter Kernels | Kashmiri Quarter Akhrot Giri | Walnut Kernel ," 1,150.00 ",674.00,None,None
488, Varalakshmi Premium Sabudana / Sago 1 kg , 140.00 ,108.00,None,None
489, Good Life Premium Ponni Boiled Rice 1 kg , 85.00 ,73.00,None,None
490, Good Life MP Sharbatti Atta 1 kg , 52.00 ,45.00,None,None
491, Sunrich Refined Sunflower Oil 4.5 L , 835.00 ,519.00,None,( 103.80/1 l)
492, Catch Turmeric Powder 100 g , 37.00 ,24.00,None,None
493, Clever Stevia Sugar 500gm low calorie Diabetic friendly Sugar ( Pack of 2 ) , 320.00 ,318.00,None,None
494, Aashirvaad Coriander Powder 100 g , 45.00 ,30.00,None,None
495, Yogabar 500g Almonds | 100% Natural Premium California Almonds 500g | Premium High Quality Almonds| High in Fiber & Boost Immunity | Real Nuts | Whole Natural Badam , 575.00 ,449.00,None,None
496," Farmley Premium California Whole Dried Cranberries, Handpicked & Fresh 400 g ", 520.00 ,283.00,None,None
497, Lali Balaji Atul Anjeer 500gm (250gm x pack of 2) , 660.00 ,453.00,None,None
498, Good Life Premium Ponni Boiled Rice 10 kg , 800.00 ,699.00,None,( 69.90/1 kg)
499, Everest Hingraj Powder 50 g , 143.00 ,132.00,None,None
500, Desi Kitchen Foxtail Millet 500 g , 75.00 ,55.00,None,None
501, RRO Primio Gold Filtered Groundnut Oil 1 L , 255.00 ,183.00,None,None
502, Catch Hing 25 g , 74.00 ,49.00,None,None
503," Wonderland Foods -Healthy Nuts Dry Fruits Combo Pack of 8 Pistachios 100g, Almond 100g, Cashew 100g, Black & Golden Raisins 100g, Anjeer 100g, Walnut Kernel 100g, Dried Apricot 100g "," 1,300.00 ",671.00,None,None
504, SHAAN-E-SHAUKAT 1121 KINKI 26KG EXTRA LONG GRAIN BASMATI RICE. ," 2,000.00 ","1,249.00",None,( 48.04/1 kg)
505, GROCERY VILLA anjeer 1kg ," 1,199.00 ",549.00,None,None
506, 41 Foods Dry fruits combo pack of Cashews Almonds Raisins | Kismis Kaju Badam ( 250GM x 3) 750 GM ," 1,999.00 ",596.00,None,None
507, Nuts Vakil 1 kg Fard Dates | Fard Khajoor Dry Fruits | Fardh Dates , 999.00 ,549.00,None,None
508, Catch Coriander Powder 100 g , 40.00 ,26.00,None,None
509, Daawat Brown Basmati Rice 1 kg , 190.00 ,149.00,None,None
510," Nut Toppers Arabian Dates, 800 g (400g x 2) ", 500.00 ,236.00,None,None
511, Bharvi Dates With Seeds - 1kg - Premium Dates|Khajoor|Khajur|Cholesterol Free| Soft Dates| , 599.00 ,251.00,None,None
512, Good Life Miniket Rice 10 kg , 700.00 ,625.00,None,( 62.50/1 kg)
513, Borges Olive Oil for Indian Cooking 2L ," 2,600.00 ","2,085.00",None,None
514, 10X SHAKTI CHAKKI FRESH ATTA 10 Kg , 598.00 ,565.00,None,None
515, True Elements Chia Seeds 250g - Non-GMO| Rich in Omega -3 & Fibre| Healthy Snacks for Weight loss Pu , 350.00 ,189.00,None,None
516, Good Life Chironji 100 g , 195.00 ,165.00,None,None
517, Organic Tattva Raw Peanuts / Groundnuts 500 g , 165.00 ,129.00,None,None
518, Kinsfolk 1 L Extra Light Olive Oil - (Imported Oil from Spain) ," 1,399.00 ",344.00,None,None
519," Eatyumm Red Peanuts,2 kg Ground Fresh Nuts (Moongfali Sing Dana)Desi Singdana| Jumbo 2kg Pack ", 999.00 ,469.00,None,None
520, Priya Refined Sunflower Oil 15 L (Tin) ," 2,340.00 ","1,545.00",None,( 103.00/1 l)
521, Borges Extra Light Olive Oil 2 L ," 2,600.00 ","2,199.00",None,( 1099.50/1 l)
522, Everest Sambhar Masala 100 g , 78.00 ,72.00,None,( 72.00/100 g)
523, Daawat Devaaya Biryani Basmati Rice 1 kg , 250.00 ,135.00,None,None
524, India Gate Super Basmati Rice 1 kg , 230.00 ,219.00,None,None
525, KLF Coconad Coconut Oil 1 L , 300.00 ,245.00,None,None
526, OREE Premium Pure Natural Fresh Desi Jaggery Soft Block No Sugar Added Gud/ Jaggery Cube(100g) , 199.00 ,149.00,None,None
527," Wheatkart Kitchen Basket ( Atta,Maida,Sooji,Besan) "," 1,396.00 ",699.00,None,( 60.78/1 kg)
528, Pinkcity Wellness 5L Pure Sesame Oil | Til Oil | Gingelly Oil | Wood Pressed | 1 Litre Bottle ," 2,000.00 ","1,449.00",None,None
529," Farmbean Millets 5Kg Combo Pack of 10 | Foxtail, Kodo, Little, Barnyard, Browntop Millet| Low GI | Nutrient Powerhouse, High Protein & More Fibre than Rice "," 2,499.00 ","1,099.00",None,None
530, Clever Stevia Sugar 500gm caloriefree Diabetic friendly Sugar , 160.00 ,159.00,None,None
531, Good Life In-Shell Walnuts 1 kg , 699.00 ,599.00,None,None
532, Good Life Premium Ponni Raw Rice 1 kg , 85.00 ,57.00,None,None
533, Good Life Moth Bean 500 g , 73.00 ,65.00,None,None
534, Pick N Cook Brazil Big Chawli 500 g , 70.00 ,65.00,None,None
535, KEYA Oregano -10 g and Red Chilli Flakes -40 g Combo , 208.00 ,176.00,None,None
536, SHAAN-E-SHAUKAT 1121 MONGRA 30 KG BASMATI RICE - BEST MONGRA ," 2,800.00 ","1,699.00",None,( 56.63/1 kg)
537, Tata Sampann Meat Masala 100 g , 88.00 ,44.00,None,( 44.00/100 g)
538, Pyramid Traders 1 KG Broken Kashmiri Walnut Kernels ," 2,000.00 ",630.00,None,None
539, Good Life Gobindbhog Atap Rice 1 kg , 150.00 ,114.00,None,None
540, LG Compounded Hing 100 g , 182.00 ,169.00,None,None
541, GKD's Premium 100% Pure Coconut Oil Jar 1L , 380.00 ,299.00,None,None
542, Good Life Malka Masoor 500 g , 66.00 ,56.00,None,None
543," Pure Pik Byadgi Chilli Whole, Stemless, Red Chilli Whole, Dry Red Chilli, Lal Mirch Sabut, 100 G ", 299.00 ,209.00,None,None
544, Farmley Prasadam Makhana 200g , 240.00 ,225.00,None,None
545, Kohinoor Charminar Rozana Rice 1 kg , 118.00 ,75.00,None,None
546," Farmley Premium W240 Cashews, 100% Natural, Handpicked Kaju, 250 g ", 399.00 ,349.00,None,None
547, Pansari Kachi Ghani Mustard Oil 5L Jar | Pure Sarso Cooking Oil | Good for Bones & Heart | Improve functioning of Organs | Suitable for all Ages ," 1,230.00 ",839.00,None,None
548, Sundrop SuperLite Advanced Refined Sunflower Oil 1 L (Pouch) , 265.00 ,245.00,None,None
549," Farmley Premium Long Raisin (Kishmish) , Freshly Farm Picked, Healthy & Juicy 500 g ", 239.00 ,215.00,None,None
550, Sundrop Heart Blended Edible Vegetable Oil 3 L ,429.00,429.00,None,( 143.00/1 l)
551, Maharani Premium Mongra | Mungra | Tini Mongra Daily basmati rice 30 kg ," 1,680.00 ","1,599.00",None,( 53.30/1 kg)
552, Rice Villa YUVRAJ Sona Masuri (Sambha) Steam Rice 26kg ," 2,210.00 ","1,758.00",None,( 67.62/1 kg)
553, Coreganic 1kg 100% Natural International Popular Whole Cashews ," 1,599.00 ",719.00,None,None
554, Nutrela Soya Wadi 200 g , 60.00 ,54.00,None,None
555, VELEE Brand Dryfruits Combo Fruit & Nuts Diwali Gift Fancy Box Hamper P4 200 gram Almond Cashew Raisins Pistachio , 500.00 ,379.00,None,None
556, Shree Tulsi Pure Sesame Oil 1L| Til Oil| Wood Pressed|For Puja use | 1 Litre Bottle , 449.00 ,269.00,None,None
557, Pink Delight Unpolished Dry Arhar Dal | Toor Daal | Tur Dal | Sambhar Dal | 500 Gm , 280.00 ,225.00,None,None
558, Bansuri gold Pure Sesame Oil 1L| Til Oil| Wood Pressed|For Puja use | 1 Litre Bottle-1 , 449.00 ,279.00,None,None
559, Veganic Indian Sweet Dry Agra Petha | Famous Agra Sweets | Aagra Ka Pethha | Mithai/Meethai (400g) , 299.00 ,199.00,None,None
560, GIRIRAJ PRODUCTS PURE & NATURAL ANJEER 1KG [FIGS 1KG] ," 1,499.00 ",549.00,None,None
561, Everest Chicken Masala 100 g , 92.00 ,85.00,None,( 85.00/100 g)
562, Everest Shahi Biryani Masala 50 g , 83.00 ,77.00,None,( 154.00/100 g)
563, Kasturika Mini Mogra Steam Basmati 30 Kg Rice ," 1,860.00 ","1,359.00",None,( 45.30/1 kg)
564, NUTRIMIXX 100% Natural Premium Crunchy Cashews 1 Kg| Nuts Dry Fruit| Gluten Free ," 1,799.00 ",630.00,None,None
565, Appu Red Chilli Powder 1KG | Lal Mirchi Powder |Red Chilly Powder , 320.00 ,247.00,None,None
566, Good Life Saffron / Kesar 0.25 g , 110.00 ,55.00,None,None
567, Molimor Unrefined Ground nut oil/100% PURE/15 KG ," 3,800.00 ","3,750.00",None,( 237.34/1 kg)
568, BANIYA SETH Handpicked Lotus Seeds / Fox Nuts Big Size Phool Makhana (Pop / Gorgon Nut Puffed Kernels ) (100g) , 399.00 ,249.00,None,None
569, Freshtige Premium Dried Afghani Anjeer 1KG Pouch Pack| Dried Figs| Non-GMO Dried Figs ," 1,499.00 ",610.00,None,None
570, Eco Herbs Coconut Dried Copra 1 kg , 399.00 ,289.00,None,None
571, Good Life Fine Mustard 100 g , 25.00 ,17.00,None,( 8.50/50 g)
572, Pink Delight Seedless Tamarind| Sabut Imli| Bina Beej Imli | 1 Kg , 480.00 ,260.00,None,None
573, Molsi's 400g Dry Roasted and Salted Pistachios (200gX2) , 750.00 ,485.00,None,None
574," Living Tree Cashews 1000 gram (250g Value Pack of 4)| 100% Natural & Premium Whole Organic Cashew Nuts| King Size Crunchy Kaju Nuts| Premium Nuts & Dry Fruits| Rich in Fibre, Vitamin E, K, B6 & Boosts Immunity| Healthy Snacks "," 1,596.00 ",729.00,None,None
575, Desi Kitchen Kodo Millet 500 g , 75.00 ,55.00,None,None
576," Foodcan Natural Pista Pistachios (Roasted & Salted, in Shell- Super Quality Big Size) 500g "," 1,200.00 ",549.00,None,None
