,Product name,MRP,Discount,Tag,PerUnitPrice
577, RENTIO Oiled Toor Dal 2 kg | Premium Desi oiled Tur/Arhar Dal | 2 Packs of 1 kg each , 620.00 ,559.00,None,None
578, Trinetra Sugar 5 kg ," 1,999.00 ",540.00,None,None
579, Good Life Rozana Dubar Basmati Rice 1 kg , 89.00 ,75.00,None,None
580, Naturoz Daily Whole Cashews 500 g , 625.00 ,429.00,None,None
581, Jivo Gold Refined Oil Blend of Rice Bran oil & Sunflower oil 5 litre ," 1,049.00 ",749.00,None,None
582," Dry Mart Kashmiri Walnuts 1KG Without Shell/Premium Fresh Walnut Kernels/Akhrot Giri, Healthy & Delightful, Used for Snacking, Ingredient for Recipes, Cuisines & Desserts, Vaccum Pack (250GM*4) "," 1,200.00 ",649.00,None,None
583, HAYYAN Own Farm Chemical free Sun dried Half Cut Coconuts ( Copra) - 400 gm , 350.00 ,170.00,None,None
584, Daawat Sehat Mini Mogra 60 Basmati Rice 5 kg , 325.00 ,265.00,None,None
585," Angur Chana Dal | 100% Vegan, Unpolished and Gluten Free Dal - 5Kg ", 950.00 ,599.00,None,None
586, Nuts About You WALNUT Inshell 1 kg , 900.00 ,520.00,None,None
587, Catch Chat Masala Sprinklers 100 g , 85.00 ,76.00,None,( 76.00/100 g)
588, Pyramid Traders 1 KG Kashmiri Hard Shell Mamra Almond with shell ," 1,500.00 ",399.00,None,None
589," Yogabar Almonds 1 kg (500g Pack of 2)| 100% Premium California Dried Almonds |Badam Giri Nuts & Dry Fruits| Rich in Fiber, vitamin E, Magnesium, Calcium & Boost Immunity| Healthy Badami Snacks "," 1,150.00 ",799.00,None,None
590, KAUL's 100% Natural Premium 1Kg (500 gms Pack of 2) Whole Cashews| Nutritious & Delicious Big Size Kaju ," 1,999.00 ",699.00,None,None
591," Sangamam Rice, Sastha Sona Masoori Rice (26 Kg) , Broken Rice, Premium Sona Masoori Rice "," 1,799.00 ","1,479.00",None,( 56.88/1 kg)
592, Farmley Premium Pumpkin Seeds 200g , 229.00 ,189.00,None,None
593, Everest Chicken Masala 50 g , 47.00 ,43.00,None,( 86.00/100 g)
594, Saffola Tasty Pro Fitness Concious Corn Based Blended Edible Vegetable Oil 5 L , 805.00 ,649.00,None,( 129.80/1 l)
595," Vganic Peanuts/Moongfali Dana, Unpolished Peanuts Rich in Protein & Essential Nutrients, 250 gm ", 165.00 ,156.00,None,None
596, GKD's Premium 100% Pure Coconut Oil Jar 1L (Pack of 2) , 760.00 ,599.00,None,None
597, Kinsfolk 5.25 L Cold Pressed Groundnut Oil Plastic Bottle ," 1,999.00 ","1,333.00",None,( 253.90/1 l)
598, GKD's Premium 100% Pure Coconut Oil Pouch 1 L , 330.00 ,269.00,None,None
599, The Nature Krafts Jumbo Handpicked Lotus Seeds /Fox Nuts Big Size Phool Makhana 1kg (Pop / Gorgon Nut Puffed Kernels ) ," 1,599.00 ",999.00,None,None
600, Good Life Bajra 1 kg , 59.00 ,49.00,None,None
601, Tata Sampann Unpolished Whole Urad 500 g , 113.00 ,105.00,None,None
602," Mix Berry Dried without Sugar |Organic, 100% Natural, 0% Preservatives, Vegan, Sugar Free Imported Berries - 50g ", 399.00 ,199.00,None,None
603, SURYA 400gm RED CHILLI (LAL MIRCHI) WHOLE WITH STEM (Pack of 2; 200gm x 2) | Dried Whole Spices , 290.00 ,159.00,None,None
604, Farmley 200g Broken Walnuts Kernels Premium , 360.00 ,239.00,None,None
605, Ching's Secret Schezwan Fried Rice Masala 100 g (5 Sachets) , 60.00 ,49.00,None,( 49.00/100 g)
606, Fortune Biryani Special Basmati Rice 5 kg ," 1,050.00 ",789.00,None,None
607, Rishi Pure Kimia Dates Gold Premium Dried Dates 600gm , 699.00 ,329.00,None,None
608, Suhana Paneer Butter Masala Mix 50 g , 45.00 ,36.00,None,None
609, Tulsi California Inshell Walnuts 1 kg , 775.00 ,499.00,None,None
610, Khari Foods 1kg Almonds | California Badam Dry Fruit | Healthy Snacks ," 1,599.00 ",689.00,None,None
611, Nutraj W450 Cashew Nuts 800g (Pack of 2 x 400g) ," 1,198.00 ",669.00,None,( 83.63/100 g)
612, Good Life Big Brown Chana 1 kg , 185.00 ,145.00,None,None
613, Manna Multigrain Atta 6kg | Certified Low GI Atta | Multi Millet Atta | Wheat Flour with 25% Millets (5kg + 1kg) , 768.00 ,645.00,None,None
614, Daawat Biryani Basmati Rice 1 kg , 235.00 ,195.00,None,None
615, Catch Coriander Powder 500 g , 205.00 ,137.00,None,( 27.40/100 g)
616, Pink Delight Triple Refined Bura | Handmade | Sugar Powder | Kand | 500 Gm Pack , 200.00 ,149.00,None,None
617, Pink Delight Natural Organic Jaggery Cubes | Purest Jaggery | No Preservatives/Chemicals| 500 Gm Jar , 300.00 ,198.00,None,None
618, Ching's Secret Veg Manchurian Masala 20 g , 10.00 ,9.00,None,None
619, SURYA 200gm CINNAMON STICKS (DALCHINNI) | WHOLE SPICES| HERBS , 175.00 ,169.00,None,( 84.50/100 g)
620, Nature's Choice Royale Fard Dates 500 g , 250.00 ,165.00,None,None
621, SHREE KALPADRUMA ghee Natural A2 Desi Cow Ghee 5 LTR|Pure Cow Ghee for Better Digestion and Immunity|100% natural and premium quality ," 4,200.00 ","2,310.00",None,None
622, Kimia Dates | Original Kimia Dates | 500 Gm Each | Pack of 2 | 1 Kg , 550.00 ,480.00,None,None
623, The Oil Factory 5.25L Pomace Olive Oil | Ideal for All Indian Cooking | Imported from Spain ," 4,500.00 ","1,600.00",None,( 304.76/1 l)
624, Tata Sampann Turmeric Powder 100 g , 41.00 ,32.00,None,None
625, Kanaiya Murmura 500 g , 60.00 ,45.00,None,None
626, JD NUTS Dry Fig Afghani Anjeer Figs Afghanistan Dry Anjir Dried Anjeer Dry Fruits Pouch Pack 1 Kg ," 1,299.00 ",484.00,None,None
627," Dhampur Green 800g Organic Jaggery Powder | 100% Organic, 100% Pure & 100% Chemical Free | Jaggery Powder For Tea and Coffee , Milk, Mithai Sweets ", 199.00 ,197.00,None,( 246.25/1 kg)
628, PINK DELIGHT DAAL COMBO | ARHAR | CHANA | MOONG DHULI | MOONG CHILKA | URAD DHULI | 1 KG EACH ," 1,500.00 ","1,069.00",None,None
629, Organic Tattva Tur / Arhar Dal 1 kg , 295.00 ,232.00,None,None
630, Navjeevan No.1 Hing Powder 500g. , 700.00 ,420.00,None,None
631, Dr. Brand Sakariya / Prasad Sugar 150 g , 16.00 ,14.00,None,None
632, NUTRIMIXX Premium Kashmiri Mamra Almonds| 1 Kg | A+ grade Badam| High Protein & Vit E Content ," 2,899.00 ","1,300.00",None,None
633, Double Horse Palakkadan Matta Rice 5 kg , 380.00 ,365.00,None,None
634, Nutrela Soya Chunks / Wadi 1 kg , 210.00 ,149.00,None,None
635, Nutrela Soya Granules 200 g , 60.00 ,54.00,None,None
636, Dhara Nourish Vit A E Refined Sunflower Oil 15 L ," 2,480.00 ","1,799.00",None,( 119.93/1 l)
637, Nature's Bridge Seedless Black Raisins | Dried Kishmish Without Seeds | Raisins- 250 Gm Jar , 399.00 ,199.00,None,None
638, Kriti Refined Sunflower Oil - 5L Square Jar (Pack of 1) , 749.00 ,649.00,None,( 129.80/1 l)
639, Tata Sampann Chilli Powder 100 g , 73.00 ,58.00,None,None
640, Haldiram's Nagpur Fancy Dry Fruits Gift Box (WW) ,375.00,375.00,None,None
641, Tata Sampann Chicken Masala 100 g , 88.00 ,44.00,None,( 44.00/100 g)
642, Snapin Pizza Seasoning Combo 42 g , 60.00 ,49.00,None,( 11.67/10 g)
643, Long Live Extra Virgin Olive Oil (( Cold Pressed)) - 1 Ltr ," 1,100.00 ",449.00,None,( 449.00/1 l)
644, The Oil Factory Cold Pressed Organic Sesame Oil - 500 Ml , 360.00 ,180.00,None,( 360.00/1 l)
645, Marwar Combo Pack of | Pumpkin Seeds + Sunflower Seeds | 250 Gms Each | Pack of 2 , 800.00 ,299.00,None,None
646," RED ROSE DAILY BASMATI RICE, SUPER MONGRA, RICH AROMA, PERFECT FOR EVERYDAY USE, 10 KG ", 999.00 ,799.00,None,( 79.90/1 kg)
647, Catch Red Chilli Powder 500 g , 300.00 ,200.00,None,None
648," Farmley Premium California Roasted & Salted Pistachios 400g, Pack of 2 Each- 200g ", 738.00 ,549.00,None,None
649, Tata Sampann Turmeric Powder 200 g , 76.00 ,60.00,None,None
650, Ahaar Chana Brown 1Kg /Kala Chana whole ,236.00,236.00,None,None
651, HealthFields Organic Black Pepper Whole / Kali Mirch - 100 Gm ,140.00,140.00,None,None
652, Mirchillion 1Kg Kashmiri Chilli Powder Saver Pack , 799.00 ,629.00,None,( 629.00/1 kg)
653, Nature Fresh Sampoorna Chakki Whole Wheat Atta 5 kg , 240.00 ,215.00,None,( 43.00/1 kg)
654, Nature Aahar's Premium 1kg Anjeer - Delicious and Nutritious Dry Figs ," 1,999.00 ",499.00,None,( 249.50/500 g)
655," Blueberry Dried without Sugar |Organic, 100% Natural, 0% Preservatives, Vegan, Sugar Free Imported Berries ", 499.00 ,265.00,None,None
656, Pinkcity Wellness Cold Pressed Yellow Mustard Oil 4 L | Wood Pressed| 4x 1 Litre Bottle ," 1,600.00 ",799.00,None,None
657," Khari Foods Organic Pure Jaggery Powder 2kgs, Natural Sweetener, No Adulteration ", 799.00 ,349.00,None,None
658, India Gate Classic Basmati Rice 5 kg ," 1,170.00 ",899.00,None,None
659, Everest Sabji Masala 100 g , 72.00 ,66.00,None,( 66.00/100 g)
660, Horaira Nutz Raisins Almonds Cashews Pistachios Combo Pack 1kg(250gm Pack of 4) ," 1,999.00 ",859.00,None,None
661, Good Life Kalimunch Raw Rice 1 kg ,65.00,65.00,None,None
662," Dry Fruit Hub - Kesar Saffron Original 1gm | Daily Nuts kumkumapuvvu, A+ + Grade Kashmiri Kesar ", 449.00 ,320.00,None,None
663, FarmNuts-Seedless Green Raisins |kismis| |Dry Grapes| |kishmish| Significantly Lower Blood Pressure (100 gm) , 220.00 ,149.00,None,None
664, India Gate Weight Watchers Special Brown Rice 1 kg , 152.00 ,132.00,None,None
665, Brij gwala Wawa Desi Cow Ghee| Pure Cow Ghee for Better Digestion and Immunity| 1Ltr Tetra-1 , 580.00 ,399.00,None,None
666, FreshoCartz Dried Figs Premium Quality Afghani Anjir 1 kg ," 1,599.00 ",569.00,None,None
667, Sagar Pure Ghee 1 L (Tin) , 650.00 ,610.00,None,None
668, Everest Turmeric Powder 500 g , 180.00 ,153.00,None,None
669, ANMOL RICH 26 Kg Raw Sona Masoori Rice ," 1,999.00 ","1,699.00",None,( 65.35/1 kg)
670, La Casa Original Lacha Kashmiri Saffron Kesar 2 Gm (1gx2) , 999.00 ,349.00,None,None
671," RRAAMS Healthy Phool Makhana (Fox nuts/Lotus Seeds) , Total 750 gms (Pack of 3 x 250 gms) ", 897.00 ,499.00,None,None
672, Smith & Jones Pasta Masala 98 g , 70.00 ,55.00,None,( 56.12/100 g)
673, Kinsfolk 2 L Pure Coconut Oil (1L pack of 2) ," 1,500.00 ",439.00,None,( 219.50/1 l)
674, Tilsona Gold Til Oil 1 L , 415.00 ,375.00,None,None
675, Khari Foods 1kg Black Kimia Dates | Premium Dates | Healthy Snacks , 699.00 ,349.00,None,None
676, Wonderland Foods Dry Fruits California Almonds 1Kg & Raw Cashew (Kaju) 1Kg W320 Grade Combo Pack ," 3,400.00 ","1,625.00",None,None
677, Priya Kachi Ghani Mustard Oil 1 L , 189.00 ,129.00,None,None
678, Everest Tea Masala 50 g , 68.00 ,63.00,None,None
679," Mr.Gold Refined Sunflower Oil Can, 3L ", 870.00 ,500.00,None,None
680, Lali Balaji Atul Anjeer 1000gm (250gm x pack of 4) ," 1,320.00 ",833.00,None,None
681," Dhanush Baan Premium Afghani Black Raisins, Kali Kishmish 500 g - Jar (2 x 250 g) Kismis Dry Fruits ", 550.00 ,261.00,None,None
682, Catch Chicken Masala 100 g , 90.00 ,45.00,None,( 45.00/100 g)
683," Sri Sri Tattva Chana Dal - Split Bengal Gram, 1kg x Pack of 2 ", 250.00 ,212.00,None,None
684, Organic Tattva Ragi Millet Flour 500 g , 70.00 ,46.00,None,None
685," Farmley Dry Fruit Seed Mix 400g Chia seeds, Pumpkin seeds, Flax Seed & More Seed, Roasted seeds ", 399.00 ,249.00,None,None
686, Wonderland Foods Premium Munch The Healthy Crunch Value Pack Almonds 500 g , 725.00 ,349.00,None,None
687, Pick N Cook Matki 500 g , 85.00 ,79.00,None,None
688, Wondernut Heathy Testy Super Food (Mix nut and Seeds) 500gm Pack of 2 in 250gm , 899.00 ,345.00,None,None
689, RENTIO 5 Kg Oiled Toor Dal | Fresh Premium Desi Oily Tur/Arhar Dal ," 1,550.00 ","1,319.00",None,None
690, Ponkathir White Puttu Podi 1Kg x 2 Pkts(2 Kg) | Soft Puttu| Rice Powder| Export Quality (2Kg) ,244.00,244.00,None,None
691, Sundrop Lite Sunflower Refined Oil 1 L , 190.00 ,159.00,None,None
692," Sri Sri Tattva Toor Dal - Split Pigeon Pea, 1kg ", 230.00 ,195.00,None,None
693," Happilo Essentials Popular Whole Cashew W400 500g, Healthy Snack, Source of Protein ", 675.00 ,469.00,None,None
694, Bambino Red Chilli Powder Each 500 Gms X Pack of 2 (1kg) , 560.00 ,349.00,None,None
695, Nutraj Recipe Ready Walnut Kernels 500g (250g X 2) | Akhort Giri 500g | Walnut without Shell , 898.00 ,519.00,None,( 260.49/250 g)
696, Paaritosh Combo Pack of Kachi Ghani Mustard Oil- 1 Ltr and Cottonseed Oil- 2 Ltr | Natural and Chemical Free , 750.00 ,541.00,None,None
697, Good Life Arwa Katarni Rice 10 kg , 700.00 ,559.00,None,( 55.90/1 kg)
698, Everest Garam Masala 50 g , 52.00 ,48.00,None,( 96.00/100 g)
699, Nature Prime Premium Plain Unsalted Pistachio Kernels Without Shell 250G ," 1,000.00 ",329.00,None,None
700, Everest Turmeric Powder 200 g , 70.00 ,65.00,None,None
701, DS AGRO - Whole Raw Broken Cashews - 1 KG | 1/2 Pieces | 500 gm x 2 | Pack of 2 | Pet jar | W320 Grade ," 1,099.00 ",649.00,None,None
702, Parth Jaggery 450 g , 48.00 ,44.00,None,None
703, Nutraj Munakka Raisin (Abjosh) 400g (200g X 2) , 498.00 ,369.00,None,( 92.25/100 g)
704, Wonderland Foods Premium Roasted & Salted Pistachios 200 g , 390.00 ,209.00,None,None
705, Jivo Cold Pressed Canola Oil 1 L (Buy 1 & Get 1 free) , 650.00 ,469.00,None,None
706, Nutraj Gold Arabian Dates 500g (Pack of 2) , 398.00 ,319.00,None,None
707, SIMAV NATURALLY GOOD Groundnut Oil | Mungfali Ka Tel | Peanut Oil- 15Liter. ," 4,499.00 ","3,149.00",None,( 209.93/1 l)
708, Everest Chaat Masala 100 g , 85.00 ,79.00,None,( 79.00/100 g)
709, Being Vegan Premium Afghani Farm Dry Dates | Sukha Khajoor | kharak | Chuara Pack of 900 gm Yellow , 799.00 ,369.00,None,None
710, Catch Amchur Powder 50 g , 47.00 ,31.00,None,None
711," Freshtige Dried Premium Afghani Apricots (Khurbani)1000g(1Kgs) Pouch Pack | Vegan,Sun Dried Apricots ", 799.00 ,391.00,None,None
712, DAIRY GOPAL DAIRY MAKHAN 1 Litre Desi Cow Ghee|Immunity Booster and 100% Pure Cow Ghee|Made Traditionally from Curd |Pure Ghee for Better Digestion and Immunity Pure Ghee (Pack of 1) , 680.00 ,399.00,None,None
713, Organic Tattva Kabuli Chana 500 g , 175.00 ,117.00,None,None
714, Marwar Kashmiri Red chili Powder (Kashmiri Lal Mirch Powder) 400g , 500.00 ,299.00,None,None
715," Sri Sri Tattva Rock Salt - Premium Quality 2kg, 1kg x Pack of 2 ", 240.00 ,216.00,None,None
716, Emperor Seedless Dates 500 g , 280.00 ,199.00,None,None
717, Goldiee Kashmiri Mirch Powder 100 g , 116.00 ,58.00,None,None
718, Gemini Vanaspati 1 L , 150.00 ,118.00,None,None
719, Organic Tattva Suji 500 g , 60.00 ,43.00,None,None
720, EATYUMM Green Cardamom Powder 100 Grams| Ilaichi Powder| Elaichi Powder| Aromatic , 499.00 ,199.00,None,None
721, Brij Gwala Desi Cow Ghee |Made Traditionally from Curd |Pure Cow Ghee for Better Digestion and Immunity | 1Ltr Tetra Pack , 580.00 ,398.00,None,None
722, Gemini Physically Refined Ricebran Oil 1 L (Pouch) , 180.00 ,129.00,None,None
723, Daily Nut Raisin Value 1000gm (250gm x pack of 4) , 480.00 ,328.00,None,None
724, Laxmi Daily Feast 5 kg Toor Dal Oily | Arhar Dal | Tur Dal Coated with Oil Also Used as Pigeon Pea ," 1,899.00 ","1,399.00",None,( 279.80/1 kg)
725, Jivo Cold Pressed Canola Oil 5 L and Get 1 L Olive Oil Free ," 1,650.00 ","1,399.00",None,( 233.17/1 l)
726, Pyramid Traders 1 KG Kashmiri Walnuts ," 1,500.00 ",450.00,None,( 225.00/500 g)
727, Chef Urbano Himalayan Pink Salt 2 X 1 kg , 450.00 ,279.00,None,None
728, THE PRAKRITI FOODS BY KHATIRDAARI Mamra Almond from Fram Fresh 100G , 445.00 ,222.00,None,None
729, Satvikk Phool Makhana 400 Gms foxnuts/popped lotus seeds ( 100 Gm X Pack of 4) , 480.00 ,399.00,None,None
730, ANDRAMART- Solitaire Whole Cashew - 1 kg | kaju | Best Quality Cashews from PALASA ," 1,200.00 ",649.00,None,None
731, Chandan 5 in 1 Mix Mouth Fresheners 200 g , 280.00 ,140.00,None,( 35.00/50 g)
732, 24 Mantra Organic Unpolished Kabuli Chana/White Chickpeas/Chole - 500Gm | Pack of 1 | Chemical Free & Pesticides Free | Adds Variety to Your menu | Goodness Intact ,195.00,195.00,None,None
733, Dhara Filtered Groundnut Oil 1 L (Carton) , 245.00 ,209.00,None,None
734, Good Life Green Raisins/ Kishmish 100 g , 39.00 ,37.00,None,None
735, Pansari Mahak Mogra Basmati Rice 26 kg ," 1,700.00 ","1,532.00",None,None
736, The Berry People Afghan Black raisin sugarfree | Good for heart | High dietary fibre | Fresh breakfast items | Superfood by The Berry People -50gms , 299.00 ,111.00,None,None
737, Wheatkart Whole Wheat Atta - 5 KG , 449.00 ,319.00,None,( 63.80/1 kg)
738," YUM YUM 1 kg California Almonds, 100% Natural Badam Giri Dry Fruits "," 1,850.00 ",649.00,None,None
739, Double Horse Roasted Appam Powder | Roasted Rice Flour | Rice Flour | 500 Grams ,55.00,55.00,None,None
740, Good Life Apricots 100 g , 80.00 ,76.00,None,None
741," Farmley Prasadam Raisins Kishmish 400g, Pack of 2 Each- 200g ", 398.00 ,189.00,None,None
742, Rice Villa | Pure | 26 kg | Gobindo Bhog | Jeera Kasala | Kaima rice ," 3,640.00 ","2,419.00",None,( 93.04/1 kg)
743," CHATOKDE Anjeer Figs - Afghanistan Dry Anjir (Dried Figs) Dry Fruits, Increases Immunity & Purify the Blood 1KG "," 2,000.00 ",549.00,None,None
744, Pinkcity Wellness Pure Sesame Oil 1L| Til Oil| Gingelly Oil| Wood Pressed | 1 Litre Bottle , 400.00 ,375.00,None,( 375.00/1 l)
745, DAIRYSAGAR SHRI NAND KESARI Desi Cow Ghee| Premium Cow Desi Ghee| Pure Cow Ghee for better Digestion and Immunity|| 1ltr JAR (pack of 1) , 680.00 ,399.00,None,None
746, TilSona Gold Til Oil 500 ml , 220.00 ,205.00,None,None
747, Suhana Simla Premium 1 Liter Danedar Buffalo Ghee | Pure Buffalo Ghee | 1Liter , 775.00 ,449.00,None,None
748, Emperor Seeded Dates 500 g (Pack of 2) , 250.00 ,189.00,None,None
749, Good Life Matta Vada Rice 1 kg , 100.00 ,75.00,None,None
750, Pinkcity 5L Pure GroundNut Oil | Natural | Chemical Free | 1Ltr x 5 Bottles ," 2,000.00 ","1,150.00",None,None
751, Magik Cook Besan Premium Quality 100% Chana Dal Gram Flour (Pack of 500 Gram) ,75.00,75.00,None,None
752, Kinsfolk Extra Virgin Olive Oil (( Imported Olive Oil from Spain) ) -250ml , 310.00 ,161.00,None,None
753, Coreganic 1kg 100% Natural International Premium Broken Cashews ," 1,499.00 ",649.00,None,None
754, Good Life Soya Granules 200 g , 60.00 ,30.00,None,None
755, Bioherbs 100% Natural International California Cashew Whole 1 Kg (Pack of 2) ," 3,598.00 ","1,349.00",None,None
756," RRAAMS Healthy Phool Makhana (Fox nuts/Lotus Seeds) , Total 250 gms (Pack of 1 x 250 gms) ", 299.00 ,199.00,None,None
757, Coreganic 1kg 100% Natural International Premium California Almonds ," 1,799.00 ",719.00,None,None
758, 24 Mantra Organic (S) Mustard 100 g , 35.00 ,22.00,None,( 11.00/50 g)
759, True Elements 7 in 1 Super Seeds Mix 125g - Mix Seeds| Diet Snacks| Roasted Seeds for Eating ,149.00,149.00,None,None
760, Everest Turmeric Powder 100 g , 38.00 ,35.00,None,None
761, Borges Extra Virgin Olive Oil 1 L ," 1,400.00 ","1,199.00",None,None
762, RUDRAKSH Sharbati Wheat 30kg Premium Quality ( Narmada Chandausi) ," 2,100.00 ","1,549.00",None,( 51.63/1 kg)
763, VEER BRAND ROYAL - Extra Long Grain XXXL 5 Kg Biryani Basmati Rice , 999.00 ,699.00,None,( 139.80/1 kg)
764, Marwar Jeera Whole Cumin Seeds (Machine Clean JIRA Big Bold Size) 400g , 800.00 ,489.00,None,None
765, Suhana Mutter Paneer Spice Mix 50 g , 45.00 ,36.00,None,None
766, BLK Foods Daily 300gms Fresh phool Makhana (Foxnuts / lotus seeds) 300g (3 X 100g) , 750.00 ,299.00,None,None
767, MTR Sambar Powder 100 g , 86.00 ,77.00,None,( 77.00/100 g)
768, Good Life Surekha Rice 10 kg , 650.00 ,609.00,None,( 60.90/1 kg)
769, Desi Label Organic Desi Khand khandsari Natural & Unprocessed Raw Sugar | Organic & Unrefined | Unprocessed & Natural | Free from chemicals and preservatives | Substitute to refined white sugar | Immunity booster (Pack Of 2(2 Kg)) , 560.00 ,357.00,None,None
770," FARMUP Toor Dal Unpolished, High Protein Sortex Clean, (Arhar Dal, 400g Pack of 1) ", 449.00 ,239.00,None,None
771, Good Life Pulses Mix For Sprout 500 g , 78.00 ,67.00,None,None
772, NEXTSTEP ORGANIC Caraway Seeds | Shah Jeera | Shahi Jeera | Black Cumin Seeds 100g , 600.00 ,209.00,None,None
773, Good Life Amchur Powder 100 g , 50.00 ,35.00,None,None
774, India Gate Jeera Rice 1 kg , 135.00 ,105.00,None,None
775," Marwar Coriander Powder, (Agmark Grade Dhania Powder) 1 Kg Pack ", 300.00 ,219.00,None,None
776, Farmley Flax Seeds 200g Alsi Seeds Fibre Rich Flax Seeds for Hair Growth Seeds for Eating , 330.00 ,109.00,None,None
777, Everest Black Pepper Powder 50 g , 78.00 ,72.00,None,( 144.00/100 g)
778, Pitaamah Surti Kolam Rice - 5kg - Lashkari Kollam - Unpolished Rice - Aromatic Rice , 999.00 ,599.00,None,None
779, Double Horse Puttu Podi 1kg ,120.00,120.00,None,None
780, Everest Pav Bhaji Masala 50 g , 46.00 ,42.00,None,None
781, Catch Sambhar Masala 100 g , 75.00 ,37.00,None,( 37.00/100 g)
782, CHATOKDE 100% Natural and Premium Healthy Mix Dry Fruits and Nuts Healthy for Every Occasion Fresh and Healthy Dry Fruits (1kg) ," 2,000.00 ",569.00,None,None
783, Good Life Ambemohar Raw Rice 1 kg , 150.00 ,115.00,None,None
784, Desi Kitchen Little Millet 500 g , 75.00 ,72.00,None,None
785, Lotus Phool Makhana 100 g , 149.00 ,129.00,None,None
786, GKD's Premium 100% Pure Coconut Oil PET Bottle (1L) , 380.00 ,279.00,None,None
787," Shrego Radhe Roasted Chana, Bhuna Chana (Desi Chickpeas) , Healthy Snacks & Namkeen, 360G (1X360G) ", 200.00 ,179.00,None,None
788, Surya 1 kg Ginger Garlic Paste| Adrak Lahsun Paste| Ready to Use Cooking Paste , 560.00 ,239.00,None,None
789, Nupsila Parmal Raw Rice - 25 kg ," 2,500.00 ","1,390.00",None,None
790," RED ROSE ROYAL XXXL BASMATI RICE, EXTRA LONG GRAIN, BEST BASMATI RICE FOR BIRYANI, 10 KG "," 2,499.00 ","1,499.00",None,( 149.90/1 kg)
791, BHUMI-KA-AH Cardamom Elaichi ilaichi Green Grade A 100 GM , 496.00 ,219.00,None,( 219.00/100 g)
792, BLUE HIMALAYAS KASHMIRI PREMIUM WALLNUT KERNELS ONE TREE WALLNUTS HIGH QUALITY , 999.00 ,949.00,None,None
793, Brij gwala Bihari ji Pure Desi Ghee| | Pure Ghee for Better Digestion and Immunity-1 ltr tetra-1 , 580.00 ,399.00,None,None
794," SHIOSC SUN PARUVAR- Refined Sunflower Oil Pouch, 1L ( Pack of 5) "," 1,150.00 ",739.00,None,None
795, Good Life Broken (2 pcs) Cashews 500 g , 499.00 ,399.00,None,None
796," Khari Foods Everyday Cashews 500g, Whole Kaju Dry Fruits, No Adulteration ", 799.00 ,349.00,None,None
797, Wonderland Foods Raw Cashews 500 g , 770.00 ,399.00,None,None
798, Borges Extra Virgin Olive Oil 2 ltr ," 2,700.00 ","2,129.00",None,None
799, Farmley Trail Mix 400g Mixes of Nuts Dried fruits Dried Berries Seeds 400g (Pack of 2 each 200g) , 698.00 ,349.00,None,None
800, JIVO Pomace Cooking Olive Oil 2L Olive Oil Plastic Bottle (2 L) ," 1,449.00 ",849.00,None,None
801, Samrat Chana Besan 1 kg , 150.00 ,105.00,None,None
802," Spellfry 100% Pure Kachi Ghani Mustard Oil, 15 KG, Tin "," 5,600.00 ","2,790.00",None,None
803," Sri Sri Tattva Shuddhta ka naam Organic Brown Sugar, 1kg x Pack of 2 ", 320.00 ,288.00,None,None
804, Daawat Rozana Gold Basmati Rice 1 kg , 115.00 ,89.00,None,None
805, Pink Delight Double Refined Sulphurfree Sugar | 5 Kg Pack , 700.00 ,560.00,None,None
806," Dry Fruit Hub Pumpkin Seeds 1Kg - AAA Grade, Raw Pumpkin Seed, Super Diet Food "," 1,050.00 ",649.00,None,None
807, Daawat Rozana Super Basmati Rice 10 kg , 963.00 ,699.00,None,( 69.90/1 kg)
808," Marwar GurJaggery 1 Kg (Gud Cubes, Chemical Free, Organic, No Preservatives Added), Whole Gur Cube Pack (1KG) ", 300.00 ,199.00,None,None
809," Kinsfolk 1L(500mlx2) Sesame Oil Cold Pressed (Virgin, Chekku/Ghani) - 500ML Pack of 2 ", 698.00 ,353.00,None,( 353.00/1 l)
810," Elephant Brand Hathi Mustard Oil - Ideal for cooking food, pickles, massages | 1L x 16 Bulk Pack ","5,200.00","5,200.00",None,( 325.00/1 l)
811, MADHURI Cold Pressed Groundnut Oil | Cold Pressed Mungfali Ka Tel | Cold Pressed Peanut Oil- 15Liter ," 4,115.00 ","3,340.00",None,None
812, Madam Rawa 500 g , 42.00 ,40.00,None,None
813, Mr. Nuttz 100% Natural Premium California Almonds Badam 500 g , 950.00 ,375.00,None,None
814, Mirchillion 500gm Guntur Red Chilli Whole with stem - Saver Pack , 375.00 ,349.00,None,( 698.00/1 kg)
815, Farmley Roasted Cashew Chatpata Flavoured Cashews Standee Pouch 200g , 379.00 ,269.00,None,None
816, Foodcan Afghan Abjosh Munakka (Big Aabjosh Raisins | A Grade | with Seeds) 400g , 800.00 ,299.00,None,None
817, NEXTSTEP ORGANIC Best Quality Raw Peanut | Mungfali dana (Whole) 100g , 350.00 ,129.00,None,None
818, Rajbhog Plain Makhana 250 g , 300.00 ,249.00,None,None
819, India Gate Regular Choice Basmati Rice 10 kg , 945.00 ,799.00,None,( 79.90/1 kg)
820, Ramdev Chilli Powder 500 g , 355.00 ,301.00,None,None
821," Farmley Mix Dry Fruit -Panchmeva Combo of Almond, Cashew, Dates, Black Raisin, Green Raisin - 450 g ", 519.00 ,399.00,None,None
822, Freshtige Rosemary Dried Leaves - For Hair Growth | Rosemary Herb Tea | Organic | Natural (100 Gram) , 499.00 ,199.00,None,None
823, Annprash Desi Khand - 1 kg (Pack of 2) , 998.00 ,220.00,None,None
824, Molsi's 200 g Dry Roasted and Salted Pistachios , 375.00 ,275.00,None,None
825," Farmley Roasted Cashew Black Pepper Flavored Cashew Standee Pouch Pack of 2, each 200 gm ", 758.00 ,469.00,None,None
826, Catch Coriander Powder 200 g , 78.00 ,52.00,None,None
827, Smith & Jones Peri Peri Masala 72 g , 70.00 ,55.00,None,None
828, Angur Toor Dal Plain - 5 Kg ," 1,500.00 ","1,300.00",None,( 260.00/1 kg)
829," CROWN RICE, Daily Basmati Rice, Broken Rice, Double Polished 100% Natural Basmati Rice , 5 KG ",575.00,575.00,None,None
830, Nutraj Raisins / Kishmish 500 g , 299.00 ,155.00,None,None
831, natural n Tasty Afghani Anjeer Figs Afghanistan Dry Anjir Dried Figs Dry Fruits (500 Grams) ," 1,679.00 ",499.00,None,None
832, Indrayani Rice 2 kg ,125.00,125.00,None,None
833, SAPPHIRE California Almonds/Badam Kernels (Independent) Pack of 4 (250gm X 4) ," 1,116.00 ",660.00,None,None
834, Special Choice Cashew Combo Crunch (Cashew Roasted n Salted & Cashew Tingy Tangy Masala) 100g x 2 , 540.00 ,275.00,None,None
835, Good Life Unpolished White Gota Urad 500 g , 111.00 ,84.00,None,None
836, BA Dryfruits and Spices Premium Dry Afghani Anjeer/Figs 250 g Jar , 525.00 ,225.00,None,None
837, Kashmir Exotics Organic Kashmiri Mamra Almond Kernels 400 G , 925.00 ,589.00,None,None
838, Manna Millets Combo pack of 3 | Unpolished Millets| Siridhanya| Foxtail| Kodo| Little , 390.00 ,385.00,None,None
839, Daawat Brown Basmati Rice 5 kg , 830.00 ,679.00,None,None
840, Desi Kitchen Proso Millet 500 g , 75.00 ,59.00,None,None
841," The Nature Krafts Mix Dry Fruits 1kg [ Almonds, Cashews, Walnuts, Raisins and More] Jar Pack "," 1,699.00 ",499.00,None,None
