,Product name,MRP,Discount,Tag,PerUnitPrice
842, VOC Mart Premium Imported Black Dates 1 Kg | Pind Khajoor | Lowest Price | Best Quality , 599.00 ,399.00,None,None
843, Catch Meat Masala 100 g , 90.00 ,45.00,None,( 45.00/100 g)
844, BLK Foods Select Seedless Tamarind (Imli without beej) 500g (2 blocks in 1 pack) , 350.00 ,183.00,None,None
845, Saffola Total Pro Heart Concious RiceBran Based Blended Oil 1 L , 200.00 ,185.00,None,None
846, Pro Nature Organic Unpolished Tur / Arhar Dal 1 kg , 279.00 ,271.00,None,None
847, Pitambari Ruchiyana Jaggery Powder 500 gm - pack of 2 , 170.00 ,150.00,None,None
848, Good Life Popcorn Maize 200 g ,29.00,29.00,None,None
849," Jumbo Dried Apricots Organic (Khumani, Khurmani, Khurbani, Jardalu, Prunu) High Quality (Grade - Big Size) 1 kg ", 999.00 ,391.00,None,None
850, MEEWA 1 KG PREMIUM WALNUT KASHMIRI AKHROT GIRI | QUARTER KERNELS | BEST QUALITY| VACCUM PACKED ," 3,000.00 ",675.00,None,None
851, natural n Tasty Natural Dried Big Size Mamra Almonds  Gluten Free Dry Fruit A Grade Irani Badam Giri| Quality Nuts| Healthy Party Snack Extra Crunch (Jar Pack 1 kg) ," 2,799.00 ","1,199.00",None,None
852, BLK Foods Daily 400g True Small Green Cardamom Mini | Refreshing & Aromatic Choti Elaichi 400g ," 1,200.00 ",799.00,None,None
853, Kinsfolk Extra Virgin Olive Oil - 5 Ltr PET ," 4,999.00 ","1,793.00",None,None
854, Triangle Walnut Kernels 1 Kg Quarter Kashmiri Premium Akhrot Giri Vaccum Pack Without Shell Lowest Price ," 3,000.00 ",670.00,None,None
855, Ching's Secret Chowmein Hakka Noodles Masala 100 g , 60.00 ,49.00,None,( 49.00/100 g)
856, Pyramid Traders 1KG White Broken Walnut Kernels ," 2,000.00 ",745.00,None,None
857, Kitchen Jungle Seedless Dates ( Pin Khajoor) -[ Premium Quality] [ Hygienically Vaccum Packed] , 299.00 ,199.00,None,None
858, Suhana Paneer Makhanwala Spice Mix 50 g , 45.00 ,36.00,None,None
859, BLK Foods Daily 1Kg Munnaka / Munakka / Abjosh / Golden Raisin (with seed) 1000g (5 X 200g) ," 1,750.00 ",569.00,None,None
860, RENTIO Super Desi Toor Dal 5kg | Fresh Tur/Arhar Dal ," 1,550.00 ","1,239.00",None,None
861, BLK Foods Select Seedless Tamarind (Imli without beej) 1Kg (4 Wrapped blocks in 1 pack) , 600.00 ,272.00,None,None
862," Mr.Nuttz Dry Fruits Combo Pack-Almonds, Pistachios & Raisins 150g (Badam, Pista & Kishmish) 50g each ", 305.00 ,195.00,None,None
863, Natureland Organics Chana Dal 1 kg - Pack of 2 , 420.00 ,357.00,None,None
864, Samrat Refined MP Wheat Flour / Maida 1 kg , 76.00 ,48.00,None,None
865, Gulab Kolhapuri Premium Jaggery 900gm , 349.00 ,285.00,None,None
866, Natureland Organics Toor Dal 1 Kg - Pack of 2 , 590.00 ,501.00,None,None
867, Standard Pulav Rice 2 kg ,139.00,139.00,None,None
868, ANMOL ROYAL 26 Kg Premium Steam Sona Masoori Rice ,"1,560.00","1,560.00",None,( 60.00/1 kg)
869," Farmbean Premium Whole Spices Combo Pack of 2 -500Gms (Cumin 250g, Fenugreek Seeds 250g) ", 999.00 ,399.00,None,None
870, Pansari Great Taste and Pure Aroma | Long Grain Basmati Rice - 10 KG ," 2,600.00 ","1,549.00",None,None
871," RED ROSE MONGRA BASMATI RICE, 10 KG ", 899.00 ,749.00,None,( 74.90/1 kg)
872, Bioherbs Kimia dates (Rich in Dietary Fiber) 500g (Pack of 2) , 899.00 ,340.00,None,None
873," FARMUP Moong Dal Unpolished, High Protein Sortex Clean, (Mung Bean, 400g Pack of 1) ", 399.00 ,199.00,None,None
874, Everest Kasuri Methi 25 g , 30.00 ,27.00,None,None
875, Anjali Gingelly/Sesame Oil 5 Litre Can With 1 Litre Free ," 2,750.00 ","2,050.00",None,None
876, NAVJEEVAN CINNAMON STICKS 400g (200g X 2) , 280.00 ,159.00,None,None
877, Nutri Binge 500g Vitals Whole Cashews W320 , 775.00 ,395.00,None,None
878," PANCHAMRUTHA DELUXE 26KGS SONA MASURI RICE ,+F (Fortified with 9 added VITAMINS & MINERALS ) "," 3,000.00 ","1,580.00",None,( 60.77/1 kg)
879, BLK Foods Select Gond Katira Tragacanth Gum Crystals (Edible Gum) 250g , 400.00 ,173.00,None,None
880, Marwar Watermelon Seeds (Magaj| Melon Kernels| Tarboj Beej Magaj Machine Cleaned) 400g , 800.00 ,449.00,None,None
881," Vale Of Kashmir Walnuts Without Shell Brown Kernels 1 Kg (500 x2), Akhrot Kernels Giri "," 1,499.00 ",779.00,None,None
882, Tulsi Premium California Walnuts Kernels 200 g (Pack Of 2) , 780.00 ,499.00,None,None
883, Marwar Spices 3 kg Combo Red Chilly (Lal Mirch) Powder + Coriander (Dhania)+ Turmeric (Haldi) Powder 1 kg Pack (Super Saver Spices Combo) Agmark Certified Total 3 Kgs ," 1,200.00 ",649.00,None,None
884, Gemini Vanaspati 500 ml , 108.00 ,63.00,None,None
885," Oreal 5L Pure Groundnut Oil | Chemical Free| Natural Anti-Oxidants| Vitamin A, D & E| 5 Litres "," 1,280.00 ","1,145.00",None,( 229.00/1 l)
886, Gropure Organic 4.5kg Wheat Sharbati , 599.00 ,499.00,None,None
887, Double Horse Palakkadan Matta Rice | Single Boiled Rice | Traditional Matta Rice | (5kg) , 599.00 ,582.00,None,None
888, Qualinut | Diwali Gift Box | Elegant Red | Premium Quality , 750.00 ,697.00,None,None
889, Pink Delight Pure & Natural Jaggery | Organic Gur| Purest Form Of Gur| Brown Gur| 900 Gm Pack , 400.00 ,249.00,None,None
890, Suhana Ambari Kanda Lasun Masala 200 g , 73.00 ,65.00,None,( 32.50/100 g)
891, Molsi's 500g Kimia Dates , 275.00 ,215.00,None,None
892, Pusht Organic Mix Dal - 1Kg , 256.00 ,164.00,None,None
893, Yoagbar 500g Green Raisins | Premium Seedless Green Raisins | Kishmish | Nutritious| Rich in Iron , 375.00 ,249.00,None,None
894, BAJ'S CASHEW , 850.00 ,650.00,None,None
895, Satvikk 500 gm Premium Almonds Californian 500 Gm , 700.00 ,425.00,None,None
896," Nut Toppers Premium Arabian Dates, 400 g ", 250.00 ,148.00,None,None
897, Catch Black Salt Sprinkler 200 g , 45.00 ,43.00,None,None
898," GO KITCHEN Premium California Walnuts Without Shell, Akhrot Giri Walnut Kernels High in Protein & Iron|Low Calorie Walnut, 200gm "," 1,126.00 ",591.00,None,None
899, DailyHerbs Premium Phool Makhana Lotus Seeds (Makhana) - 1 KG Pack , 999.00 ,899.00,None,None
900, Goshudh Desi Khand 500 g Sugar , 399.00 ,150.00,None,None
901, Heaven's purity Premium quality anjeer 500 gram , 425.00 ,298.00,None,None
902, Organic Tattva Wheat Maida 500 g , 60.00 ,40.00,None,None
903, APLENTY Unrefined Desi Khand/Khhand | Khandsari Sugar | Sulphur-free Khand | Mishri Powder | Semi Crystal Sugar | Full Of Minerals & Nutrients (200g) , 299.00 ,169.00,None,None
904," Havoc Nuts Premium Unsalted Pistachio Kernels Crunchy Pista Kernals Without Shell Sada Pista Dry Fruit, Shelled Nuts Super Crunchy & Delicious Healthy Snack | Vitamins & Minerals Rich (Jar Pack 500 gm) "," 1,799.00 ",854.00,None,None
905, Farmley Premium California Roasted & Salted Pistachios Farmley Standee Pouch 750 g ," 1,899.00 ",889.00,None,None
906, Dhampur Green 2.4Kg Organic Desi Khand| 800g x 3 Packs , 597.00 ,589.00,None,( 245.42/1 kg)
907, Suhana Sambar Masala 100 g , 79.00 ,39.00,None,( 39.00/100 g)
908," DailyHerbs 100% Natural Mix Dry Fruits 500gm with Almonds| Cashew| Black Raisins| Apricot | Healthy Gift Hamper for Every Occasion Fresh and Healthy Dry Fruits, Seeds & Nuts. ", 799.00 ,329.00,None,None
909, Daily Nut Raisin Value 500gm (250gm x pack of 2) , 240.00 ,202.00,None,None
910, Tulsi California Walnuts Kernels Premium 200 g , 390.00 ,309.00,None,None
911, Sundrop Heart Ricebran Based Blended Oil 1 L , 200.00 ,185.00,None,None
912," Hanumakkhya Mix (DryFruits Seeds&Berries) 1kg Cashews, Raisins, Almonds, Pistachios, Cranberries ", 799.00 ,480.00,None,None
913," JEERA RICE DELUXE 5KGS, STEAM JSR LACHKARI KOLAM, +F(Fortified with 9 VITAMINS & MINERALS) ", 700.00 ,525.00,None,( 105.00/1 kg)
914, Double Horse Roasted Rawa 500 g , 65.00 ,61.00,None,None
915, Tata Sampann Poha| High In Fibre| Flattened Rice| Healthy Breakfast| 1 Kg Each | Pack of 2 | 2 Kg ,349.00,349.00,None,None
916, Keya 150 gm Pizza Seasoning Combo| Italian Pizza Oregano (80 gm) | Italian Pizza Chilli (70 gm) , 238.00 ,209.00,None,None
917, Double Horse 1 Hour Idli/Dosa Batter Pre-Mix 500g (Pack of 3) ,207.00,207.00,None,None
918, Pick N Cook Regular Kabuli Chana 500 g , 147.00 ,136.00,None,None
919, Good Life Jaggery 950 g , 80.00 ,59.00,None,None
920, Wonderland Foods Premium California Whole Walnuts 500 g , 475.00 ,279.00,None,None
921," Dhampur Green 2.4Kg Organic Jaggery Powder | 800g x 3 Packs | 100% Organic, 100% Pure & 100% Chemical Free | Jaggery Powder For Tea and Coffee , Milk, Mithai Sweets ", 597.00 ,589.00,None,None
922, BLK Foods Select Coriander Whole (Dhaniya Sabut) 500g (2 X 250g) , 340.00 ,199.00,None,None
923, Wonderland Foods Premium Roasted & Salted Almonds 200 g (Buy 1 & Get 1 free) , 699.00 ,579.00,None,None
924, NUTRIMIXX Premium Kashmiri Mamra Almonds| 500 gm| A+ grade Badam| High Protein & Vit E Content ," 1,299.00 ",659.00,None,None
925," mickno organics Mix seeds , seedmix weightloss organic trailmix chia seeds, pumpkin seeds , flax seeds, sunflower seeds, watermelon seeds , 5 seeds in one protein mix Mixed Seeds (250 g) ", 400.00 ,286.00,None,None
926, A Plus 1Kg Green Peas/Hara Matar vatana , 250.00 ,215.00,None,( 215.00/1 kg)
927, FreshoCartz Dried Figs Medium Size Afghani Anjeer 1 kg ," 1,599.00 ",569.00,None,None
928, Good Life Sharmili Rajma 1 kg ,108.00,108.00,None,None
929, Pansari Everyday Basmati Rice 5Kg | Long Grain | Biryani Special ,540.00,540.00,None,None
930, YUM YUM Premium California Almond Badam 300 g (Pack of 2 -150 g Each) , 650.00 ,375.00,None,None
931, Paleo India 1kg California Inshell Walnuts| Kaagzi Akhrot| Akharot Giri| Dry Fruits ," 1,380.00 ",549.00,None,None
932, Anjani Regular Cashews/Kaju 1 kg ," 1,799.00 ",633.00,None,None
933, 41 foods Dry fruits combo pack of Pistachios Almonds Cashews | Kaju Badam Pista ( 150GM X 3 ) 450 GM ," 1,599.00 ",516.00,None,None
934, Masti Sihori Wheat 30 kg ," 1,380.00 ","1,199.00",None,None
935, ALEMA DUBAR BASMATI RICE 30KG ," 5,150.00 ","1,899.00",None,( 63.30/1 kg)
936, Pick N Cook Tur / Arhar Dal 500 g , 142.00 ,132.00,None,None
937, BA Dryfruits and Spices Premium Green Cardamom (Choti Elachi) Big Size 100 g , 499.00 ,275.00,None,None
938, SIMAV NATURALLY GOOD Groundnut Oil | Mungfali Ka Tel | Peanut Oil- 5Liter . ," 1,499.00 ","1,149.00",None,None
939," Dry Fruit Hub - Biryani Whole Spices Combo Pack 650 g (Lawang, Elaichi, Dalchini, Shahi jeera, Bay Leaves) "," 1,899.00 ","1,120.00",None,None
940, Everest Pani Puri Masala 50 g , 40.00 ,37.00,None,( 74.00/100 g)
941, SHREE KALPADRUMA ghee Natural A2 Desi Cow Ghee 500ML|Pure Cow Ghee for Better Digestion and Immunity|100% natural and premium quality , 459.00 ,335.00,None,None
942, Notlih Pistachios 500gm ," 1,000.00 ",698.00,None,None
943, Daawat Sehat Mogra 70 Basmati Rice 5 kg , 415.00 ,315.00,None,None
944," Foodery Mix Dry Fruits and Nuts (Almonds, Pistachios, Cashew, Kishmish, Apricot, Black Raisins) Healthy Gift Hamper for Every Occasion Fresh and Healthy (100 g) ", 899.00 ,119.00,None,None
945, Marwar Kashmiri Red Chilli Whole & Dry (Lal Mirchi Sabut) - 400 Grams , 500.00 ,299.00,None,None
946," Pansari Signature (Pack of 4 x 5kg) Basmati Rice, Long Grain, Biryani Rice/Pulao Rice - - 20KG "," 5,200.00 ","2,899.00",None,None
947, SHIVAAY PURE AND NATURAL Figs Dry Fruits (Afghani Anjeer | Dried Figs | Medium Size) 1 KG , 999.00 ,559.00,None,None
948, Ahaar Chana Dal 1Kg ,240.00,240.00,None,None
949, Mama's Daily Cart Sounf Fennel Seeds Bold (Fennel Whole) 1Kg + (Mustard 50gm) Free , 400.00 ,360.00,None,None
950, Rajabhogam Ponni Boiled Rice 5Kg ," 1,100.00 ",467.00,None,None
951, Organic Tattva Tur / Arhar Dal 500 g , 150.00 ,118.00,None,None
952, Aeroplane 10kg Sulphurless Sugar (5kgx2) , 700.00 ,499.00,None,( 49.90/1 kg)
953, Kinsfolk Pomace Olive Oil - 1 Ltr , 699.00 ,349.00,None,None
954, Ahaar Moong Dal Chilka Split 1Kg ,262.00,262.00,None,None
955, Manna Multigrain Atta 5kg | Certified Low GI Atta | Multi Millet Atta | Wheat Flour with 25% Millets , 599.00 ,585.00,None,None
956," YUM YUM 400g Dry Fruits Gift Box (Diwali Gift Offer) Badam, Kaju, Pista, Kishmish - 100g Each "," 1,299.00 ",449.00,None,None
957, Organic Tattva Brown Sugar 500 g , 80.00 ,53.00,None,None
958, RAVINDRA OIL & GINNING MILLS Kachi Ghani Mustard Oil 1L each(Pack of 2) , 450.00 ,280.00,None,None
959, MADHURI Refined Soyabean Oil Cooking Oil | Perfect for Deep Frying Baking Roasting-15 Liter Can ," 3,995.00 ","2,010.00",None,None
960, Saffola Gold Pro Healthy Life Style Rice Bran Based Blended Oil 2 L , 415.00 ,369.00,None,( 184.50/1 l)
961, GREEN CROP Afghani Anjeer Figs - 1kg | Afghanistan Anjir (Dried Figs) ," 1,625.00 ",489.00,None,None
962, Kimia Dates 500g pack of 2 with dates syrupSoft Dates | Mazafati Dates , 620.00 ,463.00,None,None
963, Good Life Bhadang Murmura 200 g , 36.00 ,27.00,None,None
964, LIVING TREE..DIRECT FROM NATURE 500 gm Seedless Black Raisins/Kali Kishmish | Sun Dried| HEALTHY SNACK|Helps In Hair Health , 449.00 ,225.00,None,None
965," Marwar Black Mustard Seeds Small (Kali Sarso/Rai), 1 Kg ", 800.00 ,219.00,None,None
966, Tata Sampann Turmeric Powder 500 g , 180.00 ,144.00,None,None
967, LG Compounded Asafoetida Cake (Hing) 50 g , 91.00 ,84.00,None,None
968, Tata Sampann Sambar Masala 45 g , 40.00 ,20.00,None,None
969, AL-ZAMEENDAR - Premium Whole Cashew | 1 KG |Whole Kaju ," 1,058.00 ",688.00,None,None
970, Laxmi Extra Virgin Olive Oil Jaitun tail Edible food cooking oil light 1000 ML| Olive Oil| Cold Pressed Oil| Edible Oil ," 1,399.00 ",495.00,None,None
971, Nutrela Soya Chunks / Wadi 80 g , 15.00 ,13.00,None,None
972, 24 Mantra Organic Wheat Daliya 500 g , 65.00 ,55.00,None,None
973, YUM YUM Premium Unsalted Pistachios Kernels Dry Fruits without Shell 150 g Jar , 525.00 ,399.00,None,None
974, VEER SPECIAL - Extra Long Grain Biryani Basmati Rice - 10Kg ," 1,550.00 ","1,369.00",None,( 136.90/1 kg)
975, Good Life Roasted Fennel 100 g , 120.00 ,108.00,None,( 54.00/50 g)
976, the food stuff premium anjeer 1kg ," 1,190.00 ",569.00,None,None
977, PIYOR 100% Premium Quality Dryfruit Combo Pack of 900g | Almond| Cashews| Raisin| Anjeer| Walnut| Nutmix(6X150g Etc) ," 2,399.00 ",699.00,None,None
978, LAL QILLA OLD MALAI BASMATI RICE 5KG (TRADITIONAL) ," 1,330.00 ","1,199.00",None,( 239.80/1 kg)
979, Dulhan Daily Premium 10 kg basmati rice| Chawal | 1121| Dubar Basmati ," 1,099.00 ",749.00,None,( 74.90/1 kg)
980, Unity Basmati Biryani Rice 1 kg , 219.00 ,159.00,None,None
981, SIMAV NATURALLY GOOD Groundnut Oil | Mungfali Ka Tel | Peanut Oil- 1Liter . , 349.00 ,300.00,None,None
982, Borges Olive oil for Indian Cooking (5L Pet) ," 5,500.00 ","4,945.00",None,None
983," Farmley Premium Sunflower Seeds 400g, Pack of 2, Each- 200g ", 960.00 ,239.00,None,None
984, FreshoCartz Organic Black Dry Chuhara Dates 1 Kg , 999.00 ,399.00,None,None
985, Pick N Cook Peanuts / Singdhana 500 g , 127.00 ,126.00,None,None
986, Shiva's Premium Singhara Atta | Singhada Atta | Water Chestnut flour | Shingoda flour- 500 Gm , 250.00 ,215.00,None,None
987, Saffola Gold Pro healthy RiceBran Based Blended Oil 15 L ," 2,650.00 ","2,329.00",None,( 155.27/1 l)
988, Marwar Poppy Seeds | Khus Khus | Posto Dana | Handpicked and Clean | Chemical and Pesticides Free | Naturally Processed | Unadulterated | 50 Grams , 500.00 ,199.00,None,None
989, Amul Cow Ghee 200 ml (Jar) , 141.00 ,140.00,None,None
990, Good Life Jaya Rice 10 kg , 700.00 ,625.00,None,( 62.50/1 kg)
991," RAJ GOLD BESAN Pure Chana Daal Besan | Gram Flour Gram Flour Besan Pindi | Chemical Free & Pesticides Free | Uniform Particle Size | Unadulterated (200gram, 2) ", 240.00 ,119.00,None,None
992, Nutrovally Chia Seeds For Eating | High In Fiber & Calcium Rich | Premium & Authentic Diet Superfood | Gluten Free Chia Seeds 125gm ,149.00,149.00,None,None
993, Good Life Saffron / Kesar 0.5 g , 210.00 ,105.00,None,None
994, Pink Delight Premium Boora | Handmade | Triple Refined | Kand | Bura | 1Kg Pack , 300.00 ,199.00,None,None
995, Goodness Grocery Premium Mixed Whole Pulses for Sprouts / Sprouting Mix Beans (450gm) , 499.00 ,160.00,None,None
996, Dulhan Premium Biryani basmati rice 5 kg |XXXL Rice|Chawal|1121 , 899.00 ,649.00,None,( 129.80/1 kg)
997, Saffola Mealmaker Soya Chunks 400 g , 130.00 ,65.00,None,None
998," 5: 15PM Cheddar Cheese Powder Seasoning for Popcorn, Pasta, Pizza, Nachos, Fries, 100 g ", 300.00 ,195.00,None,None
999," ORGANIC BASKET Pumpkin,Sunflower,Chia,Watermelon Seeds For Eating And Immunity Seeds,Each 100 Gram (Pack of 4) ", 499.00 ,319.00,None,None
1000, Catch Kuti Mirch Powder 200 g , 150.00 ,100.00,None,None
1001, Suhana Butter Chicken Mix 50 g , 45.00 ,36.00,None,None
1002, Berries And Nuts Roasted Seed mix 400 Grams | 2 packet of 200 gram ,360.00,360.00,None,None
1003, Kaul's 100% Natural Premium 1 Kg Raisins |Sweet Kismis/Kismish Dry Fruits ," 1,499.00 ",349.00,None,None
1004," CHATOKDE Cardamom Green Whole - Grade - Big Size, 100g ", 600.00 ,329.00,None,None
1005, Everest Cumin Powder 50 g , 71.00 ,66.00,None,( 132.00/100 g)
