,Product name,MRP,Discount,Tag,PerUnitPrice
0, Priya Fortified With Vitamin A & D Refined Sunflower Oil 1 L , 162.00 ,99.00,None,None
1, Happilo Premium Dried Blueberry Cranberry Duet 200 g , 380.00 ,325.00, sponsored ,None
2, Super Sarvottam Physically Refined Rice Bran Oil 1 L , 199.00 ,99.00,None,None
3, Fortune Sunlite Refined Sunflower Oil 1 L , 140.00 ,114.00,None,None
4, Tata Iodised Salt 1 kg , 28.00 ,24.00,None,None
5, Happilo 1kg Popular Almond California , 1250.00 ,799.00, sponsored ,None
6, Fortune Premium Kachi Ghani Pure Mustard Oil 1 L , 185.00 ,146.00,None,None
7, Good Life Refined Sunflower Oil 1 L , 150.00 ,97.00,None,None
8, Tur / Arhar Dal 2 kg , 450.00 ,355.00,None,None
9, Chakki Atta 10 kg , 425.00 ,359.00,None,( 35.90/1 kg)
10, Good Life Pure Crystal Sugar (M) 5 kg , 275.00 ,229.00,None,None
11, Nutri Binge 1kg Whole Cashews , 1498.00 ,739.00, sponsored ,None
12, Good Life Almonds 500 g , 549.00 ,349.00,None,None
13, Brill 1Kg Premium Whole Cashews (500g x 2pack) ," 1,840.00 ",735.00,None,None
14, Gemini Refined Sunflower Oil 1 L , 179.00 ,115.00,None,None
15, Nutri Binge 500g California Almonds Vitals , 660.00 ,369.00,None,None
16, Good Life (W320) Cashews 500 g , 499.00 ,399.00,None,None
17, ORGANIC GREEN MOONG DAL 1KG , 250.00 ,188.00, sponsored ,None
18, Amul Pure Ghee 1 L (Pouch) , 635.00 ,585.00,None,None
19, DAIRY SAGAR GOPAL Pure Desi Cow Ghee Pure Cow Ghee for Better Digestion and Immunity 1 ltr jar-1 , 680.00 ,399.00,None,None
20, Suji / Rawa 1 kg , 106.00 ,45.00,None,None
21, Aashirvaad Superior MP Whole Wheat Atta 10 kg , 551.00 ,468.00,None,( 46.80/1 kg)
22, Good Life Jeera 100 g , 150.00 ,89.00,None,( 44.50/50 g)
23," VEEDINT RED CHILLI POWDER, TIKHA LAL, 500 GRAM PACK ", 495.00 ,220.00, sponsored ,None
24, Good Life Raw Peanuts 500 g , 120.00 ,97.00,None,None
25, Nutri Binge 500g Whole Cashews , 749.00 ,379.00,None,None
26, Coreganic 1kg 100% Natural International Premium Whole Cashews ," 1,799.00 ",719.00,None,None
27, Good Life Yellow Kishmish 500 g , 183.00 ,129.00,None,None
28, Nutri Binge 1kg Vitals California Almonds ," 1,320.00 ",699.00,None,None
29, Ziofit 500g Popular Almonds California , 625.00 ,434.00, sponsored ,None
30, Good Life Sugar (M) 1 kg , 55.00 ,50.00,None,None
31, Suji / Rawa 500 g , 53.00 ,25.00,None,None
32, Dhara Kachi Ghani Mustard Oil 1 L (Pouch) , 160.00 ,150.00,None,None
33, Good Life Refined Soyabean Oil 1 L , 150.00 ,105.00,None,None
34, Fortune Rice Bran Health Physically Refined Rice Bran Oil 5 L , 849.00 ,629.00,None,( 125.80/1 l)
35, Nutri Binge 500g Pistachios Vitals California , 900.00 ,549.00, sponsored ,None
36, Nutri Binge 500g Premium California Almonds , 670.00 ,429.00,None,None
37," Horaira Nutz Dry Fruits Combo Pack 1Kg Cashews 250g , Figs 250g , Raisins 250g , Almond 250g "," 1,900.00 ",720.00,None,None
38, Gowardhan Pure Cow Ghee 1 L (Pouch) , 725.00 ,635.00,None,None
39, Maida 1 kg , 106.00 ,42.00,None,None
40, Good Life Kachi Ghani Mustard Oil 1 L (Bottle) , 175.00 ,126.00,None,None
41, Nutri Binge 200g California Pistachios , 385.00 ,290.00, sponsored ,None
42, Good Life Free Flow Iodised Salt 1 kg , 28.00 ,15.00,None,None
43, Good Life Jeera 500 g , 740.00 ,359.00,None,( 35.90/50 g)
44, Karan's Cashew Whole Cashew Nuts 1 Kg ( 500gX2) / Kaju. ," 1,400.00 ",669.00,None,None
45, Aashirvaad Select Sharbati Whole Wheat Atta 5 kg , 331.00 ,262.00,None,( 52.40/1 kg)
46," VEEDINT RED CHILLI POWDER, TIKHA LAL, TIKHA MIRCH POWDER, LAL MIRCH POWDER, MIRCH POWDER, 5 KG SAVER PACK ", 2495.00 ,1579.00, sponsored ,None
47, Sunday Refined Sunflower Oil 1 L , 189.00 ,109.00,None,None
48, Dhara Kachi Ghani Mustard Oil 1 L (Bottle) , 180.00 ,152.00,None,None
49, Good Life Value Almond 500 g , 525.00 ,315.00,None,None
50, Patanjali Kachi Ghani Mustard Oil 1 L (Bottle) , 145.00 ,135.00,None,None
51, Good Life Tur Dal 1 kg , 266.00 ,211.00,None,None
52," House of Veda Organic Tur (Arhar) Dal - 1kg Pack, Certified Organic | Rich in Protein & Iron | Zero Chemicals, Preservative Free ", 275.00 ,261.00, sponsored ,None
53, RUNUTZ 500g Cashew Nuts (250g X 2) , 590.00 ,395.00,None,None
54, Ruchi Gold Refined Palmolein Oil 893 g , 136.00 ,91.00,None,None
55, Anjeer 100% Natural Anjeer (Dry Figs) 500g , 899.00 ,399.00,None,None
56, India Gate Mini Mogra-II Basmati Rice 10 kg , 496.00 ,429.00,None,( 42.90/1 kg)
57," Horaira Nutz Natural & Fresh Figs , Anjeer 1kg ( 500g x 2 ) "," 1,498.00 ",649.00,None,None
58, Tata Sampann White Poha 500 g , 53.00 ,35.00,None,None
59, Gowardhan Cow Ghee 1 L (Pack of 2) Pouch With Lock & Seal Container ," 1,450.00 ","1,249.00",None,None
60, Besan 500 g , 95.00 ,45.00,None,None
61, Daawat Rozana Super Basmati Rice 1 kg , 98.00 ,75.00,None,None
62, Good Life Thick Poha / Aval 1 kg , 75.00 ,63.00,None,None
63, Aashirvaad Multigrain Atta 5 kg , 359.00 ,278.00,None,( 55.60/1 kg)
64, Gulab Gold Filtered Groundnut Oil 5 L ," 1,347.00 ",999.00,None,( 199.80/1 l)
65, Fortune Physically Refined Rice Bran Oil 1 L (Pouch) , 165.00 ,127.00,None,None
66, Saffola Gold Rice Bran Based Blended Oil 3 L , 690.00 ,399.00,None,( 133.00/1 l)
67, Navjeevan 500g Green Cardamom | Green Elaichi ," 2,150.00 ",849.00,None,( 169.80/100 g)
68, Moong Dal 2 kg , 340.00 ,233.00,None,None
69, Good Life MP Wheat Chakki Atta 1 kg , 50.00 ,43.00,None,None
70, Good Life Kabuli Chana 500 g , 134.00 ,111.00,None,None
71, Good Life Jeera 200 g , 305.00 ,175.00,None,( 43.75/50 g)
72, Maida 500 g , 53.00 ,25.00,None,None
73," Farmley Handpicked Gold Makhana ( Fox Nuts) , 500g (Pack of 2, Each 250g) ", 600.00 ,499.00,None,None
74, Chana Dal 2 kg , 240.00 ,167.00,None,None
75, Patanjali Cow Ghee 500 ml (Carton) , 355.00 ,329.00,None,None
76, Besan 1 kg , 190.00 ,90.00,None,None
77, Anjani Anjeer 100% Natural Dry Figs/Anjeer 1 kg ," 1,599.00 ",749.00,None,None
78, Good Life Moong Dal 500 g , 96.00 ,73.00,None,None
79, Nestle EveryDay Ghee 1 L (Carton) , 630.00 ,579.00,None,None
80, Gulab Gold Filtered Groundnut Oil 1 L , 264.00 ,195.00,None,None
81, Daawat Rozana Super Basmati Rice 5 kg , 486.00 ,359.00,None,None
82, 41 foods Almonds Pistachios Cashews Raisins Walnuts Combo Pack | Kaju Pista Badam Akhrot Kishmish (150GM x 5) 750 GM ," 2,799.00 ",716.00,None,None
83, Good Life Chana Dal 500 g , 70.00 ,52.00,None,None
84, Dhara Nourish Vit A E Refined Sunflower Oil 1 L , 150.00 ,112.00,None,None
85, Fortune Rozana Dubar Basmati Rice 5 kg , 585.00 ,429.00,None,None
86, Good Life Whole Moong 500 g , 95.00 ,72.00,None,None
87, Freshtige 100% Natural and Premium Healthy Mix Dry Fruits 1kg(500gms*2)|Fresh and Healthy Dry Fruits ," 1,499.00 ",599.00,None,None
88, Daawat Sonamasoori Rice 10 kg , 816.00 ,605.00,None,( 60.50/1 kg)
89," RED ROSE MINI MONGRA BASMATI RICE, 30 KG "," 1,699.00 ","1,499.00",None,( 49.97/1 kg)
90, Good Life Big Mustard 100 g , 25.00 ,15.00,None,( 7.50/50 g)
91, Sunrich Refined Sunflower Oil 899 g , 152.00 ,102.00,None,None
92, Daawat Rozana Gold Basmati Rice 5 kg , 560.00 ,395.00,None,None
93, India Gate Mogra Basmati Rice 10 kg , 800.00 ,655.00,None,( 65.50/1 kg)
94, 921 CLASSIC BIRYANI SPECIAL BASMATI RICE 5 KG (Long grain 1121 Rice XXXL) , 925.00 ,599.00,None,( 119.80/1 kg)
95, Maggi Masala Ae Magic 6 g (Pack of 12) , 60.00 ,55.00,None,None
96, Regular Value Pack Plain Cashews 500 g , 500.00 ,355.00,None,None
97, Nutraj California Walnuts InShell 1 kg (500gm x 2) ," 1,098.00 ",529.00,None,( 264.50/500 g)
98, Good Life MP Wheat Chakki Atta 5 kg , 275.00 ,199.00,None,( 39.80/1 kg)
99, Nature Fresh Sampoorna Chakki Whole Wheat Atta 10 kg , 460.00 ,379.00,None,( 37.90/1 kg)
100, Nutri Binge 500g Pistachios Roasted & Salted California , 920.00 ,629.00,None,None
101, Elina Long Grain Rice 1 kg , 195.00 ,65.00,None,None
102, GKD's Premium 2 L Pure Coconut Oil Jar , 760.00 ,599.00,None,None
103, Amul Pure Ghee 500 ml (Pouch) , 320.00 ,299.00,None,None
104," Horaira Nutz Premium Dry fruits Combo Pack 500g Almond , Cashews ( Pack of 2 _ Each 250g ) ", 999.00 ,513.00,None,None
105, Good Life Turmeric Powder 100 g , 50.00 ,21.00,None,None
106, Good Life Masoor Dal 500 g , 69.00 ,51.00,None,None
107, RUNUTZ 1kg Cashew Nuts (250g X 4) ," 1,180.00 ",739.00,None,None
108, Wonderland Foods Premium Raisins 500 g , 300.00 ,109.00,None,None
109, Amul Cow Ghee 1 L (Pouch) , 650.00 ,595.00,None,None
110, Good Life Small Brown Chana 500 g , 69.00 ,53.00,None,None
111, Good Life Roasted Chana Dal / Split Bengal Gram 500 g , 80.00 ,55.00,None,None
112, Tata Sampann Unpolished Chilka Moong 500 g , 99.00 ,92.00,None,None
113, Open Secret Kimia Dates 800g Premium Khajur , 500.00 ,281.00,None,None
114, Fortune Rozana Basmati Rice 5 kg Bag + Fortune Rice Bran Health Physically Refined Rice Bran Oil 5 L PET Combo ," 1,425.00 ",949.00,None,None
115, Mother Dairy Cow Ghee 1 L (Pouch) , 685.00 ,575.00,None,None
116, Good Life Green Kishmish 500 g , 183.00 ,129.00,None,None
117, Good Life Moong Dal 1 kg , 189.00 ,145.00,None,None
118, Go Crackers 2kg Broken Walnuts Kernels Amber without Shell (250g x 8) ," 2,360.00 ",857.00,None,None
119, Good Life Almonds 1 kg ," 1,050.00 ",695.00,None,None
120, Aashirvaad Superior MP Whole Wheat Atta 1 kg , 60.00 ,55.00,None,None
121, Nutraj Jumbo California Walnuts in Shell 1 kg , 999.00 ,619.00,None,( 309.50/500 g)
122, Good Life Urad Dal 500 g , 97.00 ,80.00,None,None
123, Annprash White Sugar - 0.5 kg , 499.00 ,148.00,None,None
124," Happilo Essentials Popular Whole Cashew W400 1kg, Healthy Snack, Source of Protein, Vitamin & Minerals, No Preservatives "," 1,350.00 ",889.00,None,None
125, Yogabar 500g Cashews W320 | 100% Natural Premium Whole Cashews | Whole Crunchy Cashew | Premium Kaju nuts | Nutritious & Delicious | Gluten Free & Plant based Protein , 600.00 ,449.00,None,None
126, Broken Wheat / Daliya 500 g , 60.00 ,25.00,None,None
127, Daawat Super Basmati Rice 1 kg , 220.00 ,139.00,None,None
128, Sunny Sun Lite Refined Sunflower Oil 1 L (Pouch) , 185.00 ,102.00,None,None
129, Good Life Unpolished Toor Dal 1 kg , 272.00 ,219.00,None,None
130, Good Life Chilli Powder 100 g , 50.00 ,32.00,None,None
131, Suhana Simla Premium 1 Liter Danedar Cow Ghee | Pure Cow Ghee | 1Liter , 775.00 ,449.00,None,None
132, BLK FOODS Select 500g Cashews Nuts (320 no. Kaju) ," 1,150.00 ",369.00,None,None
133, Rice Villa Rozana Basmati Rice 26 Kg ," 2,600.00 ","1,559.00",None,( 59.96/1 kg)
134, Ziofit 1kg Popular Almonds Calfornia ," 1,250.00 ",799.00,None,None
135, Tulsi California Rozana Value Almonds 1 Kg ," 1,140.00 ",749.00,None,None
136," Farmley Popular California Almonds, 100% Natural, 2 Times Crunchier, 500 g ", 899.00 ,449.00,None,None
137, Good Life Toor Dal 500 g , 134.00 ,106.00,None,None
138, Good Life Chana Dal 1 kg , 138.00 ,99.00,None,None
139, Tata Lite Sodium Curtailed Iodised Salt 1 kg , 50.00 ,45.00,None,None
140, Navjeevan Jeera 500g (Cumin) , 750.00 ,329.00,None,( 65.80/100 g)
141, Jivo Cold Pressed Sunflower Oil 5 Ltr - Chemical free ," 1,350.00 ",799.00,None,None
142, India Gate Rozana Basmati Rice 5 kg , 570.00 ,429.00,None,None
143, 921 CLASSIC BASMATI MOGRA | MUNGRA RICE - 30 KG ," 1,750.00 ","1,299.00",None,( 43.30/1 kg)
144, Gulab Sungold Refined Sunflower Oil 1 L , 150.00 ,91.00,None,None
145, Good Life Compounded Hing Powder 50 g , 95.00 ,55.00,None,None
146, Good Life Soya Wadi / Chunks 200 g , 55.00 ,27.00,None,None
147, Date Crown Premium Fard Dates 500 g , 257.00 ,169.00,None,None
148, Naturoz 1kg Daily Whole Cashews ," 1,125.00 ",795.00,None,None
149, Prabhat Cow Ghee 1 L (Pouch) , 725.00 ,539.00,None,None
150, Molsi's 1Kg Kimia Dates (500gX2) , 550.00 ,345.00,None,None
151, DAIRY SAGAR GOPAL Desi Cow Ghee |Made Traditionally from Curd |Pure Cow Ghee for Better Digestion and Immunity | 1Ltr Tetra Pack , 680.00 ,399.00,None,None
152, Parth Jaggery 950 g , 90.00 ,62.00,None,None
153, Dhara Filtered Groundnut Oil 1 L (Pouch) , 255.00 ,205.00,None,None
154, Gulab Classic Refined Cottonseed Oil 5 L , 782.00 ,555.00,None,( 111.00/1 l)
155, Jubilee Regular Long Grain Rice 1 kg , 190.00 ,63.00,None,None
156, Tata Salt 2 kg , 55.00 ,48.00,None,None
157, Good Life Thick Poha / Aval 500 g , 38.00 ,34.00,None,None
158, Fortune Besan 1 kg , 160.00 ,106.00,None,None
159, Satvikk 1000 gm Premium Almonds Californian 1 KG ," 1,400.00 ",689.00,None,None
160," Farmley 1kg Popular Almonds Californian, 100% Natural, 2 Times Crunchier Badaam "," 1,799.00 ",799.00,None,None
161, Good Life Filtered Groundnut Oil 1 L , 215.00 ,179.00,None,None
162, Nutraj Special Round Raisin 1 Kg (500 g X 2) , 598.00 ,329.00,None,( 32.90/100 g)
163, Pyramid Traders 1KG Kashmiri Mamra Almonds (Badam Giri) ," 4,000.00 ","1,070.00",None,None
164, Nutraj California Walnut Kernels 250g , 499.00 ,319.00,None,None
165, Wonderland Foods Platinum California Pistachios Roasted & Salted 400 g , 725.00 ,409.00,None,None
166, Brill California Almond Daily (500g x 2pkts) 1000g ," 1,600.00 ",739.00,None,None
167, Good Life Urad Dal 1 kg , 191.00 ,159.00,None,None
168, Anjani 1KG Premium Seedless Green Raisins (Kishmish) , 999.00 ,299.00,None,None
169, Tata Sampann Unpolished Kala Chana 500 g , 74.00 ,68.00,None,None
170, Good Life Kabuli Chana 1 kg , 266.00 ,221.00,None,None
171, Gulab Sungold Refined Sunflower Oil 5 L , 700.00 ,479.00,None,( 95.80/1 l)
172," Nutraj 100% Natural Dried Premium California Walnut Kernels, 500g (2 X 250g) ", 998.00 ,549.00,None,( 274.50/250 g)
173, Gemini Refined Sunflower Oil 5 L , 890.00 ,625.00,None,( 125.00/1 l)
174," RED ROSE ROYAL BASMATI RICE 5KG I XXXL BIRYANI RICE I BEST BASMATI RICE FOR BIRYANI, 5 KG "," 1,299.00 ",699.00,None,( 139.80/1 kg)
175, Nature's Choice Arabian Dates 500 g , 200.00 ,99.00,None,None
176, DailyHerbs Anjeer 1kg - Premium Quality Afghani Anjeer | Naturally Dried Figs | Perfect for a Healthy Lifestyle ," 1,299.00 ",539.00,None,None
177, Dalda Vanaspati 1 L , 150.00 ,119.00,None,None
178, Fortune Rozana Basmati Rice 1 kg , 130.00 ,89.00,None,None
179, AweLiv Pure Olive Oil - 1 Ltr (Imported from Spain) ," 1,350.00 ",375.00,None,None
180, Farmley Whole Cashews Natural Raw W400 Kaju 500g , 749.00 ,399.00,None,None
181," English Nuts Mixed Dry Fruit, Nuts, Seeds, Berries - 1kg Trial Mix| 10+ Varieties | Lowest Price I "," 3,000.00 ",519.00,None,None
182, GO KITCHEN Afghanistan Afghani Anjeer Figs Big Size Anjir Dried Figs Zero Added Sugar & Preservatives Dry Fruit (Pack of 250 gram) , 359.00 ,249.00,None,None
183, GKD's Premium Pure Coconut Oil Jar (1 L) , 380.00 ,299.00,None,None
184," GUNJAL SILKY PARMAL RICE, 30 KG "," 1,699.00 ","1,649.00",None,( 54.97/1 kg)
185, Good Life Brown Chana 1 kg , 136.00 ,105.00,None,None
186, Farmley Handpicked Gold Makhana ( Fox Nuts) 250g , 300.00 ,269.00,None,None
187, Good Life Whole Moong 1 kg , 188.00 ,143.00,None,None
188, Sundrop SuperLite Advanced Refined Sunflower Oil 3 L ,489.00,489.00,None,( 163.00/1 l)
189, India Gate Super Basmati Rice 5 kg ," 1,080.00 ",729.00,None,None
190, Amul Cow Ghee 500 ml (Pouch) , 325.00 ,308.00,None,None
191, Lali Balaji DAILY NUT California Almond VALUE 1000gm (250gm x pack of 4) ," 1,240.00 ",689.00,None,None
192, Anjani Popular Cashews/Kaju 1 kg ," 1,599.00 ",799.00,None,None
193, Good Life Phool Makhana 250 g , 300.00 ,249.00,None,None
194, Aashirvaad Chilli Powder 100 g , 72.00 ,36.00,None,None
195, Foodcan Kismis 1 Kg Black Afghani Raisin Dakh (Kishmis) 1 Kg Saver Pack ," 1,000.00 ",299.00,None,None
196, Puro Healthy Salt 1 kg , 110.00 ,95.00,None,None
197," Pawan Foods ""Paaritosh"" Premium Kacchi Ghani Mustard Oil 2 Litre | Sarso ka Tel Pure | Khusi ke Sath, Bhojan ka Swad | Natural with Healthy | kali Sarso ka Tel ", 520.00 ,425.00,None,None
198, OM+ Filtered Groundnut Oil Pouch 5 ltr (Pack of 5) ," 1,500.00 ",939.00,None,None
199, Kasturika Mini Mogra Steam Basmati 10 Kg Rice , 930.00 ,579.00,None,( 57.90/1 kg)
200, Gemini Filtered Groundnut Oil 1 L , 230.00 ,199.00,None,None
201, ALEMA MOGRA BASMATI RICE 30KG ," 4,451.00 ","1,499.00",None,( 49.97/1 kg)
202," Grocery On The Go MIX DRY FRUITS Almonds, Apricots, Cashews, Pistachios, Walnuts, Raisins 250GM ", 578.00 ,288.00,None,None
203, Tata Sampann Unpolished Tur / Arhar Dal 1 kg , 289.00 ,259.00,None,None
204, BLK Foods 1Kg Indian Kishmish | Big Size Raisins ( 500g x 2) ," 1,400.00 ",349.00,None,None
205," Marwar Red Chili Powder 1 Kg (Lal Mirchi Powder | Red Chilly Powder, Agmark Grade) 1 Kilogram Pack ", 560.00 ,279.00,None,None
206, Good Life Mixed Dry Fruits 500 g , 450.00 ,289.00,None,None
207, Good Life Dry White Peas 500 g , 67.00 ,61.00,None,None
208, Smith & Jones Ginger Garlic Paste 200 g , 50.00 ,29.00,None,( 14.50/100 g)
209, Lotus Spices Green Elaichi 10 g , 39.00 ,28.00,None,None
210, Fortune Soya Wadi / Chunks 200 g , 60.00 ,55.00,None,None
211, Dhara Health Refined Sunflower Oil 5 L , 780.00 ,599.00,None,( 119.80/1 l)
212, Good Life Jeera 1 kg ," 1,450.00 ",715.00,None,( 35.75/50 g)
213, Good Life Chitra Rajma 500 g , 112.00 ,97.00,None,None
214, Daawat Devaaya Basmati Rice 5 kg , 720.00 ,539.00,None,None
215, 921 CLASSIC BASMATI MOGRA | MUNGRA RICE - 10KG , 625.00 ,529.00,None,( 52.90/1 kg)
216, Good Life Unpolished Moong Dal 500 g , 103.00 ,79.00,None,None
217, LILA DRY FRUITS 500gms x 2 (1 Kgs) Mason Jar Pack Premium Dried Afghani Anjeer| Dried Figs ," 1,499.00 ",659.00,None,None
218, Pansari Kachi Ghani Mustard oil/Sarso Cooking Oil| Good for Bones & Heart| - 3 Litre , 759.00 ,519.00,None,None
219," VEEDINT CUMIN SEEDS, JEERA WHOLE, CUMIN SEED WHOLE, 1 KG PACK ", 950.00 ,785.00,None,None
220, Kitchen Jungle Premium Dry Figs| Anjeer - 1kg FIGS | Dry Anjir (Dried Figs) ," 1,799.00 ",599.00,None,None
221," BANIYYA SETH Dried Afghani Anjeer / Figs, Rich in Iron, Fibre & Vitamins, Low in calories and Fat Free | Source of Dietary Fiber, 1 KG "," 1,299.00 ",549.00,None,None
222, Good Life Unpolished Moong Dal 1 kg , 202.00 ,155.00,None,None
223, Nutraj Gold Walnut Kernels 250 grams| Walnut without Shell Kernels| Akhrot Giri Dry Fruit , 435.00 ,319.00,None,( 319.00/250 g)
224, Molsi's 1kg Arabian Black Dates (500gX2) , 480.00 ,375.00,None,None
225, Being Vegan Afghani Anjeer Figs Afghanistan Dry Anjir Dried Figs Dry Fruits (500 Grams) ," 1,679.00 ",363.00,None,None
226," Eatyumm Indian Poppy Seeds / Khus Khus / Posto Dana,400 Gram "," 2,000.00 ",549.00,None,None
227, Ching's Secret Schezwan Fried Rice Masala 20 g , 10.00 ,9.00,None,None
228, Brill Kishmish (Green Raisin) (500g x 2pkt) 1Kg , 700.00 ,300.00,None,None
229, Sagar Pure Ghee 1 L (Pouch) , 635.00 ,579.00,None,None
230, Good Life Jeerasar Rice 1 kg ,53.00,53.00,None,None
231, Fortune Mini Mogra Basmati Rice 10 kg , 700.00 ,499.00,None,( 49.90/1 kg)
232, BLK Foods 1Kg Cashew ( 200g x 5) ," 2,450.00 ",799.00,None,None
233, Tata Sampann Unpolished Kabuli Chana 500 g , 160.00 ,148.00,None,None
234, Good Life Phool Makhana 100 g , 150.00 ,119.00,None,None
235," Foodcan Dried Apricots 1 Kg | Khumani Khurbani, Jardalu Dry Fruit Badam Bor| Dry Fruits | 1 Kg Saver Pack "," 1,500.00 ",349.00,None,None
236, Nutri Binge California Almonds 200g (200g x 2) , 540.00 ,349.00,None,None
237, Angur Oily Toor Dal 5Kg ," 1,500.00 ","1,300.00",None,( 260.00/1 kg)
238, Good Life Whole Masoor 500 g , 65.00 ,52.00,None,None
239, Good Life Idli Rice 1 kg , 95.00 ,57.00,None,None
240, Everest Tikhalal Chilli Powder 100 g , 68.00 ,63.00,None,None
241, Kashmir Exotics Kashmiri Walnut Kernels Light Brown Halves Vacuum Packed 400 G , 749.00 ,425.00,None,None
242, Tata Sampann Unpolished Gota Urad 1 kg , 224.00 ,208.00,None,None
243, Gulab Filtered Groundnut Oil 15 L ," 3,862.00 ","3,069.00",None,( 204.60/1 l)
244," Eatyumm Cardamom Green Whole - Grade - Big Size, 100g(Hari elaichi) - Premium Bold Size ", 599.00 ,299.00,None,None
245, Good Life Walnut Kernels 500 g , 750.00 ,659.00,None,None
246, Good Life Black Raisin 500 g , 280.00 ,189.00,None,None
247, ERAVAT Parmal 30kg Rice | Silky Parmal I TAKA TAK RICE ," 1,800.00 ","1,570.00",None,( 52.33/1 kg)
248, Notlih 1Kg Premium Raisins | Indian Green Kishmish | (Pack Of 2 - 500g Each) ," 1,000.00 ",348.00,None,None
249, India Gate Dubar Basmati Rice 1 kg , 159.00 ,132.00,None,None
250, NAVJEEVAN BLACK PEPPER 500g. , 820.00 ,349.00,None,None
251, Dhara Filtered Groundnut Oil 5 L ," 1,300.00 ","1,049.00",None,( 209.80/1 l)
252, Notlih 500g Green Cardamom | Hari Elaichi | Whole Elaichi | Premium Quality ," 3,000.00 ",999.00,None,None
253, BLK Foods Select 1Kg Californian Almond Kernel | American Jumbo size Healthy Badam Giri Nuts (500g x 2packs) ," 2,300.00 ",749.00,None,None
254, Anjani Daily California Almond (Badam) 1 Kg ," 1,319.00 ",699.00,None,None
255," Pawan Foods ""Paaritosh"" Premium Kacchi Ghani Mustard Oil, 5Ltr | Khushi Ke Saath, Bhojan Ka Swaad (5Ltr) Mustard Oil Tin (5 L) "," 2,360.00 ",999.00,None,None
256, Parmatma | Kachi Ghani Pure Mustard Oil | Good for Heart | Cholesterol Free | Fortified with vitamin D | Delicious food | Ideal for cooking food - 500ml ,87.00,87.00,None,None
257, Good Life California Roasted & Salted Pista 500 g ,569.00,569.00,None,None
258, Poorvigam Wooden Cold Pressed Groundnut Oil| Peanut Oil| 5 LTR ," 3,750.00 ","1,399.00",None,( 279.80/1 l)
259, Good Life HMT Kolam Rice 30 kg ," 1,750.00 ","1,359.00",None,( 45.30/1 kg)
260," Horaira Nutz Premium Dry fruits Combo Pack 750gm Cashew , Almond , Raisins (Pack of 3 Each 250gm) "," 1,300.00 ",570.00,None,None
261, Marwar Mirchi (Red Chilly powder-500g) + Haldi (Turmeric powder-200g) + Dhania (Coriander powder-200g) Agmark Spices Super Saver Combo Pack of 900g , 388.00 ,229.00,None,None
262, Aashirvaad Superior MP Whole Wheat Atta 2 kg , 119.00 ,109.00,None,( 54.50/1 kg)
263, Nature's Bliss Calcutta Meetha Paan Mouth Freshner Paan mukhwas Without Supari Jar Packing FD Quality Product (400gm) , 449.00 ,189.00,None,None
264, Good Life Big Fennel 100 g , 120.00 ,89.00,None,( 44.50/50 g)
265, Good Life Whole (W320) Cashews 100 g , 120.00 ,99.00,None,None
266, Foodcan Raisins 1 Kg Original Afghani Kismis Dakh Green Long Size (Kishmis) Seedless 1 Kg Supersaver Pack ," 1,500.00 ",299.00,None,None
267, Bioherbs 100% Natural Premium International California Almond 1 kg (Pack of 2) ," 3,598.00 ","1,399.00",None,None
268, Happilo 500g Popular Almond California , 625.00 ,434.00,None,None
269, Fortune Everyday Full Grain Basmati Rice 5 kg , 845.00 ,542.00,None,None
270, Tata Sampann Unpolished Urad Dal 1 kg , 224.00 ,208.00,None,None
271, Catch Kasuri Methi 25 g , 30.00 ,20.00,None,None
272, Oreal 6L Premium Canola Oil | Healthy Cooking Oil | Rich Natural Anti Oxidants | Preservative Free |5+1 Litres ," 2,050.00 ","1,154.00",None,( 192.33/1 l)
273, Good Life Chilka Urad Dal 500 g , 92.00 ,76.00,None,None
274, Good Life Unpolished Chana Dal 1 kg , 142.00 ,111.00,None,None
275, Daawat Premium Lachkari Wada Kolam Rice 10 kg , 950.00 ,699.00,None,( 69.90/1 kg)
276," Farmley 8 in 1 Tasty Berry Mix Antioxidants Rich, Mix Dried Berries 400g(Pack of 2, Each 200 g) ", 698.00 ,379.00,None,None
277," GO KITCHEN Healthy Dry Fruit Dried Figs Afghani Anjeer|Afghani Anjeer Figs Dry Fruits Anjir (Dried Figs) Dry Fruits Anjeer Big and Soft, 800gm Pack "," 2,999.00 ",484.00,None,None
278, Guinea Filtered Groundnut Oil 15 L ," 3,600.00 ","2,990.00",None,( 199.33/1 l)
279, Good Life Turmeric Powder 500 g , 240.00 ,99.00,None,None
280," ENVELOPE DRYFRUITS - THE WORLD OF FRESHNESS MIX DRYFRUITS TRIAL MIX 1 KG , PACK OF 2 X 500 GRAMS PREMIUM QUALITY "," 3,000.00 ",525.00,None,None
281, Veganic Unrefined Desi Khand/Khhand | Khandsari Sugar | Sulphur-free Khand | Mishri Powder | Semi Crystal Sugar | Full Of Minerals & Nutrients (900g) , 499.00 ,215.00,None,None
282, Good Life Soya Wadi / Chunks 500 g , 135.00 ,67.00,None,None
283, Vandevi Bandhani No 1 Hing Powder 50 g , 80.00 ,40.00,None,None
284, Bharat Super Foods Dry Fruits Combo Pack - California Almonds & Cashew Nuts W320 - 100gm each (200gm) , 488.00 ,238.00,None,None
285," YUM YUM Dry Fruits Combo Pack 1Kg (Almonds 250g, Cashew 250g, Pista 250g, Kishmish 250g) "," 1,850.00 ",879.00,None,None
286, Wheatkart Whole Wheat Atta - 10 KG , 749.00 ,559.00,None,( 55.90/1 kg)
287," Aeroplane Daily Basmati Biryani Rice, 5 Kg ", 825.00 ,449.00,None,( 89.80/1 kg)
288, Sonai Rich Aroma Danedaar Ghee 1 L (Pouch) , 610.00 ,499.00,None,None
289, Satvikk 1000 gm Premium Almonds Californian (500 gmX2) ," 1,400.00 ",699.00,None,None
290, Nutraj California Roasted & Salted Pistachios 250 g | Crunchy & Healthy | Rich in Vitamin & Minerals , 499.00 ,369.00,None,None
291, Pyramid Traders 1 KG Brown Plus Kashmiri Walnut Kernels (Without Shell) Akrot Giri ," 1,999.00 ",695.00,None,None
292, Wonderland Foods Dry Fruits California Almonds 250g & Cashews W320 250g Combo Pack , 949.00 ,449.00,None,None
293, Dev Bhog Mogra Rice 30 Kg ," 3,400.00 ","1,499.00",None,( 49.97/1 kg)
294, Aeroplane Shudh Chakki Atta| 10 Kg , 450.00 ,419.00,None,( 41.90/1 kg)
295, Coreganic Premium Afghani Jumbo Anjeer 1 kg ," 1,449.00 ",719.00,None,None
296, Marwadi Farm Anjeer Figs 1kg ," 1,400.00 ",499.00,None,( 249.50/500 g)
297, Meewa 1 Kg Premium Walnut Quarter Kernels | Akhrot Giri 1000 Grams | Lowest Price | Best Quality | Vaccum Packed | Pack of 2 x 500 Grams | ," 3,000.00 ",779.00,None,None
298, Kinsfolk 1 L Extra Virgin Olive Oil - (Imported Oil from Spain) ," 1,100.00 ",499.00,None,None
299, Bemisal Premium Shahi Pakwan Rice 1 kg , 172.00 ,62.00,None,None
300, TEMPERADO 100% Natural Premium 1000gms Whole Cashews | Whole Crunchy Cashew | Premium Kaju nuts | Nutritious & Delicious | Gluten Free | Source of Minerals & Vitamins | Dry Fruits ," 1,899.00 ",699.00,None,None
301, EPOK BOLA 1 kg Cashews| Daily Cashews | 1 kg (500gx2) | Value Pack ," 1,200.00 ",748.00,None,( 397.87/500 g)
302, Good Life Red Rajma 500 g , 115.00 ,101.00,None,None
303, FRESHTIGE 100% Natural and Premium Healthy Mix Dry Fruits 1KG Nuts | Fresh and Healthy Dry Fruits ," 1,299.00 ",664.00,None,None
304, Paaritosh Mridang 2 Litre Sesame Oil Can | Premium Cold Pressed Sesame/Gingelly Oil (Til Ka Tel)| , 750.00 ,599.00,None,None
