Unnamed: 0,Product name,MRP,Selling Price,Tag,PerUnitPrice,Brand,Quantity,Unit,Is Pack of,Discount,Discount Percentage,Price Per Unit(Kg/L)
660, KEYA Oregano -10 g and Red Chilli Flakes -40 g Combo ,208.0,176.0,,,KEYA,10.0,g,False,32.0,15.38,17600.0
661," Farmbean Millets 5Kg Combo Pack of 10 | Foxtail, Kodo, Little, Barnyard, Browntop Millet| Low GI | Nutrient Powerhouse, High Protein & More Fibre than Rice ",2499.0,1099.0,,,FARMBEAN,5.0,kg,True,1400.0,56.02,219.8
662, BANIYA SETH Handpicked Lotus Seeds / Fox Nuts Big Size Phool Makhana (Pop / Gorgon Nut Puffed Kernels ) (100g) ,399.0,249.0,,,BANIYYA SETH,100.0,g,False,150.0,37.59,2490.0
663, RENTIO Oiled Toor Dal 2 kg | Premium Desi oiled Tur/Arhar Dal | 2 Packs of 1 kg each ,620.0,559.0,,,RENTIO,2.0,kg,False,61.0,9.84,279.5
664, Everest Chicken Masala 50 g ,47.0,43.0,,( 86.00/100 g),EVEREST,50.0,g,False,4.0,8.51,860.0
665, Tata Sampann Unpolished Whole Urad 500 g ,113.0,105.0,,,TATA SAMPANN,500.0,g,False,8.0,7.08,210.0
666, Rishi Pure Kimia Dates Gold Premium Dried Dates 600gm ,699.0,329.0,,,RISHI PURE,600.0,gm,False,370.0,52.93,548.33
667, KAUL's 100% Natural Premium 1Kg (500 gms Pack of 2) Whole Cashews| Nutritious & Delicious Big Size Kaju ,1999.0,699.0,,,KAUL'S,1.0,kg,True,1300.0,65.03,699.0
668, Organic Tattva Tur / Arhar Dal 1 kg ,295.0,232.0,,,ORGANIC TATTVA,1.0,kg,False,63.0,21.36,232.0
669, Fortune Biryani Special Basmati Rice 5 kg ,1050.0,789.0,,,FORTUNE,5.0,kg,False,261.0,24.86,157.8
670, Saffola Tasty Pro Fitness Concious Corn Based Blended Edible Vegetable Oil 5 L ,805.0,649.0,,( 129.80/1 l),SAFFOLA,5.0,l,False,156.0,19.38,129.8
671, Pink Delight Seedless Tamarind| Sabut Imli| Bina Beej Imli | 1 Kg ,480.0,260.0,,,PINK DELIGHT,1.0,kg,False,220.0,45.83,260.0
672, Trinetra Sugar 5 kg ,1999.0,499.0,,,TRINETRA,5.0,kg,False,1500.0,75.04,99.8
673, Suhana Paneer Butter Masala Mix 50 g ,45.0,36.0,,,SUHANA,50.0,g,False,9.0,20.0,720.0
674, Pillsbury Multigrain Atta 5 kg ,352.0,264.0,,( 48.00/1 kg),PILLSBURY,5.0,kg,False,88.0,25.0,52.8
675, Kimia Dates | Original Kimia Dates | 500 Gm Each | Pack of 2 | 1 Kg ,550.0,480.0,,,KIMIA DATES,500.0,gm,True,70.0,12.73,960.0
676, Shreeja Premium Makhana 1 kg Phool Makhana | Lotus Seeds (Makhana) ,999.0,638.0,,,SHREEJA,1.0,kg,False,361.0,36.14,638.0
677, Eco Herbs Coconut Dried Copra 1 kg ,399.0,289.0,,,ECO HERBS,1.0,kg,False,110.0,27.57,289.0
678, Farmley 200g Broken Walnuts Kernels Premium ,360.0,239.0,,,FARMLEY,200.0,g,False,121.0,33.61,1195.0
679," Sangamam Rice, Sastha Sona Masoori Rice (26 Kg) , Broken Rice, Premium Sona Masoori Rice ",1799.0,1479.0,,( 56.88/1 kg),SANGAMAM RICE,26.0,kg,False,320.0,17.79,56.88
680, HAYYAN Own Farm Chemical free Sun dried Half Cut Coconuts ( Copra) - 400 gm ,350.0,170.0,,,HAYYAN,400.0,gm,False,180.0,51.43,425.0
681, Ching's Secret Schezwan Fried Rice Masala 100 g (5 Sachets) ,60.0,49.0,,( 49.00/100 g),CHING'S SECRET,100.0,g,False,11.0,18.33,490.0
682, Ching's Secret Veg Manchurian Masala 20 g ,10.0,9.0,,,CHING'S SECRET,20.0,g,False,1.0,10.0,450.0
683, Catch Coriander Powder 500 g ,205.0,137.0,,( 27.40/100 g),CATCH,500.0,g,False,68.0,33.17,274.0
684," Yogabar Almonds 1 kg (500g Pack of 2)| 100% Premium California Dried Almonds |Badam Giri Nuts & Dry Fruits| Rich in Fiber, vitamin E, Magnesium, Calcium & Boost Immunity| Healthy Badami Snacks ",1150.0,799.0,,,YOGABAR,1.0,kg,True,351.0,30.52,799.0
685, Pink Delight Triple Refined Bura | Handmade | Sugar Powder | Kand | 500 Gm Pack ,200.0,149.0,,,PINK DELIGHT,500.0,gm,False,51.0,25.5,298.0
686, Daawat Biryani Basmati Rice 1 kg ,235.0,195.0,,,DAAWAT,1.0,kg,False,40.0,17.02,195.0
687, Nature's Choice Royale Fard Dates 500 g ,250.0,165.0,,,NATURE'S CHOICE,500.0,g,False,85.0,34.0,330.0
688, Tulsi California Inshell Walnuts 1 kg ,775.0,499.0,,,TULSI,1.0,kg,False,276.0,35.61,499.0
689, Aashirvaad Kashmiri Mirch Powder 100 g ,140.0,70.0,,,AASHIRVAAD,100.0,g,False,70.0,50.0,700.0
690, Molsi's 400g Dry Roasted and Salted Pistachios (200gX2) ,750.0,485.0,,,MOLSI'S,400.0,g,False,265.0,35.33,1212.5
691, Pink Delight Natural Organic Jaggery Cubes | Purest Jaggery | No Preservatives/Chemicals| 500 Gm Jar ,300.0,198.0,,,PINK DELIGHT,500.0,gm,False,102.0,34.0,396.0
692, Khari Foods 1kg Almonds | California Badam Dry Fruit | Healthy Snacks ,1599.0,689.0,,,KHARI FOODS,1.0,kg,False,910.0,56.91,689.0
693, Nuts About You WALNUT Inshell 1 kg ,900.0,520.0,,,NUTS ABOUT YOU,1.0,kg,False,380.0,42.22,520.0
694, GKD's Premium 100% Pure Coconut Oil Jar 1L (Pack of 2) ,760.0,599.0,,,GKD'S PREMIUM,1.0,l,True,161.0,21.18,599.0
695, Tata Sampann Turmeric Powder 100 g ,41.0,32.0,,,TATA SAMPANN,100.0,g,False,9.0,21.95,320.0
696," Blueberry Dried without Sugar |Organic, 100% Natural, 0% Preservatives, Vegan, Sugar Free Imported Berries ",499.0,265.0,,,THE BERRY PEOPLE - FINEST BERRIES FOR FINEST PEOPLE,,none,False,234.0,46.89,
697, Jivo Gold Refined Oil Blend of Rice Bran oil & Sunflower oil 5 litre ,1049.0,749.0,,,JIVO,5.0,litre,False,300.0,28.6,
698, The Oil Factory Cold Pressed Organic Sesame Oil - 500 Ml ,360.0,180.0,,( 360.00/1 l),THE OIL FACTORY,500.0,ml,False,180.0,50.0,360.0
699, Double Horse Palakkadan Matta Rice 5 kg ,380.0,365.0,,,DOUBLE HORSE,5.0,kg,False,15.0,3.95,73.0
700, Pyramid Traders 1 KG Kashmiri Walnuts ,1500.0,450.0,,( 225.00/500 g),PYRAMID TRADERS,1.0,kg,False,1050.0,70.0,450.0
701, Long Live Extra Virgin Olive Oil (( Cold Pressed)) - 1 Ltr ,1100.0,449.0,,( 449.00/1 l),LONG LIVE,1.0,ltr,False,651.0,59.18,449.0
702, Haldiram's Nagpur Fancy Dry Fruits Gift Box (WW) ,375.0,375.0,,,HALDIRAM'S NAGPUR,,none,False,0.0,0.0,
703, JD NUTS Dry Fig Afghani Anjeer Figs Afghanistan Dry Anjir Dried Anjeer Dry Fruits Pouch Pack 1 Kg ,1299.0,484.0,,,JD NUTS,1.0,kg,False,815.0,62.74,484.0
704, SHAAN-E-SHAUKAT 1121 MONGRA 30 KG BASMATI RICE - BEST MONGRA ,2800.0,1699.0,,( 56.63/1 kg),SHAAN-E-SHAUKAT,1121.0,mongra,False,1101.0,39.32,
705, Tata Sampann Chilli Powder 100 g ,73.0,58.0,,,TATA SAMPANN,100.0,g,False,15.0,20.55,580.0
706," Sri Sri Tattva Chana Dal - Split Bengal Gram, 1kg x Pack of 2 ",250.0,212.0,,,SRI SRI TATTVA,1.0,kg,True,38.0,15.2,212.0
707, Smith & Jones Pasta Masala 98 g ,70.0,55.0,,( 56.12/100 g),SMITH & JONES,98.0,g,False,15.0,21.43,561.22
708, Nutrela Soya Granules 200 g ,60.0,54.0,,,NUTRELA,200.0,g,False,6.0,10.0,270.0
709," Wheatkart Kitchen Basket ( Atta,Maida,Sooji,Besan) ",1396.0,699.0,,( 60.78/1 kg),WHEATKART,,none,False,697.0,49.93,
710, Tata Sampann Turmeric Powder 200 g ,76.0,60.0,,,TATA SAMPANN,200.0,g,False,16.0,21.05,300.0
711, Molimor Unrefined Ground nut oil/100% PURE/15 KG ,3800.0,3750.0,,( 237.34/1 kg),MOLIMOR,15.0,kg,False,50.0,1.32,250.0
712, Dr. Brand Sakariya / Prasad Sugar 150 g ,16.0,14.0,,,DR. BRAND,150.0,g,False,2.0,12.5,93.33
713, Eatyumm Cumin Seeds (Jeera) 1kg|Kitchen Spice|Organic Farm Jeera Cumin Seeds jeera ,1499.0,799.0,,,EATYUMM,1.0,kg,False,700.0,46.7,799.0
714, Tata Sampann Chaat Masala 100 g ,80.0,40.0,,( 40.00/100 g),TATA SAMPANN,100.0,g,False,40.0,50.0,400.0
715, GKD's Premium 100% Pure Coconut Oil Pouch 1 L ,330.0,269.0,,,GKD'S PREMIUM,1.0,l,False,61.0,18.48,269.0
716, Good Life Big Brown Chana 1 kg ,185.0,145.0,,,GOOD LIFE,1.0,kg,False,40.0,21.62,145.0
717, Nature Aahar's Premium 1kg Anjeer - Delicious and Nutritious Dry Figs ,1999.0,499.0,,( 249.50/500 g),NATUREAAHAR,1.0,kg,False,1500.0,75.04,499.0
718, Catch Red Chilli Powder 500 g ,300.0,200.0,,,CATCH,500.0,g,False,100.0,33.33,400.0
719, BLK Foods Select 1.0Kg Jumbo Super Crunchy Almonds Californian ,2250.0,897.0,,,BLK FOODS,1.0,kg,False,1353.0,60.13,897.0
720, Marwar Combo Pack of | Pumpkin Seeds + Sunflower Seeds | 250 Gms Each | Pack of 2 ,800.0,299.0,,,MARWAR,250.0,gms,True,501.0,62.62,
721, Nutrela Soya Chunks / Wadi 1 kg ,210.0,149.0,,,NUTRELA,1.0,kg,False,61.0,29.05,149.0
722," Dhampur Green 800g Organic Jaggery Powder | 100% Organic, 100% Pure & 100% Chemical Free | Jaggery Powder For Tea and Coffee , Milk, Mithai Sweets ",199.0,197.0,,( 246.25/1 kg),DHAMPUR GREEN,800.0,g,False,2.0,1.01,246.25
723," RRAAMS Healthy Phool Makhana (Fox nuts/Lotus Seeds) , Total 750 gms (Pack of 3 x 250 gms) ",897.0,499.0,,,RRAAMS FOOD INTERNATIONAL,750.0,gms,True,398.0,44.37,
724, India Gate Classic Basmati Rice 5 kg ,1170.0,899.0,,,INDIA GATE,5.0,kg,False,271.0,23.16,179.8
725," YUM YUM 1 kg California Almonds, 100% Natural Badam Giri Dry Fruits ",1850.0,799.0,,,YUM YUM,1.0,kg,False,1051.0,56.81,799.0
726, Kanaiya Murmura 500 g ,60.0,45.0,,,KANAIYA,500.0,g,False,15.0,25.0,90.0
727, Snapin Pizza Seasoning Combo 42 g ,60.0,49.0,,( 11.67/10 g),SNAPIN,42.0,g,False,11.0,18.33,1166.67
728, Kriti Refined Sunflower Oil - 5L Square Jar (Pack of 1) ,749.0,649.0,,( 129.80/1 l),KRITI,5.0,l,True,100.0,13.35,129.8
729, India Gate Weight Watchers Special Brown Rice 1 kg ,152.0,132.0,,,INDIA GATE,1.0,kg,False,20.0,13.16,132.0
730, SURYA 200gm CINNAMON STICKS (DALCHINNI) | WHOLE SPICES| HERBS ,175.0,169.0,,( 84.50/100 g),SURYA,200.0,gm,False,6.0,3.43,845.0
731, Everest Sabji Masala 100 g ,72.0,66.0,,( 66.00/100 g),EVEREST,100.0,g,False,6.0,8.33,660.0
732, Good Life Lokwan Wheat 10 kg ,600.0,369.0,,( 36.90/1 kg),GOOD LIFE,10.0,kg,False,231.0,38.5,36.9
733," GreenFinity Mix Dry Fruits and Nuts, 500g [Almonds, Pistachios, Walnuts, Cashew, Pumpkin, Cranberry, Black Raisin] Healthy Gift Hamper for Every Occasion Fresh and Healthy Dry Fruits, Seeds & Nuts. ",994.0,399.0,,,GREENFINITY,500.0,g,False,595.0,59.86,798.0
734," Farmley Premium California Roasted & Salted Pistachios 400g, Pack of 2 Each- 200g ",738.0,549.0,,,FARMLEY,400.0,g,True,189.0,25.61,1372.5
735, Good Life Kalimunch Raw Rice 1 kg ,65.0,65.0,,,GOOD LIFE,1.0,kg,False,0.0,0.0,65.0
736, Everest Turmeric Powder 500 g ,180.0,153.0,,,EVEREST,500.0,g,False,27.0,15.0,306.0
737," GreenFinity Raw Chia Seeds, Flax Seeds, Pumpkin Seed, Sunflower Seed, Watermelon Seeds & Muskmelon Seeds Combo(950g, Pack of 6) ",699.0,545.0,,,GREENFINITY,950.0,g,True,154.0,22.03,573.68
738, Nature Fresh Sampoorna Chakki Whole Wheat Atta 5 kg ,240.0,215.0,,( 43.00/1 kg),NATURE FRESH,5.0,kg,False,25.0,10.42,43.0
739, Catch Chicken Masala 100 g ,90.0,45.0,,( 45.00/100 g),CATCH,100.0,g,False,45.0,50.0,450.0
740," Farmley Dry Fruit Seed Mix 400g Chia seeds, Pumpkin seeds, Flax Seed & More Seed, Roasted seeds ",399.0,249.0,,,FARMLEY,400.0,g,False,150.0,37.59,622.5
741," Khari Foods Organic Pure Jaggery Powder 2kgs, Natural Sweetener, No Adulteration ",799.0,349.0,,,KHARI FOODS,2.0,kgs,False,450.0,56.32,
742, Organic Tattva Ragi Millet Flour 500 g ,70.0,46.0,,,ORGANIC TATTVA,500.0,g,False,24.0,34.29,92.0
743, Nature's Bridge Seedless Black Raisins | Dried Kishmish Without Seeds | Raisins- 250 Gm Jar ,399.0,199.0,,,NATURE'S BRIDGE,250.0,gm,False,200.0,50.13,796.0
744, GreenFinity Cardamom Green Whole - 50gm + 50gm Sabut Elaichi Grade - Big Size (Buy 1 Get 1 Free). ,794.0,264.0,,,GREENFINITY,50.0,gm,False,530.0,66.75,5280.0
745, The Oil Factory 5.25L Pomace Olive Oil | Ideal for All Indian Cooking | Imported from Spain ,4500.0,1600.0,,( 304.76/1 l),THE OIL FACTORY,5.25,l,False,2900.0,64.44,304.76
746, ANMOL RICH 26 Kg Raw Sona Masoori Rice ,1999.0,1699.0,,( 65.35/1 kg),ANMOL,26.0,kg,False,300.0,15.01,65.35
747, Fortune Dubar Basmati Rice 1 kg ,149.0,116.0,,,FORTUNE,1.0,kg,False,33.0,22.15,116.0
748, Nutraj Recipe Ready Walnut Kernels 500g (250g X 2) | Akhort Giri 500g | Walnut without Shell ,898.0,519.0,,( 260.49/250 g),NUTRAJ,500.0,g,False,379.0,42.2,1038.0
749, FreshoCartz Dried Figs Premium Quality Afghani Anjir 1 kg ,1599.0,569.0,,,FRESHOCARTZ,1.0,kg,False,1030.0,64.42,569.0
750, Kinsfolk 2 L Pure Coconut Oil (1L pack of 2) ,1500.0,439.0,,( 219.50/1 l),KINSFOLK,2.0,l,True,1061.0,70.73,219.5
751, Navjeevan No.1 Hing Powder 500g. ,700.0,420.0,,,NAVJEEVAN,1.0,hing,False,280.0,40.0,
752, Horaira Nutz Raisins Almonds Cashews Pistachios Combo Pack 1kg(250gm Pack of 4) ,1999.0,859.0,,,HORAIRA NUTZ,1.0,kg,True,1140.0,57.03,859.0
753, FarmNuts-Seedless Green Raisins |kismis| |Dry Grapes| |kishmish| Significantly Lower Blood Pressure (100 gm) ,220.0,149.0,,,FARMNUTS,100.0,gm,False,71.0,32.27,1490.0
754, Good Life Idli Rawa 500 g ,25.0,23.0,,,GOOD LIFE,500.0,g,False,2.0,8.0,46.0
755, Brij gwala Wawa Desi Cow Ghee| Pure Cow Ghee for Better Digestion and Immunity| 1Ltr Tetra-1 ,580.0,399.0,,,BRIJ GWALA,1.0,ltr,False,181.0,31.21,399.0
756," RRAAMS Healthy Phool Makhana (Fox nuts/Lotus Seeds) , Total 250 gms (Pack of 1 x 250 gms) ",299.0,199.0,,,RRAAMS FOOD INTERNATIONAL,250.0,gms,True,100.0,33.44,
757, Kinsfolk 5.25 L Cold Pressed Groundnut Oil Plastic Bottle ,1999.0,1333.0,,( 253.90/1 l),KINSFOLK,5.25,l,False,666.0,33.32,253.9
758, DS AGRO - Whole Raw Broken Cashews - 1 KG | 1/2 Pieces | 500 gm x 2 | Pack of 2 | Pet jar | W320 Grade ,1099.0,649.0,,,DS AGRO,1.0,kg,True,450.0,40.95,649.0
759, The Nature Krafts Jumbo Handpicked Lotus Seeds /Fox Nuts Big Size Phool Makhana 1kg (Pop / Gorgon Nut Puffed Kernels ) ,1599.0,999.0,,,THE NATURE KRAFTS,1.0,kg,False,600.0,37.52,999.0
760, Brij Gwala Desi Cow Ghee |Made Traditionally from Curd |Pure Cow Ghee for Better Digestion and Immunity | 1Ltr Tetra Pack ,580.0,398.0,,,BRIJ GWALA,1.0,ltr,False,182.0,31.38,398.0
761," Angur Chana Dal | 100% Vegan, Unpolished and Gluten Free Dal - 5Kg ",950.0,599.0,,,ANGUR,5.0,kg,False,351.0,36.95,119.8
762," Dry Fruit Hub - Kesar Saffron Original 1gm | Daily Nuts kumkumapuvvu, A+ + Grade Kashmiri Kesar ",449.0,320.0,,,DRY FRUIT HUB,1.0,gm,False,129.0,28.73,320000.0
763," Mr.Gold Refined Sunflower Oil Can, 3L ",870.0,500.0,,,MR. GOLD,3.0,l,False,370.0,42.53,166.67
764, Good Life (W240) Cashews 200 g ,260.0,180.0,,,GOOD LIFE,200.0,g,False,80.0,30.77,900.0
765, Mirchillion 1Kg Kashmiri Chilli Powder Saver Pack ,799.0,639.0,,( 639.00/1 kg),MIRCHILLION,1.0,kg,False,160.0,20.03,639.0
766, NUTRIMIXX Premium Kashmiri Mamra Almonds| 1 Kg | A+ grade Badam| High Protein & Vit E Content ,2899.0,1300.0,,,NUTRIMIXX,1.0,kg,False,1599.0,55.16,1300.0
767, Pick N Cook Matki 500 g ,85.0,77.0,,,PICK N COOK,500.0,g,False,8.0,9.41,154.0
768, Wonderland Foods Premium Roasted & Salted Pistachios 200 g ,390.0,209.0,,,WONDERLAND FOODS,200.0,g,False,181.0,46.41,1045.0
769, Lali Balaji Atul Anjeer 1000gm (250gm x pack of 4) ,1320.0,833.0,,,LALI BALAJI,1000.0,gm,True,487.0,36.89,833.0
770, Wonderland Foods Premium Munch The Healthy Crunch Value Pack Almonds 500 g ,725.0,349.0,,,WONDERLAND FOODS,500.0,g,False,376.0,51.86,698.0
771, Sundrop Lite Sunflower Refined Oil 1 L ,190.0,159.0,,,SUNDROP,1.0,l,False,31.0,16.32,159.0
772, Tilsona Gold Til Oil 1 L ,415.0,375.0,,,TILSONA,1.0,l,False,40.0,9.64,375.0
773, Pinkcity Wellness Cold Pressed Yellow Mustard Oil 4 L | Wood Pressed| 4x 1 Litre Bottle ,1600.0,799.0,,,PINKCITY,4.0,l,False,801.0,50.06,199.75
774, Snapin Pizza Mix 45 g ,99.0,92.0,,( 20.44/10 g),SNAPIN,45.0,g,False,7.0,7.07,2044.44
775, Organic Tattva Kabuli Chana 500 g ,175.0,117.0,,,ORGANIC TATTVA,500.0,g,False,58.0,33.14,234.0
776, Chandan Special Mukhwas 100 g ,45.0,22.0,,( 11.00/50 g),CHANDAN,100.0,g,False,23.0,51.11,220.0
777, La Casa Original Lacha Kashmiri Saffron Kesar 2 Gm (1gx2) ,999.0,349.0,,,LA CASA,2.0,gm,False,650.0,65.07,174500.0
778, Everest Garam Masala 50 g ,52.0,48.0,,( 96.00/100 g),EVEREST,50.0,g,False,4.0,7.69,960.0
779, Ahaar Chana Brown 1Kg /Kala Chana whole ,236.0,236.0,,,AHAAR,1.0,kg,False,0.0,0.0,236.0
780, Goldiee Kashmiri Mirch Powder 100 g ,116.0,58.0,,,GOLDIEE,100.0,g,False,58.0,50.0,580.0
781, RENTIO 5 Kg Oiled Toor Dal | Fresh Premium Desi Oily Tur/Arhar Dal ,1550.0,1319.0,,,RENTIO,5.0,kg,False,231.0,14.9,263.8
782, Everest Turmeric Powder 200 g ,70.0,65.0,,,EVEREST,200.0,g,False,5.0,7.14,325.0
783, Magik Cook Besan Premium Quality 100% Chana Dal Gram Flour (Pack of 500 Gram) ,75.0,75.0,,,MAGIK COOK,500.0,gram,True,0.0,0.0,150.0
784, Sagar Pure Ghee 1 L (Tin) ,650.0,610.0,,,SAGAR,1.0,l,False,40.0,6.15,610.0
785, Good Life Arwa Katarni Rice 10 kg ,700.0,559.0,,( 55.90/1 kg),GOOD LIFE,10.0,kg,False,141.0,20.14,55.9
786," GreenFinity Healthy & Tasty Jumbo Pumpkin, Jumbo Sunflower - 250g, Flax Seeds, Chia Seeds - 300g Jar ",899.0,414.0,,,GREENFINITY,250.0,g,False,485.0,53.95,1656.0
787, Gemini Vanaspati 1 L ,150.0,118.0,,,GEMINI,1.0,l,False,32.0,21.33,118.0
788, Ponkathir White Puttu Podi 1Kg x 2 Pkts(2 Kg) | Soft Puttu| Rice Powder| Export Quality (2Kg) ,244.0,244.0,,,PONKATHIR,1.0,kg,False,0.0,0.0,244.0
789, Tata Sampann Kasuri Methi 25 g ,30.0,15.0,,,TATA SAMPANN,25.0,g,False,15.0,50.0,600.0
790, ANDRAMART- Solitaire Whole Cashew - 1 kg | kaju | Best Quality Cashews from PALASA ,1200.0,649.0,,,ANDRAMART,1.0,kg,False,551.0,45.92,649.0
791," RED ROSE DAILY BASMATI RICE, SUPER MONGRA, RICH AROMA, PERFECT FOR EVERYDAY USE, 10 KG ",999.0,799.0,,( 79.90/1 kg),RED ROSE,10.0,kg,False,200.0,20.02,79.9
792," Happilo Essentials Popular Whole Cashew W400 500g, Healthy Snack, Source of Protein ",675.0,469.0,,,HAPPILO,400.0,500g,False,206.0,30.52,
793, Wonderland Foods Dry Fruits California Almonds 1Kg & Raw Cashew (Kaju) 1Kg W320 Grade Combo Pack ,3400.0,1625.0,,,WONDERLAND FOODS,1.0,kg,False,1775.0,52.21,1625.0
794, Jivo Cold Pressed Canola Oil 1 L (Buy 1 & Get 1 free) ,650.0,469.0,,,JIVO,1.0,l,False,181.0,27.85,469.0
795, DAIRY GOPAL DAIRY MAKHAN 1 Litre Desi Cow Ghee|Immunity Booster and 100% Pure Cow Ghee|Made Traditionally from Curd |Pure Ghee for Better Digestion and Immunity Pure Ghee (Pack of 1) ,680.0,399.0,,,DAIRY GOPAL,1.0,litre,True,281.0,41.32,
796, Khari Foods 1kg Black Kimia Dates | Premium Dates | Healthy Snacks ,699.0,349.0,,,KHARI FOODS,1.0,kg,False,350.0,50.07,349.0
797," Freshtige Dried Premium Afghani Apricots (Khurbani)1000g(1Kgs) Pouch Pack | Vegan,Sun Dried Apricots ",799.0,391.0,,,FRESHTIGE,1000.0,g,False,408.0,51.06,391.0
798," GreenFinity Raw Pumpkin, Sunflower Seeds for Eating Protein and Fibre Rich Food For Immunity Booster Diet Food Pack of 2 - 250g (JAR Pack) ",998.0,354.0,,,GREENFINITY,250.0,g,True,644.0,64.53,1416.0
799, Catch Amchur Powder 50 g ,47.0,31.0,,,CATCH,50.0,g,False,16.0,34.04,620.0
800, Nature Prime Premium Plain Unsalted Pistachio Kernels Without Shell 250G ,1000.0,329.0,,,NATURE PRIME,250.0,g,False,671.0,67.1,1316.0
801, Catch Red Chilli Powder 200 g ,133.0,88.0,,,CATCH,200.0,g,False,45.0,33.83,440.0
802," Dhanush Baan Premium Afghani Black Raisins, Kali Kishmish 500 g - Jar (2 x 250 g) Kismis Dry Fruits ",550.0,261.0,,,DHANUSH BAN,500.0,g,False,289.0,52.55,522.0
803," Dry Fruit Hub Pumpkin Seeds 1Kg - AAA Grade, Raw Pumpkin Seed, Super Diet Food ",1050.0,649.0,,,DRY FRUIT HUB,1.0,kg,False,401.0,38.19,649.0
804, Emperor Seedless Dates 500 g ,280.0,199.0,,,EMPEROR,500.0,g,False,81.0,28.93,398.0
805, Everest Chaat Masala 100 g ,85.0,79.0,,( 79.00/100 g),EVEREST,100.0,g,False,6.0,7.06,790.0
806, SIMAV NATURALLY GOOD Groundnut Oil | Mungfali Ka Tel | Peanut Oil- 15Liter. ,4499.0,3149.0,,( 209.93/1 l),SIMAV NATURALLY GOOD,15.0,liter,False,1350.0,30.01,209.93
807, Jivo Cold Pressed Canola Oil 5 L and Get 1 L Olive Oil Free ,1650.0,1399.0,,( 233.17/1 l),JIVO,5.0,l,False,251.0,15.21,279.8
808, 24 Mantra Organic Ragi Flour 500 g ,65.0,60.0,,,24 MANTRA ORGANIC,24.0,mantra,False,5.0,7.69,
809, Priya Kachi Ghani Mustard Oil 1 L ,189.0,129.0,,,PRIYA,1.0,l,False,60.0,31.75,129.0
810, Gulab Gold Filtered Groundnut Oil 15 L ,3647.0,3069.0,,( 204.60/1 l),GULAB,15.0,l,False,578.0,15.85,204.6
811, 24 Mantra Organic Unpolished Kabuli Chana/White Chickpeas/Chole - 500Gm | Pack of 1 | Chemical Free & Pesticides Free | Adds Variety to Your menu | Goodness Intact ,195.0,195.0,,,24 MANTRA,24.0,mantra,True,0.0,0.0,
812, Good Life Green Raisins/ Kishmish 100 g ,39.0,37.0,,,GOOD LIFE,100.0,g,False,2.0,5.13,370.0
813," Sri Sri Tattva Toor Dal - Split Pigeon Pea, 1kg ",230.0,195.0,,,SRI SRI TATTVA,1.0,kg,False,35.0,15.22,195.0
814, Good Life Apricots 100 g ,80.0,76.0,,,GOOD LIFE,100.0,g,False,4.0,5.0,760.0
815, Dr. Brand Black Salt 200 g ,23.0,21.0,,,DR. BRAND,200.0,g,False,2.0,8.7,105.0
816, Organic Tattva Suji 500 g ,65.0,43.0,,,ORGANIC TATTVA,500.0,g,False,22.0,33.85,86.0
817, THE PRAKRITI FOODS BY KHATIRDAARI Mamra Almond from Fram Fresh 100G ,445.0,222.0,,,THE PRAKRITI FOODS BY KHATIRDAARI,100.0,g,False,223.0,50.11,2220.0
818, Daily Nut Raisin Value 1000gm (250gm x pack of 4) ,480.0,328.0,,,LALI BALAJI,1000.0,gm,True,152.0,31.67,328.0
819, Being Vegan Premium Afghani Farm Dry Dates | Sukha Khajoor | kharak | Chuara Pack of 900 gm Yellow ,799.0,369.0,,,BEING VEGAN,900.0,gm,True,430.0,53.82,410.0
820, Chandan 5 in 1 Mix Mouth Fresheners 200 g ,280.0,140.0,,( 35.00/50 g),CHANDAN,5.0,in,False,140.0,50.0,
821, Nutraj Gold Arabian Dates 500g (Pack of 2) ,398.0,319.0,,,NUTRAJ,500.0,g,True,79.0,19.85,638.0
822, DAIRYSAGAR SHRI NAND KESARI Desi Cow Ghee| Premium Cow Desi Ghee| Pure Cow Ghee for better Digestion and Immunity|| 1ltr JAR (pack of 1) ,680.0,399.0,,,DAIRYSAGAR,1.0,ltr,True,281.0,41.32,399.0
823, Dhara Filtered Groundnut Oil 1 L (Carton) ,245.0,209.0,,,DHARA,1.0,l,False,36.0,14.69,209.0
824, Borges Extra Virgin Olive Oil 1 L ,1400.0,1199.0,,,BORGES,1.0,l,False,201.0,14.36,1199.0
825, SSKE Gift Pack 300 g(Cashew /Almond /Yellow Raisins /Pistachio/Caramel Crunch/Dark Chocolate 15 PCS) ,1050.0,325.0,,,SSKE,300.0,g,False,725.0,69.05,1083.33
826," Farmley Prasadam Raisins Kishmish 400g, Pack of 2 Each- 200g ",398.0,189.0,,,FARMLEY,400.0,g,True,209.0,52.51,472.5
827, TilSona Gold Til Oil 500 ml ,220.0,205.0,,,TILSONA,500.0,ml,False,15.0,6.82,410.0
828, True Elements 7 in 1 Super Seeds Mix 125g - Mix Seeds| Diet Snacks| Roasted Seeds for Eating ,149.0,149.0,,,TRUE ELEMENTS,7.0,in,False,0.0,0.0,
829, Good Life Matta Vada Rice 1 kg ,100.0,75.0,,,GOOD LIFE,1.0,kg,False,25.0,25.0,75.0
830, Wheatkart Whole Wheat Atta - 5 KG ,449.0,319.0,,( 63.80/1 kg),WHEATKART,5.0,kg,False,130.0,28.95,63.8
831, Double Horse Roasted Appam Powder | Roasted Rice Flour | Rice Flour | 500 Grams ,55.0,55.0,,,DOUBLE HORSE,500.0,grams,False,0.0,0.0,
832, Emperor Seeded Dates 500 g (Pack of 2) ,250.0,189.0,,,EMPEROR,500.0,g,True,61.0,24.4,378.0
833, King's Physically Refined Rice Bran Oil 900 g ,185.0,103.0,,,KINGS,900.0,g,False,82.0,44.32,114.44
834, Kinsfolk Extra Virgin Olive Oil (( Imported Olive Oil from Spain) ) -250ml ,310.0,161.0,,,KINSFOLK,250.0,ml,False,149.0,48.06,644.0
835, EATYUMM Green Cardamom Powder 100 Grams| Ilaichi Powder| Elaichi Powder| Aromatic ,499.0,199.0,,,EATYUMM,100.0,grams,False,300.0,60.12,
836, 24 Mantra Organic (S) Mustard 100 g ,35.0,22.0,,( 11.00/50 g),24 MANTRA ORGANIC,24.0,mantra,False,13.0,37.14,
837, Rice Villa | Pure | 26 kg | Gobindo Bhog | Jeera Kasala | Kaima rice ,3640.0,2419.0,,( 93.04/1 kg),"RICE VILLA, DEVICE OF SHIELD, PADDY TREE",26.0,kg,False,1221.0,33.54,93.04
838, Organic Tattva Brown Sugar 1 kg ,160.0,107.0,,,ORGANIC TATTVA,1.0,kg,False,53.0,33.12,107.0
839, Farmley Flax Seeds 200g Alsi Seeds Fibre Rich Flax Seeds for Hair Growth Seeds for Eating ,330.0,109.0,,,FARMLEY,200.0,g,False,221.0,66.97,545.0
840, The Berry People Afghan Black raisin sugarfree | Good for heart | High dietary fibre | Fresh breakfast items | Superfood by The Berry People -50gms ,299.0,111.0,,,THE BERRY PEOPLE - FINEST BERRIES FOR FINEST PEOPLE,50.0,gms,False,188.0,62.88,
841, GKD's Premium 100% Pure Coconut Oil PET Bottle (1L) ,380.0,279.0,,,GKD'S PREMIUM,1.0,l,False,101.0,26.58,279.0
842, Nutraj W450 Cashew Nuts 800g (Pack of 2 x 400g) ,1198.0,669.0,,( 83.63/100 g),NUTRAJ,450.0,cashew,True,529.0,44.16,
843, Desi Kitchen Little Millet 500 g ,75.0,72.0,,,DESI KITCHEN,500.0,g,False,3.0,4.0,144.0
844, Nutraj Munakka Raisin (Abjosh) 400g (200g X 2) ,498.0,369.0,,( 92.25/100 g),NUTRAJ,400.0,g,False,129.0,25.9,922.5
845, Pinkcity Wellness Pure Sesame Oil 1L| Til Oil| Gingelly Oil| Wood Pressed | 1 Litre Bottle ,400.0,375.0,,( 375.00/1 l),PINKCITY,1.0,l,False,25.0,6.25,375.0
846," CHATOKDE Anjeer Figs - Afghanistan Dry Anjir (Dried Figs) Dry Fruits, Increases Immunity & Purify the Blood 1KG ",2000.0,549.0,,,CHATOKDE,1.0,kg,False,1451.0,72.55,549.0
847, MTR Sambar Powder 100 g ,86.0,77.0,,( 77.00/100 g),MTR,100.0,g,False,9.0,10.47,770.0
848, Desi Label Organic Desi Khand khandsari Natural & Unprocessed Raw Sugar | Organic & Unrefined | Unprocessed & Natural | Free from chemicals and preservatives | Substitute to refined white sugar | Immunity booster (Pack Of 2(2 Kg)) ,560.0,357.0,,,DESILABEL,,none,False,203.0,36.25,
849, Suhana Simla Premium 1 Liter Danedar Buffalo Ghee | Pure Buffalo Ghee | 1Liter ,775.0,449.0,,,SUHANA SIMLA,1.0,liter,False,326.0,42.06,449.0
850, Gemini Physically Refined Ricebran Oil 1 L (Pouch) ,180.0,129.0,,,GEMINI,1.0,l,False,51.0,28.33,129.0
851, Good Life Surti Kolam Rice 30 kg ,2400.0,1680.0,,( 56.00/1 kg),GOOD LIFE,30.0,kg,False,720.0,30.0,56.0
852, Suhana Mutter Paneer Spice Mix 50 g ,45.0,36.0,,,SUHANA,50.0,g,False,9.0,20.0,720.0
853, Everest Turmeric Powder 100 g ,38.0,35.0,,,EVEREST,100.0,g,False,3.0,7.89,350.0
854, Everest Black Pepper Powder 50 g ,78.0,72.0,,( 144.00/100 g),EVEREST,50.0,g,False,6.0,7.69,1440.0
855, Pansari Mahak Mogra Basmati Rice 26 kg ,1700.0,1532.0,,,PANSARI,26.0,kg,False,168.0,9.88,58.92
856, Everest Pav Bhaji Masala 50 g ,46.0,42.0,,,EVEREST,50.0,g,False,4.0,8.7,840.0
857, India Gate Jeera Rice 1 kg ,135.0,105.0,,,INDIA GATE,1.0,kg,False,30.0,22.22,105.0
858, Good Life Pulses Mix For Sprout 500 g ,78.0,67.0,,,GOOD LIFE,500.0,g,False,11.0,14.1,134.0
859, Good Life Surekha Rice 10 kg ,650.0,609.0,,( 60.90/1 kg),GOOD LIFE,10.0,kg,False,41.0,6.31,60.9
860, Good Life Soya Granules 200 g ,60.0,30.0,,,GOOD LIFE,200.0,g,False,30.0,50.0,150.0
861," Sri Sri Tattva Rock Salt - Premium Quality 2kg, 1kg x Pack of 2 ",240.0,216.0,,,SRI SRI TATTVA,2.0,kg,True,24.0,10.0,108.0
862," SHIOSC SUN PARUVAR- Refined Sunflower Oil Pouch, 1L ( Pack of 5) ",1150.0,739.0,,,SHIIOSC SUN PARIVAR,1.0,l,True,411.0,35.74,739.0
863, Wondernut Heathy Testy Super Food (Mix nut and Seeds) 500gm Pack of 2 in 250gm ,899.0,345.0,,,WONDERNUT,500.0,gm,True,554.0,61.62,690.0
864, Nupsila Parmal Raw Rice - 25 kg ,2500.0,1390.0,,,NUPSILA,25.0,kg,False,1110.0,44.4,55.6
