Unnamed: 0,Product name,MRP,Selling Price,Tag,PerUnitPrice,Brand,Quantity,Unit,Is Pack of,Discount,Discount Percentage,Price Per Unit(Kg/L)
0, Priya Fortified With Vitamin A & D Refined Sunflower Oil 1 L ,162.0,99.0,,,PRIYA,1.0,l,False,63.0,38.89,99.0
1, ORGANIC GREEN MOONG DAL 1KG ,250.0,188.0, sponsored ,,HOUSE OF VEDA,1.0,kg,False,62.0,24.8,188.0
2, Super Sarvottam Physically Refined Rice Bran Oil 1 L ,199.0,102.0,,,SUPER SARVOTTAM,1.0,l,False,97.0,48.74,102.0
3, Fortune Sunlite Refined Sunflower Oil 1 L ,140.0,114.0,,,FORTUNE,1.0,l,False,26.0,18.57,114.0
4, Fortune Refined Soyabean Oil 1 L ,130.0,115.0,,,FORTUNE,1.0,l,False,15.0,11.54,115.0
5, House of Veda Organic Lobia (Cowpea White) 500g ,117.0,110.0, sponsored ,,HOUSE OF VEDA,500.0,g,False,7.0,5.98,220.0
6, Tata Iodised Salt 1 kg ,28.0,24.0,,,TATA,1.0,kg,False,4.0,14.29,24.0
7, Fortune Premium Kachi Ghani Pure Mustard Oil 1 L ,185.0,146.0,,,FORTUNE,1.0,l,False,39.0,21.08,146.0
8, Chakki Atta 10 kg ,425.0,359.0,,( 35.90/1 kg),PRIVATE LABEL,10.0,kg,False,66.0,15.53,35.9
9, Tur / Arhar Dal 2 kg ,450.0,355.0,,,PRIVATE LABEL,2.0,kg,False,95.0,21.11,177.5
10, Good Life Pure Crystal Sugar (M) 5 kg ,275.0,229.0,,,GOOD LIFE,5.0,kg,False,46.0,16.73,45.8
11, Nutri Binge 200g California Pistachios ,385.0,290.0, sponsored ,,NUTRI BINGE,200.0,g,False,95.0,24.68,1450.0
12, Good Life Almonds 500 g ,549.0,349.0,,,GOOD LIFE,500.0,g,False,200.0,36.43,698.0
13, Fortune Premium Kachi Ghani Pure Mustard Oil 1 L (Pouch) ,180.0,145.0,,,FORTUNE,1.0,l,False,35.0,19.44,145.0
14, Chakki Atta 5 kg ,250.0,185.0,,( 37.00/1 kg),PRIVATE LABEL,5.0,kg,False,65.0,26.0,37.0
15, Brill 1Kg Premium Whole Cashews (500g x 2pack) ,1840.0,735.0,,,BRILL,1.0,kg,False,1105.0,60.05,735.0
16, Gemini Refined Sunflower Oil 1 L ,179.0,115.0,,,GEMINI,1.0,l,False,64.0,35.75,115.0
17, SHREE KALPADRUMA ghee Natural A2 Desi Cow Ghee 5 LTR|Pure Cow Ghee for Better Digestion and Immunity|100% natural and premium quality ,4200.0,2310.0, sponsored ,,SHREE KALPADRUMA,2.0,desi,False,1890.0,45.0,
18, Nutri Binge 500g California Almonds Vitals ,660.0,369.0,,,NUTRI BINGE,500.0,g,False,291.0,44.09,738.0
19, Good Life (W320) Cashews 500 g ,499.0,399.0,,,GOOD LIFE,500.0,g,False,100.0,20.04,798.0
20, Amul Pure Ghee 1 L (Pouch) ,635.0,585.0,,,AMUL,1.0,l,False,50.0,7.87,585.0
21, DAIRY SAGAR GOPAL Pure Desi Cow Ghee Pure Cow Ghee for Better Digestion and Immunity 1 ltr jar-1 ,680.0,398.0,,,DAIRYSAGAR,1.0,ltr,False,282.0,41.47,398.0
22, Sugar (M) 2 kg ,100.0,90.0,,,LOOSE,2.0,kg,False,10.0,10.0,45.0
23," House of Veda Organic Tur (Arhar) Dal - 1kg Pack, Certified Organic | Rich in Protein & Iron | Zero Chemicals, Preservative Free ",275.0,261.0, sponsored ,,HOUSE OF VEDA,1.0,kg,False,14.0,5.09,261.0
24, Good Life Kachi Ghani Mustard Oil 1 L (Pouch) ,170.0,125.0,,,GOOD LIFE,1.0,l,False,45.0,26.47,125.0
25, Aashirvaad Superior MP Whole Wheat Atta 10 kg ,568.0,479.0,,( 47.90/1 kg),AASHIRVAAD,10.0,kg,False,89.0,15.67,47.9
26, Suji / Rawa 1 kg ,106.0,45.0,,,PRIVATE LABEL,1.0,kg,False,61.0,57.55,45.0
27, Good Life Jeera 100 g ,150.0,89.0,,( 44.50/50 g),GOOD LIFE,100.0,g,False,61.0,40.67,890.0
28, Good Life Raw Peanuts 500 g ,120.0,101.0,,,GOOD LIFE,500.0,g,False,19.0,15.83,202.0
29, House of Veda ORGANIC KABULI CHANA 1Kg ,290.0,203.0, sponsored ,,HOUSE OF VEDA,1.0,kg,False,87.0,30.0,203.0
30, Parry's White Label Sulphur Free Sugar 5 kg ,300.0,229.0,,,PARRY'S,5.0,kg,False,71.0,23.67,45.8
31, Nutri Binge 500g Whole Cashews ,749.0,379.0,,,NUTRI BINGE,500.0,g,False,370.0,49.4,758.0
32, Good Life Sugar (M) 1 kg ,55.0,50.0,,,GOOD LIFE,1.0,kg,False,5.0,9.09,50.0
33, Good Life Yellow Kishmish 500 g ,183.0,129.0,,,GOOD LIFE,500.0,g,False,54.0,29.51,258.0
34, Coreganic 1kg 100% Natural International Premium Whole Cashews ,1799.0,719.0,,,COREGANIC,1.0,kg,False,1080.0,60.03,719.0
35, SHREE KALPADRUMA ghee Natural A2 Desi Cow Ghee 1000ML|Pure Cow Ghee for Better Digestion and Immunity|100% natural and premium quality ,799.0,599.0, sponsored ,,SHREE KALPADRUMA,2.0,desi,False,200.0,25.03,
36, Suji / Rawa 500 g ,53.0,25.0,,,PRIVATE LABEL,500.0,g,False,28.0,52.83,50.0
37, Nutri Binge 1kg Vitals California Almonds ,1320.0,699.0,,,NUTRI BINGE,1.0,kg,False,621.0,47.05,699.0
38, Dhara Kachi Ghani Mustard Oil 1 L (Pouch) ,160.0,150.0,,,DHARA,1.0,l,False,10.0,6.25,150.0
39, Aashirvaad Iodized Salt 1 kg ,28.0,14.0,,,AASHIRVAAD,1.0,kg,False,14.0,50.0,14.0
40, Fortune Rice Bran Health Physically Refined Rice Bran Oil 5 L ,849.0,629.0,,( 125.80/1 l),FORTUNE,5.0,l,False,220.0,25.91,125.8
41," VEEDINT RED CHILLI POWDER, TIKHA LAL, 500 GRAM PACK ",495.0,220.0, sponsored ,,VEEDINT,500.0,gram,False,275.0,55.56,440.0
42," Horaira Nutz Dry Fruits Combo Pack 1Kg Cashews 250g , Figs 250g , Raisins 250g , Almond 250g ",1900.0,720.0,,,HORAIRA NUTZ,1.0,kg,False,1180.0,62.11,720.0
43, Aashirvaad Superior MP Whole Wheat Atta 5 kg ,294.0,245.0,,( 49.00/1 kg),AASHIRVAAD,5.0,kg,False,49.0,16.67,49.0
44, Gulab Sungold Refined Sunflower Oil 15 L (Tin) ,3563.0,1589.0,,( 105.93/1 l),GULAB,15.0,l,False,1974.0,55.4,105.93
45, Good Life Kachi Ghani Mustard Oil 1 L (Bottle) ,175.0,127.0,,,GOOD LIFE,1.0,l,False,48.0,27.43,127.0
46, Karan's Cashew Whole Cashew Nuts 1 Kg ( 500gX2) / Kaju. ,1400.0,669.0,,,KARANâS CASHEW,1.0,kg,False,731.0,52.21,669.0
47, SHREE KALPADRUMA ghee Natural A2 Desi Cow Ghee 500ML|Pure Cow Ghee for Better Digestion and Immunity|100% natural and premium quality ,459.0,335.0, sponsored ,,SHREE KALPADRUMA,2.0,desi,False,124.0,27.02,
48, Gowardhan Pure Cow Ghee 1 L (Pouch) ,725.0,635.0,,,GOWARDHAN,1.0,l,False,90.0,12.41,635.0
49, Aashirvaad Select Sharbati Whole Wheat Atta 5 kg ,331.0,291.0,,( 58.20/1 kg),AASHIRVAAD,5.0,kg,False,40.0,12.08,58.2
50, Maida 1 kg ,106.0,42.0,,,PRIVATE LABEL,1.0,kg,False,64.0,60.38,42.0
51, Good Life Free Flow Iodised Salt 1 kg ,28.0,15.0,,,GOOD LIFE,1.0,kg,False,13.0,46.43,15.0
52, Good Life Jeera 500 g ,740.0,359.0,,( 35.90/50 g),GOOD LIFE,500.0,g,False,381.0,51.49,718.0
53, Nutri Binge 1kg Whole Cashews ,1498.0,739.0, sponsored ,,NUTRI BINGE,1.0,kg,False,759.0,50.67,739.0
54, Patanjali Traditional Chakki Whole Wheat With Bran Atta 10 kg ,450.0,365.0,,( 36.50/1 kg),PATANJALI,10.0,kg,False,85.0,18.89,36.5
55, Nutri Binge 500g Premium California Almonds ,670.0,429.0,,,NUTRI BINGE,500.0,g,False,241.0,35.97,858.0
56," GreenFinity Mix Dry Fruits and Nuts, 1kg [Almonds, Walnuts, Cashew, Pumpkin, Cranberry, Black Raisin & Many More] Healthy Gift Hamper for Every Occasion Fresh and Healthy Dry Fruits, Seeds & Nuts. ",1299.0,599.0,,,GREENFINITY,1.0,kg,False,700.0,53.89,599.0
57, Gemini Refined Sunflower Oil 15 L ,2650.0,1625.0,,( 108.33/1 l),GEMINI,15.0,l,False,1025.0,38.68,108.33
58, Patanjali Kachi Ghani Mustard Oil 1 L (Bottle) ,145.0,135.0,,,PATANJALI,1.0,l,False,10.0,6.9,135.0
59, Good Life Value Almond 500 g ,525.0,315.0,,,GOOD LIFE,500.0,g,False,210.0,40.0,630.0
60, Dhara Kachi Ghani Mustard Oil 1 L (Bottle) ,180.0,152.0,,,DHARA,1.0,l,False,28.0,15.56,152.0
61, Good Life Tur Dal 1 kg ,266.0,211.0,,,GOOD LIFE,1.0,kg,False,55.0,20.68,211.0
62, Sunday Refined Sunflower Oil 1 L ,189.0,109.0,,,SUNDAY,1.0,l,False,80.0,42.33,109.0
63, India Gate Mini Mogra-II Basmati Rice 10 kg ,496.0,429.0,,( 42.90/1 kg),INDIA GATE,10.0,kg,False,67.0,13.51,42.9
64, Tata Sampann White Poha 500 g ,53.0,35.0,,,TATA SAMPANN,500.0,g,False,18.0,33.96,70.0
65, Anjeer 100% Natural Anjeer (Dry Figs) 500g ,899.0,399.0,,,ANJANI,500.0,g,False,500.0,55.62,798.0
66, Gowardhan Pure Cow Ghee 1 L (Jar) ,749.0,665.0,,,GOWARDHAN,1.0,l,False,84.0,11.21,665.0
67, Gowardhan Cow Ghee 1 L (Pack of 2) Pouch With Lock & Seal Container ,1450.0,1249.0,,,GOWARDHAN,1.0,l,True,201.0,13.86,1249.0
68, Happilo 1kg Popular Almond California ,1250.0,799.0,,,HAPPILO,1.0,kg,False,451.0,36.08,799.0
69, Good Life Thick Poha / Aval 1 kg ,75.0,63.0,,,GOOD LIFE,1.0,kg,False,12.0,16.0,63.0
70, Daawat Rozana Super Basmati Rice 1 kg ,98.0,75.0,,,DAAWAT,1.0,kg,False,23.0,23.47,75.0
71, Aashirvaad Multigrain Atta 5 kg ,359.0,309.0,,( 61.80/1 kg),AASHIRVAAD,5.0,kg,False,50.0,13.93,61.8
72, RUNUTZ 500g Cashew Nuts (250g X 2) ,590.0,395.0,,,RUNUTZ,500.0,g,False,195.0,33.05,790.0
73, Saffola Gold Rice Bran Based Blended Oil 3 L ,690.0,399.0,,( 133.00/1 l),SAFFOLA,3.0,l,False,291.0,42.17,133.0
74, Fortune Physically Refined Rice Bran Oil 1 L (Pouch) ,165.0,127.0,,,FORTUNE,1.0,l,False,38.0,23.03,127.0
75, Besan 500 g ,95.0,45.0,,,PRIVATE LABEL,500.0,g,False,50.0,52.63,90.0
76," Horaira Nutz Natural & Fresh Figs , Anjeer 1kg ( 500g x 2 ) ",1498.0,649.0,,,HORAIRA NUTZ,1.0,kg,False,849.0,56.68,649.0
77, Gulab Gold Filtered Groundnut Oil 5 L ,1347.0,999.0,,( 199.80/1 l),GULAB,5.0,l,False,348.0,25.84,199.8
78, Safola Gold Multisource Blended Refined Edible Oil 5 L (Can) + 1 L Free (Pouch) ,945.0,855.0,,( 142.50/1 l),SAFFOLA,5.0,l,False,90.0,9.52,171.0
79, Moong Dal 2 kg ,340.0,233.0,,,PRIVATE LABEL,2.0,kg,False,107.0,31.47,116.5
80, Fortune Chakki Fresh Atta 5 kg ,245.0,199.0,,( 39.80/1 kg),FORTUNE,5.0,kg,False,46.0,18.78,39.8
81, Navjeevan 500g Green Cardamom | Green Elaichi ,2150.0,849.0,,( 169.80/100 g),NAVJEEVAN,500.0,g,False,1301.0,60.51,1698.0
82, Good Life MP Wheat Chakki Atta 1 kg ,50.0,43.0,,,GOOD LIFE,1.0,kg,False,7.0,14.0,43.0
83, Fortune Superfine Besan 500 g ,80.0,53.0,,,FORTUNE,500.0,g,False,27.0,33.75,106.0
84, Good Life Jeera 200 g ,305.0,175.0,,( 43.75/50 g),GOOD LIFE,200.0,g,False,130.0,42.62,875.0
85, Good Life Kabuli Chana 500 g ,134.0,111.0,,,GOOD LIFE,500.0,g,False,23.0,17.16,222.0
86, Chana Dal 2 kg ,240.0,172.0,,,PRIVATE LABEL,2.0,kg,False,68.0,28.33,86.0
87, Maida 500 g ,53.0,25.0,,,PRIVATE LABEL,500.0,g,False,28.0,52.83,50.0
88, Good Life Moong Dal 500 g ,96.0,73.0,,,GOOD LIFE,500.0,g,False,23.0,23.96,146.0
89, Besan 1 kg ,190.0,90.0,,,PRIVATE LABEL,1.0,kg,False,100.0,52.63,90.0
90, Gulab Gold Filtered Groundnut Oil 1 L ,264.0,195.0,,,GULAB,1.0,l,False,69.0,26.14,195.0
91, Fortune Sunlite Refined Sunflower Oil 15 L (Can) ,2150.0,1675.0,,( 111.67/1 l),FORTUNE,15.0,l,False,475.0,22.09,111.67
92, Daawat Rozana Super Basmati Rice 5 kg ,486.0,359.0,,,DAAWAT,5.0,kg,False,127.0,26.13,71.8
93, Good Life Chana Dal 500 g ,70.0,52.0,,,GOOD LIFE,500.0,g,False,18.0,25.71,104.0
94, Anjani Anjeer 100% Natural Dry Figs/Anjeer 1 kg ,1599.0,749.0,,,ANJANI,1.0,kg,False,850.0,53.16,749.0
95, Daawat Sonamasoori Rice 10 kg ,816.0,605.0,,( 60.50/1 kg),DAAWAT,10.0,kg,False,211.0,25.86,60.5
96, Dhara Nourish Vit A E Refined Sunflower Oil 1 L ,150.0,112.0,,,DHARA,1.0,l,False,38.0,25.33,112.0
97, Fortune Rozana Dubar Basmati Rice 5 kg ,585.0,429.0,,,FORTUNE,5.0,kg,False,156.0,26.67,85.8
98, Sunrich Refined Sunflower Oil 899 g ,152.0,102.0,,,SUNRICH,899.0,g,False,50.0,32.89,113.46
99, Nestle EveryDay Ghee 1 L (Carton) ,630.0,579.0,,,NESTLE,1.0,l,False,51.0,8.1,579.0
100, Good Life Whole Moong 500 g ,95.0,72.0,,,GOOD LIFE,500.0,g,False,23.0,24.21,144.0
101, Daawat Rozana Gold Basmati Rice 5 kg ,560.0,395.0,,,DAAWAT,5.0,kg,False,165.0,29.46,79.0
102, 41 foods Almonds Pistachios Cashews Raisins Walnuts Combo Pack | Kaju Pista Badam Akhrot Kishmish (150GM x 5) 750 GM ,2099.0,573.0,,,41 FOODS,41.0,foods,False,1526.0,72.7,
103, Fortune Suji / Semolina 500 g ,39.0,26.0,,,FORTUNE,500.0,g,False,13.0,33.33,52.0
104, Freshtige 100% Natural and Premium Healthy Mix Dry Fruits 1kg(500gms*2)|Fresh and Healthy Dry Fruits ,1499.0,599.0,,,FRESHTIGE,1.0,kg,False,900.0,60.04,599.0
105, Amul Pure Ghee 1 L (Tin) ,650.0,615.0,,,AMUL,1.0,l,False,35.0,5.38,615.0
106, Good Life Big Mustard 100 g ,25.0,15.0,,( 7.50/50 g),GOOD LIFE,100.0,g,False,10.0,40.0,150.0
107," Farmley Handpicked Gold Makhana ( Fox Nuts) , 500g (Pack of 2, Each 250g) ",600.0,499.0,,,FARMLEY,500.0,g,True,101.0,16.83,998.0
108, Regular Value Pack Plain Cashews 500 g ,500.0,355.0,,,PRIVATE LABEL,500.0,g,False,145.0,29.0,710.0
109, Nutri Binge 500g Pistachios Roasted & Salted California ,920.0,629.0,,,NUTRI BINGE,500.0,g,False,291.0,31.63,1258.0
110, Maggi Masala Ae Magic 6 g (Pack of 12) ,60.0,55.0,,,MAGGI,6.0,g,True,5.0,8.33,9166.67
111, India Gate Mogra Basmati Rice 10 kg ,800.0,655.0,,( 65.50/1 kg),INDIA GATE,10.0,kg,False,145.0,18.12,65.5
112, Nutraj California Walnuts InShell 1 kg (500gm x 2) ,1098.0,529.0,,( 264.50/500 g),NUTRAJ,1.0,kg,False,569.0,51.82,529.0
113, Tata Sampann Unpolished Toor / Arhar Dal 500 g ,143.0,132.0,,,TATA SAMPANN,500.0,g,False,11.0,7.69,264.0
114, Mount 84 Rock Salt 1 kg ,99.0,49.0,,,DR. BRAND,84.0,rock,False,50.0,50.51,
115, Tata Sampann Unpolished Moong Dal 500 g ,105.0,97.0,,,TATA SAMPANN,500.0,g,False,8.0,7.62,194.0
116, Gulab Sungold Refined Sunflower Oil 15 L (Jar) ,3589.0,1609.0,,( 107.27/1 l),GULAB,15.0,l,False,1980.0,55.17,107.27
117, Daawat Devaaya Everyday Rice 5 kg ,600.0,300.0,,,DAAWAT,5.0,kg,False,300.0,50.0,60.0
118," RED ROSE MINI MONGRA BASMATI RICE, 30 KG ",1699.0,1499.0,,( 49.97/1 kg),RED ROSE,30.0,kg,False,200.0,11.77,49.97
119, Elina Long Grain Rice 1 kg ,195.0,65.0,,,ELINA,1.0,kg,False,130.0,66.67,65.0
120, 921 CLASSIC BIRYANI SPECIAL BASMATI RICE 5 KG (Long grain 1121 Rice XXXL) ,925.0,649.0,,( 129.80/1 kg),921,5.0,kg,False,276.0,29.84,129.8
121, Good Life Masoor Dal 500 g ,69.0,57.0,,,GOOD LIFE,500.0,g,False,12.0,17.39,114.0
122," Horaira Nutz Premium Dry fruits Combo Pack 500g Almond , Cashews ( Pack of 2 _ Each 250g ) ",999.0,513.0,,,HORAIRA NUTZ,500.0,g,True,486.0,48.65,1026.0
123, Fortune Rozana Basmati Rice 5 kg Bag + Fortune Rice Bran Health Physically Refined Rice Bran Oil 5 L PET Combo ,1425.0,999.0,,,FORTUNE+FORTUNE,5.0,kg,False,426.0,29.89,199.8
124, GKD's Premium 2 L Pure Coconut Oil Jar ,760.0,599.0,,,GKD'S PREMIUM,2.0,l,False,161.0,21.18,299.5
125, Amul Pure Ghee 500 ml (Pouch) ,320.0,299.0,,,AMUL,500.0,ml,False,21.0,6.56,598.0
126, RUNUTZ 1kg Cashew Nuts (250g X 4) ,1180.0,739.0,,,RUNUTZ,1.0,kg,False,441.0,37.37,739.0
127, Good Life Roasted Chana Dal / Split Bengal Gram 500 g ,80.0,67.0,,,GOOD LIFE,500.0,g,False,13.0,16.25,134.0
128, Emami Healthy & Tasty Kachi Ghani Mustard Oil 1 L (Pouch) ,210.0,129.0,,,EMAMI,1.0,l,False,81.0,38.57,129.0
129, Tata Sampann Unpolished Chilka Moong 500 g ,99.0,92.0,,,TATA SAMPANN,500.0,g,False,7.0,7.07,184.0
130, Gemini Refined Soyabean Oil 1 L ,140.0,103.0,,,GEMINI,1.0,l,False,37.0,26.43,103.0
131, Amul Cow Ghee 1 L (Pouch) ,650.0,595.0,,,AMUL,1.0,l,False,55.0,8.46,595.0
132, Good Life Small Brown Chana 500 g ,69.0,53.0,,,GOOD LIFE,500.0,g,False,16.0,23.19,106.0
133, Wonderland Foods Premium Raisins 500 g ,300.0,109.0,,,WONDERLAND FOODS,500.0,g,False,191.0,63.67,218.0
134, Go Crackers 2kg Broken Walnuts Kernels Amber without Shell (250g x 8) ,2360.0,857.0,,,GO,2.0,kg,False,1503.0,63.69,428.5
135, Mother Dairy Cow Ghee 1 L (Pouch) ,685.0,575.0,,,MOTHER DAIRY,1.0,l,False,110.0,16.06,575.0
136, Good Life Moong Dal 1 kg ,189.0,145.0,,,GOOD LIFE,1.0,kg,False,44.0,23.28,145.0
137, Fortune Everyday Full Grain Basmati Rice 1 kg ,169.0,99.0,,,FORTUNE,1.0,kg,False,70.0,41.42,99.0
138, Good Life Green Kishmish 500 g ,183.0,129.0,,,GOOD LIFE,500.0,g,False,54.0,29.51,258.0
139, Open Secret Kimia Dates 800g Premium Khajur ,500.0,281.0,,,OPEN SECRET,800.0,g,False,219.0,43.8,351.25
140, Tata Sampann Unpolished Moong Dal 1 kg ,209.0,194.0,,,TATA SAMPANN,1.0,kg,False,15.0,7.18,194.0
141, Good Life Almonds 1 kg ,1050.0,695.0,,,GOOD LIFE,1.0,kg,False,355.0,33.81,695.0
142, Wonderland Foods Platinum California Almonds 500 g ,725.0,299.0,,,WONDERLAND FOODS,500.0,g,False,426.0,58.76,598.0
143, Good Life Urad Dal 500 g ,97.0,80.0,,,GOOD LIFE,500.0,g,False,17.0,17.53,160.0
144, Aashirvaad Superior MP Whole Wheat Atta 1 kg ,61.0,55.0,,,AASHIRVAAD,1.0,kg,False,6.0,9.84,55.0
145," Happilo Essentials Popular Whole Cashew W400 1kg, Healthy Snack, Source of Protein, Vitamin & Minerals, No Preservatives ",1350.0,889.0,,,HAPPILO,400.0,1kg,False,461.0,34.15,
146, Good Life Unpolished Toor Dal 1 kg ,272.0,235.0,,,GOOD LIFE,1.0,kg,False,37.0,13.6,235.0
147, Broken Wheat / Daliya 500 g ,60.0,25.0,,,PRIVATE LABEL,500.0,g,False,35.0,58.33,50.0
148, Daawat Super Basmati Rice 1 kg ,220.0,139.0,,,DAAWAT,1.0,kg,False,81.0,36.82,139.0
149, Nutraj Jumbo California Walnuts in Shell 1 kg ,999.0,619.0,,( 309.50/500 g),NUTRAJ,1.0,kg,False,380.0,38.04,619.0
150, Amul Cow Ghee 1 L (Tin) ,665.0,618.0,,,AMUL,1.0,l,False,47.0,7.07,618.0
151, Good Life Chilli Powder 100 g ,50.0,32.0,,,GOOD LIFE,100.0,g,False,18.0,36.0,320.0
152, Gowardhan Pure Cow Ghee 500 ml (Jar) ,385.0,345.0,,,GOWARDHAN,500.0,ml,False,40.0,10.39,690.0
153, Good Life Toor Dal 500 g ,134.0,106.0,,,GOOD LIFE,500.0,g,False,28.0,20.9,212.0
154, Ziofit 1kg Popular Almonds Calfornia ,1250.0,799.0,,,ZIOFIT,1.0,kg,False,451.0,36.08,799.0
155, Annprash White Sugar - 0.5 kg ,499.0,148.0,,,ANNPRASH,0.5,kg,False,351.0,70.34,296.0
156, Patanjali Whole Wheat Atta with Bran 5 kg ,230.0,195.0,,( 39.00/1 kg),PATANJALI,5.0,kg,False,35.0,15.22,39.0
157, 921 CLASSIC BASMATI MOGRA | MUNGRA RICE - 30 KG ,1750.0,1299.0,,( 43.30/1 kg),921,30.0,kg,False,451.0,25.77,43.3
158, Gulab Sungold Refined Sunflower Oil 1 L ,150.0,97.0,,,GULAB,1.0,l,False,53.0,35.33,97.0
159, Tata Lite Sodium Curtailed Iodised Salt 1 kg ,50.0,45.0,,,TATA,1.0,kg,False,5.0,10.0,45.0
160, Fortune Sunlite Refined Sunflower Oil 15 L (Tin) ,2150.0,1625.0,,( 108.33/1 l),FORTUNE,15.0,l,False,525.0,24.42,108.33
161, Navjeevan Jeera 500g (Cumin) ,750.0,329.0,,( 65.80/100 g),NAVJEEVAN,500.0,g,False,421.0,56.13,658.0
162, Good Life Chana Dal 1 kg ,138.0,99.0,,,GOOD LIFE,1.0,kg,False,39.0,28.26,99.0
163, India Gate Rozana Basmati Rice 5 kg ,570.0,429.0,,,INDIA GATE,5.0,kg,False,141.0,24.74,85.8
164, Jivo Cold Pressed Sunflower Oil 5 Ltr - Chemical free ,1350.0,799.0,,,JIVO,5.0,ltr,False,551.0,40.81,159.8
165," Farmley Popular California Almonds, 100% Natural, 2 Times Crunchier, 500 g ",899.0,449.0,,,FARMLEY,2.0,times,False,450.0,50.06,
166, Date Crown Premium Fard Dates 500 g ,257.0,169.0,,,DATE CROWN,500.0,g,False,88.0,34.24,338.0
167, Suhana Simla Premium 1 Liter Danedar Cow Ghee | Pure Cow Ghee | 1Liter ,775.0,449.0,,,SUHANA SIMLA,1.0,liter,False,326.0,42.06,449.0
168, Yogabar 500g Cashews W320 | 100% Natural Premium Whole Cashews | Whole Crunchy Cashew | Premium Kaju nuts | Nutritious & Delicious | Gluten Free & Plant based Protein ,600.0,449.0,,,YOGABAR,500.0,g,False,151.0,25.17,898.0
169, Gulab Classic Refined Cottonseed Oil 5 L ,782.0,555.0,,( 111.00/1 l),GULAB,5.0,l,False,227.0,29.03,111.0
170, Good Life Compounded Hing Powder 50 g ,95.0,55.0,,,GOOD LIFE,50.0,g,False,40.0,42.11,1100.0
171, India Gate Mini Mogra Basmati Rice 10 kg ,675.0,535.0,,( 53.50/1 kg),INDIA GATE,10.0,kg,False,140.0,20.74,53.5
172, Tulsi California Rozana Value Almonds 1 Kg ,1140.0,749.0,,,TULSI,1.0,kg,False,391.0,34.3,749.0
173, Rice Villa Rozana Basmati Rice 26 Kg ,2600.0,1559.0,,( 59.96/1 kg),"RICE VILLA, DEVICE OF SHIELD, PADDY TREE",26.0,kg,False,1041.0,40.04,59.96
174, Molsi's 1Kg Kimia Dates (500gX2) ,550.0,345.0,,,MOLSI'S,1.0,kg,False,205.0,37.27,345.0
175, Good Life Masoor Dal 1 kg ,135.0,113.0,,,GOOD LIFE,1.0,kg,False,22.0,16.3,113.0
176, Pyramid Traders 1KG Kashmiri Mamra Almonds (Badam Giri) ,4000.0,1070.0,,,PYRAMID TRADERS,1.0,kg,False,2930.0,73.25,1070.0
177, Good Life Soya Wadi / Chunks 200 g ,55.0,27.0,,,GOOD LIFE,200.0,g,False,28.0,50.91,135.0
178, Good Life Filtered Groundnut Oil 1 L ,215.0,179.0,,,GOOD LIFE,1.0,l,False,36.0,16.74,179.0
179, Fortune Soya Health Refined Soyabean Oil 5 L ,680.0,615.0,,( 123.00/1 l),FORTUNE,5.0,l,False,65.0,9.56,123.0
180, Jubilee Regular Long Grain Rice 1 kg ,190.0,63.0,,,JUBILEE,1.0,kg,False,127.0,66.84,63.0
181, BLK FOODS Select 500g Cashews Nuts (320 no. Kaju) ,1150.0,369.0,,,BLK FOODS,500.0,g,False,781.0,67.91,738.0
182, Good Life Thick Poha / Aval 500 g ,38.0,34.0,,,GOOD LIFE,500.0,g,False,4.0,10.53,68.0
183, Dhara Filtered Groundnut Oil 1 L (Pouch) ,255.0,205.0,,,DHARA,1.0,l,False,50.0,19.61,205.0
184, Fortune Mogra Basmati Rice 10 kg ,800.0,599.0,,( 59.90/1 kg),FORTUNE,10.0,kg,False,201.0,25.12,59.9
185, Parth Jaggery 950 g ,90.0,62.0,,,PARTH,950.0,g,False,28.0,31.11,65.26
186, Fortune Besan 1 kg ,160.0,106.0,,,FORTUNE,1.0,kg,False,54.0,33.75,106.0
187, Tata Salt 2 kg ,55.0,48.0,,,TATA,2.0,kg,False,7.0,12.73,24.0
188, Prabhat Cow Ghee 1 L (Pouch) ,725.0,539.0,,,PRABHAT,1.0,l,False,186.0,25.66,539.0
189, Tata Rock Salt 1 kg ,120.0,99.0,,,TATA,1.0,kg,False,21.0,17.5,99.0
190, Good Life Whole (W320) Cashews 200 g ,250.0,189.0,,,GOOD LIFE,200.0,g,False,61.0,24.4,945.0
191, India Gate Regular Choice Basmati Rice 5 kg ,520.0,435.0,,,INDIA GATE,5.0,kg,False,85.0,16.35,87.0
192, Dhara Kachi Ghani Mustard Oil 5 L ,825.0,749.0,,( 149.80/1 l),DHARA,5.0,l,False,76.0,9.21,149.8
193, Nutraj Special Round Raisin 1 Kg (500 g X 2) ,598.0,329.0,,( 32.90/100 g),NUTRAJ,1.0,kg,False,269.0,44.98,329.0
194, DAIRY SAGAR GOPAL Desi Cow Ghee |Made Traditionally from Curd |Pure Cow Ghee for Better Digestion and Immunity | 1Ltr Tetra Pack ,680.0,399.0,,,DAIRYSAGAR,1.0,ltr,False,281.0,41.32,399.0
195, Good Life Urad Dal 1 kg ,191.0,159.0,,,GOOD LIFE,1.0,kg,False,32.0,16.75,159.0
196, Broken Wheat / Daliya 1 kg ,120.0,49.0,,,PRIVATE LABEL,1.0,kg,False,71.0,59.17,49.0
197, Fortune Biryani Special Basmati Rice 1 kg ,210.0,134.0,,,FORTUNE,1.0,kg,False,76.0,36.19,134.0
198," Farmley 1kg Popular Almonds Californian, 100% Natural, 2 Times Crunchier Badaam ",1799.0,799.0,,,FARMLEY,1.0,kg,False,1000.0,55.59,799.0
199, Good Life MP Wheat Chakki Atta 10 kg ,500.0,419.0,,( 41.90/1 kg),GOOD LIFE,10.0,kg,False,81.0,16.2,41.9
200, Wonderland Foods Platinum California Pistachios Roasted & Salted 400 g ,725.0,409.0,,,WONDERLAND FOODS,400.0,g,False,316.0,43.59,1022.5
201, Good Life Kabuli Chana 1 kg ,266.0,221.0,,,GOOD LIFE,1.0,kg,False,45.0,16.92,221.0
202, Naturoz 1kg Daily Whole Cashews ,1125.0,795.0,,,NATUROZ,1.0,kg,False,330.0,29.33,795.0
203, Nutraj California Walnut Kernels 250g ,499.0,319.0,,( 319.00/250 g),NUTRAJ,250.0,g,False,180.0,36.07,1276.0
204, Tata Sampann Unpolished Kala Chana 500 g ,74.0,68.0,,,TATA SAMPANN,500.0,g,False,6.0,8.11,136.0
205, Good Life Washed Gota Urad 1 kg ,198.0,161.0,,,GOOD LIFE,1.0,kg,False,37.0,18.69,161.0
206, Pillsbury Chakki Fresh Atta / Flour 5 kg ,286.0,219.0,,( 43.80/1 kg),PILLSBURY,5.0,kg,False,67.0,23.43,43.8
207, Nature's Choice Arabian Dates 500 g ,200.0,99.0,,,NATURE'S CHOICE,500.0,g,False,101.0,50.5,198.0
208, Satvikk 1000 gm Premium Almonds Californian 1 KG ,1400.0,689.0,,,SATVIKK,1000.0,gm,False,711.0,50.79,689.0
209, Fortune Rozana Basmati Rice 1 kg ,130.0,89.0,,,FORTUNE,1.0,kg,False,41.0,31.54,89.0
210, Good Life Almonds 200 g ,270.0,175.0,,,GOOD LIFE,200.0,g,False,95.0,35.19,875.0
211, Gemini Refined Sunflower Oil 5 L ,890.0,625.0,,( 125.00/1 l),GEMINI,5.0,l,False,265.0,29.78,125.0
212, DailyHerbs Anjeer 1kg - Premium Quality Afghani Anjeer | Naturally Dried Figs | Perfect for a Healthy Lifestyle ,1299.0,539.0,,,DAILYHERBS,1.0,kg,False,760.0,58.51,539.0
213, India Gate Super Basmati Rice 5 kg ,1080.0,729.0,,,INDIA GATE,5.0,kg,False,351.0,32.5,145.8
214, AweLiv Pure Olive Oil - 1 Ltr (Imported from Spain) ,1350.0,375.0,,,AWELIV,1.0,ltr,False,975.0,72.22,375.0
215, GO KITCHEN Afghanistan Afghani Anjeer Figs Big Size Anjir Dried Figs Zero Added Sugar & Preservatives Dry Fruit (Pack of 250 gram) ,359.0,249.0,,,GO KITCHEN,250.0,gram,True,110.0,30.64,996.0
216," English Nuts Mixed Dry Fruit, Nuts, Seeds, Berries - 1kg Trial Mix| 10+ Varieties | Lowest Price I ",3000.0,519.0,,,ENGLISH NUTS-THE DRY FRUITS HOUSE,1.0,kg,False,2481.0,82.7,519.0
217, Lali Balaji DAILY NUT California Almond VALUE 1000gm (250gm x pack of 4) ,1240.0,689.0,,,LALI BALAJI,1000.0,gm,True,551.0,44.44,689.0
218, Good Life Whole Moong 1 kg ,188.0,143.0,,,GOOD LIFE,1.0,kg,False,45.0,23.94,143.0
219, Anjani Popular Cashews/Kaju 1 kg ,1599.0,799.0,,,ANJANI,1.0,kg,False,800.0,50.03,799.0
220, Farmley Whole Cashews Natural Raw W400 Kaju 500g ,749.0,399.0,,,FARMLEY,400.0,kaju,False,350.0,46.73,
221, Good Life California Roasted & Salted Pista 200 g ,299.0,235.0,,,GOOD LIFE,200.0,g,False,64.0,21.4,1175.0
222, Amul Cow Ghee 500 ml (Pouch) ,325.0,308.0,,,AMUL,500.0,ml,False,17.0,5.23,616.0
223, GKD's Premium Pure Coconut Oil Jar (1 L) ,380.0,299.0,,,GKD'S PREMIUM,1.0,l,False,81.0,21.32,299.0
224, Smith & Jones Ginger Garlic Paste 200 g ,50.0,29.0,,( 14.50/100 g),SMITH & JONES,200.0,g,False,21.0,42.0,145.0
225, Sundrop SuperLite Advanced Refined Sunflower Oil 3 L ,489.0,489.0,,( 163.00/1 l),SUNDROP,3.0,l,False,0.0,0.0,163.0
226, Good Life Brown Chana 1 kg ,136.0,105.0,,,GOOD LIFE,1.0,kg,False,31.0,22.79,105.0
227, Puro Healthy Salt 1 kg ,110.0,95.0,,,PURO,1.0,kg,False,15.0,13.64,95.0
228," RED ROSE ROYAL BASMATI RICE 5KG I XXXL BIRYANI RICE I BEST BASMATI RICE FOR BIRYANI, 5 KG ",1299.0,699.0,,( 139.80/1 kg),RED ROSE,5.0,kg,False,600.0,46.19,139.8
229, LILA DRY FRUITS 500gms x 2 (1 Kgs) Mason Jar Pack Premium Dried Afghani Anjeer| Dried Figs ,1499.0,659.0,,,LILA DRY FRUITS,500.0,gms,False,840.0,56.04,
230, Good Life Phool Makhana 250 g ,300.0,249.0,,,GOOD LIFE,250.0,g,False,51.0,17.0,996.0
231, Nature's Choice Mixed Dry Fruits 400 g ,260.0,199.0,,,NATURE'S CHOICE,400.0,g,False,61.0,23.46,497.5
232, Tata Sampann Unpolished Tur / Arhar Dal 1 kg ,289.0,259.0,,,TATA SAMPANN,1.0,kg,False,30.0,10.38,259.0
233, Sharbati Wheat 5 kg ,285.0,199.0,,( 39.80/1 kg),PRIVATE LABEL,5.0,kg,False,86.0,30.18,39.8
234," GUNJAL SILKY PARMAL RICE, 30 KG ",1699.0,1649.0,,( 54.97/1 kg),GUNJAL,30.0,kg,False,50.0,2.94,54.97
235, Utkal's KASPER 30 Kg SONA MASURI RAW RICE ,2038.0,1698.0,,( 56.60/1 kg),UTKAL'S KASPER,30.0,kg,False,340.0,16.68,56.6
236," Pawan Foods ""Paaritosh"" Premium Kacchi Ghani Mustard Oil 2 Litre | Sarso ka Tel Pure | Khusi ke Sath, Bhojan ka Swad | Natural with Healthy | kali Sarso ka Tel ",520.0,425.0,,,PAWAN,2.0,litre,False,95.0,18.27,
237, BLK Foods 1Kg Indian Kishmish | Big Size Raisins ( 500g x 2) ,1400.0,349.0,,,BLK FOODS,1.0,kg,False,1051.0,75.07,349.0
238, Foodcan Kismis 1 Kg Black Afghani Raisin Dakh (Kishmis) 1 Kg Saver Pack ,1000.0,329.0,,,FOODCAN,1.0,kg,False,671.0,67.1,329.0
