,Product name,MRP,Selling Price,Tag,PerUnitPrice,Brand
569, Sams Veg Hakka Noodles 180 g (Buy 1 Get 1) ,42.00,42.00,None,None,SAMS
570, Soulfull Ragi Bites Assorted Combo Pack 108 g (Pack of 6) , 60.00 ,49.00,None,None,SOULFULL
571," Bambino Soan Papdi Assorted Combo Each 200 Gm X Pack of 4 ( 800 Gms ) Badam, Butterscotch, Chocolate, Coconut ", 360.00 ,289.00,None,None,BAMBINO
572, Pintola Choco Spread Crunchy Peanut Butter 350g , 199.00 ,185.00,None,None,PINTOLA
573, Parle 20-20 Gold Choco Chip Cookies 400 g , 150.00 ,75.00,None,None,PARLE 20-20
574, Bonn Americana Hi-Fibre Digestive Cookies 1kg (495g x 2) , 250.00 ,165.00,None,None,BONN
575, Chheda's Masala Butter Chakli 100 g , 55.00 ,27.00,None,None,CHHEDA'S
576, Chupa Chups Mixed Fruit Flavour Sour Bites 61.6 g , 36.00 ,33.00,None,None,CHUPA CHUPS
577, Mother's Recipe Mango Pickle 1 kg , 240.00 ,200.00,None,None,MOTHER'S RECIPE
578, Yummiez Tandoori Paneer Nuggets 300 g , 195.00 ,123.00,None,None,YUMMIEZ
579, Haldiram Bhujiawala Delicious Crispy & Flaky Premium Rose Soan Papdi - Pack of 3 (500 Grams) Each , 465.00 ,380.00,None,None,HALDIRAM BHUJIAWALA
580, Hershey's Kisses Almond Chocolate 100.8 g , 140.00 ,95.00,None,None,HERSHEY'S
581, Bhujialalji Khatta Meetha | Namkeen Snacks Tasty & Crunchy Tea-time Namkeen | Indian Tea Time Fresh Healthy Snack Mixture | Ready to eat | No Preservatives | Crsipy & Light snacks | (pack of 1) 1kg. , 280.00 ,199.00,None,None,BHUJIALALJI
582, Pintola All Natural Creamy Peanut Butter 1kg , 449.00 ,408.00,None,None,PINTOLA
583, LuvIt Crazy Pops | Button Shaped Treats | Gems | Loved by Kids | Colored Chocolaty Pop | Pack of 1 - 350g , 450.00 ,199.00,None,None,LUVIT
584, Kellogg's Original Corn Flakes 475 g , 195.00 ,181.00,None,None,KELLOGG'S
585, LANDMARK Sweets Chandrakala Sweet Pure Freshly Mithai Perfect for Holi Diwali Dussehra Festival Pooja Bhog , 340.00 ,188.00,None,None,LANDMARK
586, McCain Aloo Tikki 400 g , 120.00 ,108.00,None,None,MCCAIN
587, Cadbury Oreo Strawberry Creme Biscuits 113.75 g , 35.00 ,32.00,None,None,OREO
588, Parle-G Gold Biscuits 500 g , 75.00 ,67.00,None,None,PARLE
589, Bounty Coconut Chocolate Bar Coconut Filled Chocolate Premium Chocolate for Sharing 57g (Pack of 12) , 840.00 ,587.00,None,None,BOUNTY
590, Maggi Hot & Sweet Tomato Chilli Sauce 500 g , 125.00 ,116.00,None,None,MAGGI
591, MTR 3 Minute Breakfast Khatta Meetha Poha Mix 60 g , 27.00 ,25.00,None,None,MTR
592, Bagrry's White Oats 100% Whole Grain 500 g , 99.00 ,84.00,None,None,BAGRRY'S
593, LANDMARK Sweet Touch Pure Kaju Katli (Kaju Burfi/Barfi)/Indian Mithai Box 400grms ," 1,200.00 ",475.00,None,None,LANDMARK
594, Saffola Oodles Yummy Masala Noodles 46 g , 22.00 ,20.00,None,None,SAFFOLA
595, 90's Mill Falhari Roasted Kerala Yellow Banana Chips Tasty Yummy Snack Healthy Snack- 200gm(Pack of 2x 100gm) , 599.00 ,225.00,None,None,90'S MILL
596, Bonn Americana Premium Sandwich Bourbonn Cookies Family Pack 1kg , 300.00 ,179.00,None,None,BONN
597, Kissan Twist Sweet & Spicy Tomato Sauce 425 g , 80.00 ,70.00,None,None,KISSAN
598, Momsy 100% Natural and Premium California Almonds| Quality Badam Giri| - Badam - Bold Size (250gm) , 799.00 ,364.00,None,None,MOMSY
599, Cadbury Bournville Cranberry Chocolate 80 g , 110.00 ,99.00,None,None,CADBURY
600, Funfoods Veg Burger Mayonnaise 250 g , 90.00 ,83.00,None,None,FUNFOODS
601, Haldiram's Ready to Eats ( Combo Pack ) 1800 g ,640.00,640.00,None,None,HALDIRAM'S NAGPUR
602, Momsy Premium Roasted & Salted Jumbo Size Pistachios Nut | Pista Dry Fruit | Super Crunchy (250gm) , 599.00 ,456.00,None,None,MOMSY
603," GHASITARAM'S Punjabi Halwai Diwali Special Mawa Peda Kesari with Free Plated Coin, 200gms ", 350.00 ,269.00,None,None,GHASITARAM'S
604, Aarambh Muesli Fruit and Nuts 750 g , 480.00 ,240.00,None,None,AARAMBH
605, Britannia Jimjam Cream Biscuits 92 g , 25.00 ,23.00,None,None,BRITANNIA
606, Bikaji Moong Dal 200 g , 60.00 ,49.00,None,None,BIKAJI
607, Kellogg's Chocos Crunchy Bites 24 g ,10.00,10.00,None,None,KELLOGG'S
608, Mother's Recipe Mango Pickle 500 g , 149.00 ,74.00,None,None,MOTHER'S RECIPE
609, Kellogg's Moons & Stars Chocos 24 g ,30.00,30.00,None,None,KELLOGG'S
610, Kellogg's Corn Flakes With Real Almond & Honey 300 g , 199.00 ,185.00,None,None,KELLOGG'S
611," Food Library The Magic of Nature Assorted Snacks Chocolate Diwali Gift Hamper Basket For All Occasions, 20 G (Set Of 15) "," 1,200.00 ",850.00, Imported ,None,FOOD LIBRARY THE MAGIC OF NATURE
612, LuvIt Luscious Choco Spread | Smooth & Delicious | Made with Cocoa | Pack of 1 - 310g , 249.00 ,176.00,None,None,LUVIT
613, Act II Classic Salted Instant Popcorn 90 g , 35.00 ,32.00,None,None,ACT II
614, KitKat Dessert Delight Rich Chocolate Fudge 150 g , 170.00 ,145.00,None,None,KIT KAT
615, Cadbury Dairy Milk Silk Roast Almond Chocolate 58 g , 85.00 ,79.00,None,None,CADBURY
616, McCain Smiles 415 g , 135.00 ,114.00,None,None,MCCAIN
617, Saffola Yummy Masala Oodles 184 g (Pack of 4) , 100.00 ,84.00,None,None,SAFFOLA
618, McVitie's Oat Cookies 120 g , 50.00 ,25.00,None,None,MCVITIE'S
619, Wai Wai Masala Delight X-press Instant Noodles 330 g , 104.00 ,52.00,None,None,WAI WAI
620," Kesar Sweets| Special Rajasthani Paneer Sweet Ghevar in Beautiful Lehariya Gift Box- 300g, Pure Desi Ghee Mithai, Homemade Sweets Gifts Pack for Family, Friends & Staff ", 597.00 ,499.00,None,None,KESAR
621, Unibic Butter Cookies 75 g , 30.00 ,27.00,None,None,UNIBIC
622, Yoga Bar Dark Chocolate + Cranberry Muesli 400 g , 359.00 ,179.00,None,None,YOGA BAR
623, Lal Sweets Mysore Pak Signature 400g (Pack Of 1) || Made With Pure Desi Ghee || Mysuru Pak , 699.00 ,399.00,None,None,LAL
624, Delight Foods Original Agra Kesar Dry Petha 350g Indian Sweets Mithai , 217.00 ,140.00,None,None,DELIGHT FOODS
625, Britannia Treat Coconut Creme Wafers Biscuit 55 g , 50.00 ,25.00,None,None,TREAT
626, Veeba Eggless Mayonnaise 100 g , 45.00 ,35.00,None,None,VEEBA
627, Haldiram's Nagpur Boondi 200 g , 52.00 ,48.00,None,None,HALDIRAM’S NAGPUR
628, Unibic Milk Cookies 500 g , 160.00 ,76.00,None,None,UNIBIC
629, Ram Bandhu Mixed Pickle 1 kg , 260.00 ,130.00,None,None,RAM BANDHU
630, Britannia NutriChoice Hi-Fibre Digestive Biscuits 150 g , 50.00 ,46.00,None,None,BRITANNIA
631, Wrigley's Doublemint Peppermint Classic Gum 13 g ,10.00,10.00,None,None,WRIGLEY'S
632, Cadbury Fuse Chocolate bar 45 g , 40.00 ,36.00,None,None,CADBURY
633," 90's mill Mixture Namkeen, Homemade and Ready to Eat, Spicy Namkeen, Namkeen And Snacks, 300GM ", 599.00 ,225.00,None,None,90'S MILL
634, Trimurti King's Premium Frozen Sweet Corn 1 kg , 200.00 ,110.00,None,None,TRIMURTI KINGS
635, Alpino Chocolate Peanut Butter Smooth 1 KG , 479.00 ,359.00,None,None,ALPINO
636, Cornitos Peri Peri Nacho Crisps 55 g , 35.00 ,28.00,None,None,CORNITOS
637," Taste Good Karela Biscuits High Fiber, Tasty and Healthy Sugar Free Snacks, 400 g - Pack of 4 ", 208.00 ,177.00,None,None,TASTE GOOD
638, Wingreens Farms Cheesy Sauce 450 g , 199.00 ,87.00,None,None,WINGREENS FARMS
639, Haldiram Bhujiawala Bhujia Namkeen Snacks For Satisfying Hunger- 800 gm , 300.00 ,199.00,None,None,HALDIRAM BHUJIAWALA
640, Snac tac Instant Tomato Soup 13 g , 15.00 ,7.00,None,None,SNACTAC
641, Ching's Secret Sweet Corn Veg Instant Soup 13 g ,10.00,10.00,None,None,CHING'S SECRET
642, Haldiram's Nagpur Moong Dal 200 g , 55.00 ,48.00,None,None,HALDIRAM’S NAGPUR
643, Bikaji Tana Tan Aloo Bhujia 200 g , 60.00 ,49.00,None,None,BIKAJI
644," Aakash Namkeen Ratlami Sev With Kali Mirch, Ajwain And Laung 900g ",260.00,260.00,None,None,AAKASH NAMKEEN
645, Knorr International Mexican Tomato Corn Soup 50 g , 70.00 ,50.00,None,None,KNORR
646," Yogabar Fruit & Nut Muesli 700g | Healthy Protein Breakfast Cereal | Added Cranberry & Apricot with Seeds, Dry Fruits & Whole Grains | High in Iron & Fiber | 100%Vegan & No Preservatives ", 499.00 ,349.00,None,None,YOGABAR
647, Dukes Creme 4 Fun Cream Biscuits 450 g (Pack of 3) ,70.00,70.00,None,None,DUKES
648, LuvIt Loca Chocolate Caramel with Nougat Bars| Pack of 2 - 815 g Each , 840.00 ,648.00,None,None,LUVIT
649, Sams Tomato Ketchup 1 kg , 140.00 ,70.00,None,None,SAMS
650, KOPIKO Cappuccino Coffee Candy - World's No 1 Coffee Candy - Pocket Pack -504g (24+1 Units X 6 Pieces in Each)(Pack of 1 ) ,240.00,240.00,None,None,KOPIKO
651," Nutella Hazelnut Spread, 350 Gm Imported ", 453.75 ,375.00, Imported ,None,NUTELLA
652, Act II Golden Sizzle Instant Popcorn 90 g , 36.00 ,33.00,None,None,ACT II
653, Lal Sweets Diwali Special Royal Delight 400g || Made With Fresh Cashew Nuts||Pure Desi Ghee Mysore Pak||Kaju Mithai || Diwali Sweets || Diwali Gift , 750.00 ,399.00,None,None,LAL
654, Polo Mint 2B Rings 12 g ,5.00,5.00,None,None,POLO
655, Top Ramen New Masala Instant Noodles 480 g , 108.00 ,73.00,None,None,TOP RAMEN
656, Hershey's Exotic Dark Blueberry & Acai Flavoured Center Chocolate 100 g , 160.00 ,106.00,None,None,BROOKSIDE
657, Pickwick Strawberry Creamy Wafer Biscuits 75 g , 60.00 ,30.00,None,None,PICKWICK
658, Haldiram's Nagpur Bhel Puri 150 g , 60.00 ,55.00,None,None,HALDIRAM’S NAGPUR
659, Punjabi Ghasitaram Halwai Holi Special Sugarfree Dryfruit NutKhut Mithai Box (200gms) , 499.00 ,407.00,None,None,GHASITARAM'S
660, Safal Frozen Sweet Corn 500 g , 100.00 ,76.00,None,None,SAFAL
661, LuvIt Luscious Dark Love Delights-Heart Shaped Dark Chocolate| Pack of 2 - 180g Each , 600.00 ,288.00,None,None,LUVIT
662, Cadbury Chocobakes Cookies 12.5 g (Pack of 12) , 80.00 ,74.00,None,None,CADBURY
663," BTW Dodha Special Barfi (Burfi, Indian Mithai / Sweets Gift Pack / Box) Festive Gift Box 200g ", 250.00 ,220.00,None,None,BTW
664," LuvIt Choco Spread | Smooth & Delicious | Made with Cocoa | Best for Chocolate Bread, Cakes, Shakes, Dosa, Roti | Pack of 5 - 310g Each "," 1,245.00 ",529.00,None,None,LUVIT
665, Lal Sweets Diwali Special Kaju Katli 200g ( Pack Of 1) | | Pure Desi Ghee| | Sweets| | Kaju burfi| | Diwali Sweets Box || Sweets Gift , 449.00 ,249.00,None,None,LAL
666, Lawrence Mills Corn Flakes 500 g , 135.00 ,99.00,None,None,LAWRENCE MILLS
667, McCain Chilli Garlic Potato Bites 420 g , 150.00 ,135.00,None,None,MCCAIN
668, Cadbury Dairy Milk Fruit & Nut Chocolate 80 g , 90.00 ,83.00,None,None,CADBURY
669," Cadbury Dairy Milk Milk Chocolate, 160 Gm ", 340.00 ,280.00, Imported ,None,CADBURY
670, Act II Butter Lover's Microwave Popcorn 33 g , 27.00 ,25.00,None,None,ACT II
671, Safal Frozen Green Peas 1 kg , 240.00 ,135.00,None,None,SAFAL
672," HF, Surya 400gm Coconut Soan Papdi, with real Coconut (Pack of 2; 200gm x 2) |Indian Sweet |Coconut Flavoured ", 200.00 ,149.00,None,None,"HF, SURYA"
673, Kissan Creamy Peanut Butter 350 g , 175.00 ,135.00,None,None,KISSAN
674, Sunfeast Dark Fantasy Bourbon Chocolate Cream Biscuits 150 g (Buy 3 Get 1 Extra) ,90.00,90.00,None,None,SUNFEAST
675, Cornitos Sweet Chili Nacho Crisps 75 g , 50.00 ,33.00,None,None,CORNITOS
676, Pringles South African Style Peri Peri Potato Crisps 107 g , 115.00 ,105.00,None,None,PRINGLES
677, ITC Master Chef Veggie Pizza Pocket 340 g , 190.00 ,171.00,None,None,ITC MASTER CHEF
678," HF, Surya 400gm Orange Soan Papdi |Best Indian Sweet ", 200.00 ,149.00,None,None,"HF, SURYA"
679, Snickers Peanut Chocolate 22 g , 20.00 ,18.00,None,None,SNICKERS
680, McVitie's HobNobs Oats Biscuits 153.85 g , 65.00 ,43.00,None,None,MCVITIE'S
681, Hershey's Kisses Milk Chocolate 108 g , 140.00 ,112.00,None,None,HERSHEY'S
682, Bikaji Kuch Kuch All In One Mixture 200 g , 60.00 ,49.00,None,None,BIKAJI
683," Uttam Soan Papdi 400 g (Pack of 2 ), Ready to Eat ", 260.00 ,206.00,None,None,UTTAM
684," Ghotaram Farali Chiwda/Upwas, Vrat, Fast Mixture Namkeen/Aloo Lachha Mungfali Sabudana Mix/Farali/Falhari Potato Mixture PHALHARI CHIWDA Farsan with Goodness Of Black Pepper-150g*2Pack ", 499.00 ,234.00,None,None,GHOTARAM
685, Parle Kaccha Mango Bite Candy 198 g , 50.00 ,46.00,None,None,KACCHA MANGO
686," Haldiram's Nagpur Peda Combo Pack (Rajasthani Peda, Kesar Peda, Mathura Peda, Special Malai Peda) 250g x 4 ",755.00,755.00,None,None,HALDIRAM'S NAGPUR
687, Top Ramen Fiery Chilli Noodles 240 g , 60.00 ,55.00,None,None,TOP RAMEN
688, Chheda's Tomato Banana Chips 170 g , 75.00 ,50.00,None,None,CHHEDA'S
689, Yogabar Rolled Oats 400g | Healthy Protein Food & Breakfast Cereal | Premium Golden 100% Rolled Oats | Gluten Free Oatmeal | High in Iron & Fibre | 100%Vegan & No Preservatives , 199.00 ,149.00,None,None,YOGABAR
690, Velvet Fine Chocolates Diwali Gift Hamper with Premium Chocolates with Designer Diya , 799.00 ,499.00,None,None,VELVET FINE CHOCOLATES
691, Laxmi Narayan Chiwda 500 g , 216.00 ,194.00,None,None,LAXMINARAYAN
692," Shrego Khari Sing Premium Roasted Salted Peanut, Snack & Namkeen, 360G (2X180G Vacuum Packed) ", 198.00 ,195.00,None,None,SHREGO
693, Yummiez Veg Cheese Fingers 400 g , 250.00 ,160.00,None,None,YUMMIEZ
694, Haldiram's Nagpur Ratlami Sev 150 g , 47.00 ,43.00,None,None,HALDIRAM’S NAGPUR
695, Yogabar Rolled Oats | Healthy Protein Food & Breakfast Cereal | Premium Golden 100% Rolled Oats | Gluten Free Oatmeal | High in Iron & Fibre | 1kg Jar & 1kg Refill Pack | 100%Vegan & No Preservatives , 980.00 ,490.00,None,None,YOGABAR
696, Kissan Fresh Tomato Ketchup 200 g , 65.00 ,60.00,None,None,KISSAN
697," HF, SURYA 800gm SOAN PAPDI (PACK OF 4; 200gm x 4) |FLAVOURED WITH CARDAMOM |Indian Sweet ", 400.00 ,229.00,None,None,"HF, SURYA"
698, Snac tac Plain Vermicelli 450 g , 46.00 ,41.00,None,None,SNACTAC
699, Veeba Eggless Mayonnaise 250 g , 89.00 ,69.00,None,None,VEEBA
700, Del Monte Food Craft Fusilli Pasta 450 g , 160.00 ,80.00,None,None,DEL MONTE
701, Mother's Recipe Moong Papad 200 g , 70.00 ,63.00,None,None,MOTHER'S RECIPE
702, Act II Classic Salted Popcorn 60 g (3 pcs) , 60.00 ,49.00,None,None,ACT II
703, Hellmann's Real Mayonnaise 250 g , 90.00 ,80.00,None,None,HELLMANN'S
704, Bambino Premium Gulab Jamun Tin 1 Kg , 250.00 ,210.00,None,None,BAMBINO
705, Haldiram's Motichoor Ladoo 200 g X 1 Box , 304.00 ,243.00,None,None,"HALDIRAM""S BHUJIA (DE.)"
706, Crave Eatables Bachubhai's Kala Jamun 1 kg , 279.00 ,139.00,None,None,CRAVE EATABLES BACHUBHAI'S
707, McVitie's Ginger Cookies 120 g , 50.00 ,25.00,None,None,MCVITIE'S
708," ANP BEE Raw Unpasteurized Pure Honey 1Kg Pack I 100% Pure, NMR Tested, Pure Natural Original Honey I Unprocessed and Unfiltered Honey ", 475.00 ,305.00,None,None,ANP BEE TM
709, MANOHARLAL AGRA PAN PETHA , 500.00 ,299.00,None,None,MANOHAR LAL DAULAT RAM GARG
710, Kissan Fresh Tomato Ketchup 2 kg Pouch with small stainless steel spoon and bowl , 530.00 ,449.00,None,None,KISSAN
711, Haldiram's Nagpur Salted Peanuts 200 g , 55.00 ,51.00,None,None,HALDIRAM’S NAGPUR
712, Easy Fun Meetha & Namkeen Mazzaa Gift Pack , 700.00 ,350.00,None,None,EASYFUN
713, LuvIt Chocorich Classic Eclairs Chocolate | Birthday Party Pack | Pack of 2 - 390g Each , 300.00 ,249.00,None,None,LUVIT
714, Haldiram's Nagpur Mixture 200 g , 45.00 ,41.00,None,None,HALDIRAM’S NAGPUR
715, Easy Fun Navratan Mixture Namkeen 1kg , 410.00 ,220.00,None,None,EASYFUN
716, Indiyum Soan Papdi 400g , 240.00 ,147.00,None,None,INDIYUM
717," GHASITARAM'S Traditional Mysore Pak For Every Occasions like Diwali, Holi, Bhai Dooj Etc. (200g) ",245.00,245.00,None,None,GHASITARAM'S
718, Top Ramen New Masala Instant Noodles 240 g , 53.00 ,49.00,None,None,TOP RAMEN
719, Malkist Cheese Flavoured Cracker Biscuits (family pack) - 144g (Pack of 8 ) With Cash Back Offer ,480.00,480.00,None,None,MALKIST
720," Kesar Sweets | Assorted Indian Sweets Gift Pack for All Occasions - 1000 g Handmade Sweets - Pure Desi Ghee Indian Mithai, Sweets Mithai Gifts Box, Fresh Sweets for Family, Friends & Staff "," 1,250.00 ",999.00,None,None,KESAR
721, Safal Frozen Green Peas 500 g , 135.00 ,105.00,None,None,SAFAL
722," 90's mill Mini Samosa Namkeen Tasty Crispy Samosa Delightful Ready to Eat Snacks , 300gm ", 699.00 ,215.00,None,None,90'S MILL
723, Center Fresh Xtra Gum 20 g ,10.00,10.00,None,None,PERFETTI
724," Nutella Hazelnut Spread, 750 Gm Imported ", 852.50 ,720.00, Imported ,None,NUTELLA
725, Sunfeast Glucose Biscuits 96 g ,10.00,10.00,None,None,SUNFEAST
726, APLENTY Raw Peanut (Whole) | Groundnut | Moongfali | Mungfali Dana 200G , 299.00 ,179.00,None,None,APLENTY
727," Galaxy Cookie Crumble Milk Chocolate Bar, 100% Cashback, 50g, (Pack of 8) ", 640.00 ,467.00,None,None,GALAXY
728, Bounty Coconut Miniatures Chocolate Pack Coconut Filled Chocolates 17 Treats Inside 170g (Pack of 3) , 597.00 ,414.00,None,None,BOUNTY
729, Weikfield Penne Pasta 400 g , 175.00 ,87.00,None,None,WEIKFIELD
730, Britannia Good Day Butter Cookies 150 g , 25.00 ,23.00,None,None,GOOD DAY
731, Hyfun French Fries 425 g , 120.00 ,80.00,None,None,HYFUN
732, Boomer Strawberry Bubblegum 18.6 g ,10.00,10.00,None,None,BOOMER
733, Dabur Hommade Schezwan Chutney 250 g , 110.00 ,55.00,None,None,DABUR HOMMADE
734, Desi Ghee Atta Biscuits | Premium Handmade Cookies | 100% Pure Desi Ghee Used | 300 Gram , 170.00 ,162.00,None,None,MIDBREAK
735, Kellogg's Chocos Crunchy Bites 375 g , 205.00 ,190.00,None,None,KELLOGG'S
736, ITC Master Chef Crispy French Fries 420 g , 120.00 ,102.00,None,None,ITC MASTER CHEF
737, Baidyanath Honey 1 kg , 475.00 ,237.00,None,None,BAIDYANATH
738, Britannia Good Day Chocochip Cookies 100 g , 30.00 ,27.00,None,None,BRITANNIA
739," Leonz Dark Choco Chips Premium for Decoration of Cakes, Ice Creams 100g (Pack of 2) ", 170.00 ,153.00,None,None,LEONZ
740, Bikano Khatta Meetha 1 kg , 272.00 ,192.00,None,None,BIKANO
741, Ferrero Rocher Chocolate 100 g , 299.00 ,224.00,None,None,FERRERO ROCHER
742, Ram Bandhu Punjabi Papad 200 g , 96.00 ,48.00,None,None,RAM BANDHU
743, Bagrry's Crunchy Almonds Raisins & Honey Muesli 750 g , 490.00 ,299.00,None,None,BAGRRY'S
744," Snickers Peanut Filled Milk Chocolate Bar, 22g (Pack of 24) ", 480.00 ,360.00,None,None,SNICKERS
745, KitKat Share and Snap Chocolate 57 g , 50.00 ,46.00,None,None,KIT KAT
746," Kesar Sweets| Boondi Ladoo| Indian Sweets Mithai| Boondi Laddu - 400gm, Pure Desi Ghee Mithai, Homemade Sweets Gifts Pack for Family, Friends & Staff ", 654.00 ,379.00,None,None,KESAR
747, Sunfeast Dark Fantasy Expressions Choco Cookies Collection 318 g , 225.00 ,112.00,None,None,SUNFEAST
748, LuvIt Goodies Chocolates Assorted Gift Pack for Diwali Celebration| Pack of 5 - 127.9g Each , 500.00 ,470.00,None,None,LUVIT
749, Chef's Basket Durum Wheat Penne Pasta 500 g , 175.00 ,87.00,None,None,CHEF'S BASKET
750," Red cliff Premium Kaju Katli (Sweets, Indian Mithai) (Kaju Katli| |200g| ", 599.00 ,249.00,None,None,RED CLIFF
751, Shree Misthan Dry Fruit Besan Ladoo 400g (200g X 2) , 320.00 ,199.00,None,None,SHREE MISTHAN
752, Cadbury Dairy Milk Silk Mousse Chocolate 50 g , 85.00 ,79.00,None,None,CADBURY
753, Bikaji Sub Kuch Navratna Mixture 200 g , 60.00 ,49.00,None,None,BIKAJI
754, SAMS White Cooking Vinegar 190 ml , 35.00 ,17.00,None,None,SAMS
755," GHASITARAM'S Tasty And Healthy Soan Papdi(Orange), Indian Dessert Soft Flaky Sweets, Indian Sweets, For Every Occasion (250g) ", 175.00 ,166.00,None,None,GHASITARAM'S
756, Yummiez Cheese Corn Nuggets 400 g , 250.00 ,160.00,None,None,YUMMIEZ
757, Mother's Recipe Potato Papad 70 g , 34.00 ,30.00,None,None,MOTHER'S RECIPE
758, Cadbury Dairy Milk Silk Hazelnut Chocolate 143 g , 185.00 ,172.00,None,None,CADBURY
759, Lijjat Mini Udad Papad 200 g , 77.00 ,60.00,None,None,LIJJAT
760, GHASITARAM'S Indian Cuisine Healthy & Tasty Kaju Katli | Kaju Barfi - Delicious Sweets Gift For Every Occasion | Ready With Pure & Natural Ingredients (400g) , 660.00 ,500.00,None,None,GHASITARAM'S
761, Nature Prime Phool Makhana 1kg ," 1,499.00 ",699.00,None,None,NATURE PRIME
762, Tata Soulfull Masala Oats+ Mast Masala 500 g , 239.00 ,164.00,None,None,SOULFULL
763, Ching's Secret Mix Vegetable Instant Soup 12 g ,10.00,10.00,None,None,CHING'S SECRET
764, McCain Chilli Garlic Potato Bites 1.24 Kg , 390.00 ,351.00,None,None,MCCAIN
765, Sunfeast Yippee Power Up Masala Instant Atta Noodles 70 g , 24.00 ,22.00,None,None,SUNFEAST
766, Parle Platina Nutricrunch Lite Crackers 200 g , 30.00 ,27.00,None,None,PARLE
767, Ambriona Dark Chocolate with Blueberry (70% Cocoa) | Vegan and Gluten Free | Daarzel chocolate bar | , 185.00 ,149.00,None,None,DAARZEL
768, Indiyum Besan Laddu 400g (200g X 2) , 300.00 ,189.00,None,None,INDIYUM
769, Alpenliebe Guava Just Jelly 166.5 g , 50.00 ,45.00,None,None,ALPENLIEBE
770, LaxmiNarayan Best Chiwda 250 g , 108.00 ,100.00,None,None,LAXMINARAYAN
771," Denali Foods Dark Chocolate Compound Slab| Decoration for cakes, muffins, mousse| 400g ", 230.00 ,185.00,None,None,LOVEJOY
772," Cadbury Dairy Milk Daim Chocolate Bar, 120 Gm ", 343.75 ,250.00, Imported ,None,CADBURY
773, True Elements No Added Sugar Muesli 1.2kg , 835.00 ,484.00,None,None,TRUE ELEMENTS
774, Dukes Bourbon Premium Sandwich Biscuits 405 g (Buy 3 Get 2) ,108.00,108.00,None,None,DUKES
775, Hyfun Aloo Tikki 400 g , 100.00 ,80.00,None,None,HYFUN
776, Hersheys Cocoa Powder 70 g (Pet) , 105.00 ,97.00,None,None,HERSHEY'S
777," GHASITARAM'S Pure Chum Chum Tin, For Every Indian Traditional Festival, Indian Mithai, Famous Indian Sweets(500g) ", 350.00 ,225.00,None,None,GHASITARAM'S
778, Bhujialalji Navratan Mixture | Indian Tea Time Fresh & Healthy Snack Mixture | Ready to eat | No Preservatives | Crsipy & Light snacks | (pack of 1) 1kg. , 280.00 ,199.00,None,None,BHUJIALALJI
779, Pillsbury Vanilla Custard Powder 100 g , 44.00 ,22.00,None,None,PILLSBURY
780, Kellogg's Corn Flakes With Real Strawberry Puree 300 g , 175.00 ,162.00,None,None,KELLOGG'S
781, Oasis Baklawa Handmade Baklawa Sweets Box 20.83 G (Each) 12 Pc l Handmade Sweets l Sweets l Homemade Sweets l Gifts l Indian Sweets l Traditional Sweets l Baklava l Baklava Sweets , 850.00 ,569.00,None,None,OASIS BAKLAWA
782, Kellogg's Chocos 125 g , 65.00 ,60.00,None,None,KELLOGG'S
783, Lal Sweets Milk Peda 400g Pack Of 1 || Made With Milk Solids ||Doodh Sweet || Doodh Peda || Indian Sweets , 599.00 ,349.00,None,None,LAL
784, Lijjat Pepper Udad Papad 1 kg , 366.00 ,329.00,None,None,LIJJAT
785, Fruit-tella Strawberry Toffee 36 g , 35.00 ,32.00,None,None,FRUITELLA
786, Parle Krack Jack Butter Masala Biscuits 100 g , 50.00 ,25.00,None,None,PARLE
787, Uncle Chipps Plain Salted Potato Chips 37 g , 20.00 ,18.00,None,None,UNCLE CHIPPS
788," 5:15PM Fresh Crispy Yellow Banana Wafers Chips 400g, Classic Salted Flavour ", 499.00 ,240.00,None,None,5:15PM
789, Yogabar Choco Cereal 345g | No Maida Chocos for Kids | Delicious Chocolate Chocos | Healthy Protein Food & Breakfast Cereal | 100%Vegan & No Preservatives , 260.00 ,199.00,None,None,YOGABAR
790, Ching's Secret Manchow Soup 55 g , 60.00 ,40.00,None,None,CHING'S SECRET
791, Bikaji Kuch-Kuch All In One Mixture 400 g , 120.00 ,99.00,None,None,BIKAJI
792, Desi Treat Soya Paneer (Tofu) 800g , 280.00 ,246.00,None,None,DESI TREAT
793, Mother's Recipe Punjabi Masala Papad 200 g , 82.00 ,74.00,None,None,MOTHER'S RECIPE
794, Parle Platina Hide & Seek Milano Centre Filled Cream Biscuits 75 g , 40.00 ,37.00,None,None,PARLE
795, RAAJALI Rice MURUKKU , 160.00 ,130.00,None,None,RAAJALI
796, Kissan Fresh Tomato Ketchup 500 g , 110.00 ,102.00,None,None,KISSAN
797," Yogabar Desi Masala Oats 400g | Healthy Snacks | Premium Oats | 3x more Vegetables, Pumpkin, Watermelon and Chia Seeds for Eating | Indian Spices | Gluten Free | Diet food for Weight Loss ", 199.00 ,149.00,None,None,YOGABAR
798, Galaxy Smooth Milk Chocolate 80 g (Pack of 8) , 99.00 ,92.00,None,None,GALAXY
799, Bambino Roasted Vermicelli 180 g , 30.00 ,27.00,None,None,BAMBINO
800, Maggi Hot & Sweet Tomato Chilli Sauce 200 g , 75.00 ,69.00,None,None,MAGGI
801, Taali Pudina Punch Protien Puffs 60 g , 59.00 ,39.00,None,None,TAALI
802," GHASITARAM'S Halwa,Perfect For Occasion Like Diwali,Rakshabandhan Etc (200g) ", 185.00 ,147.00,None,None,GHASITARAM'S
803, Haldiram Bhujiawala Moong Dal 800g | Namkeen Salty Flavour | Pack of 2 | 400 Grams Each , 260.00 ,240.00,None,None,HALDIRAM BHUJIAWALA
804, JOYTOSS One Pcs Chips Challenge NEW Pack (1) , 229.00 ,158.00,None,None,JOYTOSS
805, Britannia Good Day Pista Badam Cookies 200 g , 55.00 ,51.00,None,None,BRITANNIA
806, Yogabar Energy Bars Chocolate Chunk | Multigrain Daily Protein Snack | High Energy & Nutrition Bars | 8g Protein & 7g Fibre Protein bars | High in Iron & Fibre | Pack of 10 x 38g Energy Bars | 100%Vegan & No Preservatives , 400.00 ,299.00,None,None,YOGA BAR
807, Creamooz Tandoori Mayonnaise 1kg , 215.00 ,185.00,None,None,CREAMOOZ
808, Funfoods Burger Veg Mayonnaise 100 g , 45.00 ,41.00,None,None,FUNFOODS
809," Chocolate Celebrations Pack |Chocolate Gift for Diwali, Anniversary, Valentine's Day, Birthday, Christmas ", 379.00 ,259.00,None,None,SURPRISEFORU
810," Mars Twix Caramel Cookie Chocolate Bar, Premium Chocolate, 50g, Pack of 12 ", 840.00 ,539.00,None,None,MARS
811, Rajlaxmi Garlic Namkeen Mixture 400 g , 160.00 ,52.00,None,None,RAJLAXMI
812, Weikfield Double Action Baking Powder 50 g , 25.00 ,23.00,None,None,WEIKFIELD
813, Knorr Chinese Manchurian Gravy Mix 55 g , 60.00 ,50.00,None,None,KNORR
814, 9am Green Chilli Pickle Green Chilli Pickle 1kg , 170.00 ,141.00,None,None,9AM
815, Galaxy Smooth Milk Chocolate 20 g , 20.00 ,18.00,None,None,GALAXY
816, Lijjat Garlic Papad 200 g , 77.00 ,69.00,None,None,LIJJAT
817, Yogabar Dark Chocolate Peanut Butter 400g | Creamy & Chocolatey | Slow Roasted | Non-GMO Premium Peanuts , 294.00 ,199.00,None,None,YOGABAR
818, MTR Instant Rava Idli Mix 500 g , 130.00 ,86.00,None,None,MTR
819, 9am Assorted Sauces Combo Pack of 10 (Each - 90gm) + Eggless Mayonnaise Pack of 2 ( Each - 100gm) , 230.00 ,197.00,None,None,9 AM
820, MOMENT DELIGHTS HEART WAFFY TRUFFLES 3 PC , 120.00 ,76.00,None,None,MOMENT DELIGHTS
821, Center Fruit Chewing Gum 27.2 g ,10.00,10.00,None,None,CENTER FRUIT
822, Dabur Honey 50 g , 42.00 ,39.00,None,None,DABUR
823, Cadbury Dairy Milk Silk Hazelnut Chocolate 58 g , 130.00 ,120.00,None,None,CADBURY
